headline,date,web_url,doc_type,lead_paragraph,material_type,author,section,subsection,keywords
TECHNICAL TALKS BREAK OFF IN PARIS,1972-12-24,https://www.nytimes.com/1972/12/24/archives/technical-talks-break-off-in-paris.html,article,"PARIS, Dec. 23—A meeting of delegates who are assigned to discuss technical aspects of the Vietnam peace negotiations was adjourned abruptly today.",Archives,,Archives,,['Vietnam']
Hanoi Says Friedheim Lied,1972-12-24,https://www.nytimes.com/1972/12/24/archives/hanoi-says-friedheim-lied.html,article,"SAIGON, South Vietnam, Dec. 23 (AP)—The Hanoi radio said today that the American De fense Department spokesman, Jerry W. Friedheim, was lying when he said that American bombers were not targeting any areas in which the Penta gon believed that United States prisoners of war were being held.",Archives,,Archives,,['Vietnam']
"Saigon Still Demanding Hanoi Pullout, Aide Says",1972-12-24,https://www.nytimes.com/1972/12/24/archives/saigon-still-demanding-hanoi-pullout-aide-says.html,article,"SAIGON, South Vietnam, Dec. 23—Foreign Minister Tran Van Lam reiterated today his Gov ernment's demand that all North Vietnamese troops must be withdrawn from South Vietnam before a peace accord would be acceptable to Saigon.",Archives,By Fox Butterfield Special to The New York Times,Archives,,['Vietnam']
Bob Hope Performs For G.I.'s and Says It's His Final Tour.,1972-12-25,https://www.nytimes.com/1972/12/25/archives/bob-hope-performs-for-gis-and-says-its-his-final-tour.html,article,"SAIGON, South Vietnam, Dec. 24 — Bob Hope, a substitute Santa for two decades of G.I.'s, gave what he said was his last annual Christmas show in Viet nam today, adding that he had originally thought that he might be able to perform it in Hanoi for American prisoners. ",Archives,By Fox Butterfield Special to The New York Times,Archives,,"['Vietnam', 'Vietnam']"
Nixon Ignores Protesters,1972-12-25,https://www.nytimes.com/1972/12/25/archives/nixon-ignores-protesters.html,article,"KEY BISCAYNE, Fla., Dec. 24 (UPI)—President Nixon ig nored antiwar demonstrators outside his vacation home today and settled down for a quiet holiday with his wife. ",Archives,,Archives,,['Vietnam']
AT HOME ABROAD,1972-12-25,https://www.nytimes.com/1972/12/25/archives/good-will-to-men.html,article,"LONDON, Dec. 24—The only bless ing we can really hope for on Christ mas is self‐perception. Miracles are not to be expected: only the chance of seizing on the symbol of Christmas to look within and see who we are. That was what the Spirits did for Scrooge in done night. ",Archives,By Anthony Lewis,Archives,,['Vietnam']
TEMPORARY HALT IN RAIDS ON NORTH BY U.S. REPORTED,1972-12-25,https://www.nytimes.com/1972/12/25/archives/temporary-halt-in-raids-on-north-by-us-reported-length-of-lull-is-a.html,article,"SAIGON, South Vietnam, Monday, Dec. 25—Informed American military officers said this morning that the United States had at least temporarily halted the bombing of North Vietnam.",Archives,By Joseph B. Treaster Special to The New York Times,Archives,,['Vietnam']
Hanoi Is Reported Scarred But Key Services Continue,1972-12-25,https://www.nytimes.com/1972/12/25/archives/hanoi-is-reported-scarred-but-key-services-continue.html,article,"The following dispatch, which was delayed in trans mission, was written by Telford Taylor, professor of law at Columbia University, who is visiting Hanoi with group of Americans. Mr. Taylor, a retired brigadier gen eral, was chief prosecutor at the Nuremberg war crimes trials and is the author of several books, including “Nurem berg and Vietnam: An American Tragedy.”",Archives,,Archives,,"['Vietnam', 'Vietnam']"
Thuy Rejects Peace Talks While U.S. Raids Continue,1972-12-25,https://www.nytimes.com/1972/12/25/archives/thuy-rejects-peace-talks-while-us-raids-continue-hanoi-aide-says.html,article,"WASHINGTON, Dec. 24 — Xuan Thuy, North Vietnam's negotiator at the regular Paris talks on Vietnam, said in an interview made public today, that his Government would not resume negotiations with the United States as long as the Nixon Administration con tinued bombing north of the 20th Parallel.",Archives,By Bernard Gwertzman Special to The New York Times,Archives,,['Vietnam']
Christmas Eve Crowds Throng Central Saigon,1972-12-25,https://www.nytimes.com/1972/12/25/archives/christmas-eve-crowds-throng-central-saigon.html,article,"SAIGON, South Vietnam, Dec. 24 — For several hours this evening vehicular traffic was barred in the heart of Saigon as thousands of resi dents—young couples, fami lies with small children and swarms of teen‐age boys — strolled through the streets in their best clothes. ",Archives,,Archives,,['Vietnam']
TEMPORARY HALT IN RAIDS ON NORTH BY U.S. REPORTED,1972-12-25,https://www.nytimes.com/1972/12/25/archives/new-jersey-pages-temporary-halt-in-raids-on-north-by-us-reported.html,article,"SAIGON, South Vietnam, Monday, Dec. 25—Informed Anterican military officers said this morning that the United States had at least temporarily halted the bombing of North Vietnam. ",Archives,By Joseph B. Treaster Special to The New York Times,Archives,,[]
Spirit of Goodwill Ushers In Christmas,1972-12-25,https://www.nytimes.com/1972/12/25/archives/spirit-of-goodwill-ushers-in-christmas-christmas-is-ushered-in-here.html,article,"In city towers and shabby tenements, in light‐strung sub urban homes and in prisons, hospitals and churches across the metropolitan area, families and friends gathered on an overcast eve of Christmas last night to exchange gifts and thoughts of goodwill.",Archives,By Robert D. McFadden,Archives,,['Vietnam']
NEW JERSEY,1972-12-25,https://www.nytimes.com/1972/12/25/archives/new-jersey-pages-new-jersey-briefs.html,article,3 Killed When Car Overturns,Archives,,Archives,,['Vietnam']
Thieu Orders 93 Released,1972-12-25,https://www.nytimes.com/1972/12/25/archives/thieu-orders-93-released.html,article,"SAIGON, South Vietnam, Dec. 24 (UPI) — President Nguyen Van Thieu ordered the release of 93 convicts and commuted the sentences of 137 others in his annual Christmas clemency, message today, the Govern ment announced. None granted clemency were political pris oners. ",Archives,,Archives,,[]
Thuy Rejects Peace Talks While U.S. Raids Continue,1972-12-25,https://www.nytimes.com/1972/12/25/archives/new-jersey-pages-thuy-rejects-peace-talks-while-us-raids-continue.html,article,"WASHINGTON, Dec. 24 — Xuan Thuy, North Vietnam's negotiator at the regular. Paris talks on Vietnam, said in an interview made public today that his Government would not resume negotiations with the United States as long as the Nixon Administration con tinued bombing north of the 20th Parallel. ",Archives,By Bernard Gwertzman Special to The New York Times,Archives,,[]
PAUSE IN BOMBING OF NORTH VIETNAM SAID TO CONTINUE,1972-12-26,https://www.nytimes.com/1972/12/26/archives/new-jersey-pages-pause-in-bombing-of-north-vietnam-said-to-continue.html,article,"SAIGON, South Vietnam, Tuesday, Dec. 26 — Informed American military officers said early today that the pause in bombing of North Vietnam that began on Christmas eve re mained in effect past midnight. They added that they had re ceived no indication of when the air raids might be resumed.",Archives,By Joseph B. Treaster Special to The New York Times,Archives,,[]
IN THE NATION,1972-12-26,https://www.nytimes.com/1972/12/26/archives/shame-on-earth.html,article,"HAMLET, N. C., Dec. 25—The bar baric bombing we Americans are in ??ting on a faraway nation of Asia does not echo loudly here in this small Southern town, where few see the Eastern liberal press that President. Nixon so disdains. Television news on the local channel provides more of the natural devastation in Managua than of the American‐made havoc in Hanoi. ",Archives,By Tom Wicker,Archives,,['Vietnam']
U.S. RENEWS RAIDS IN NORTH VIETNAM AFTER LULL ENDS,1972-12-26,https://www.nytimes.com/1972/12/26/archives/us-renews-raids-in-north-vietnam-after-lull-ends-strikes-in-south.html,article,"SAIGON, South Vietnam, Tuesday, Dec. 26 — United States bombers resumed at tacks in North Vietnam above the 20th Parallel this afternoon after a 36‐hour suspension of strikes for Christmas, the United States command an nounced. ",Archives,,Archives,,['Vietnam']
Silent Protest in London,1972-12-26,https://www.nytimes.com/1972/12/26/archives/silent-protest-in-london.html,article,"LONDON, Dec. 25 (AP)— Two hundred legislators, cler ics, union leaders and actors lined the pavements outside the American Embassy in London today in silent protest against the renewed bombing. ",Archives,,Archives,,['Vietnam']
March in Berlin,1972-12-26,https://www.nytimes.com/1972/12/26/archives/march-in-berlin.html,article,"BERLIN, Dec. 25 (UN) — Several hundred demonstrators shouting “Nixon murderer” marched down the Kurfürsten damm, West Berlin's main street, today to protest United States policy in Vietnam. A police spokesman said five persons had been arrested for carrying stones. ",Archives,,Archives,,['Vietnam']
WAR PROTEST HELD NEAR WHITE HOUSE,1972-12-26,https://www.nytimes.com/1972/12/26/archives/war-protest-held-near-white-house-demonstrators-also-gather-at.html,article,"WASHINGTON, Dec. 25 (UPI) —Chanting “Stop the bomb ing, Lord,” about 200 people took Christmas communion in an interfaith service for peace today across the street from the White House. ",Archives,,Archives,,"['Vietnam', 'Vietnam']"
500 Hail Carrier on Return,1972-12-26,https://www.nytimes.com/1972/12/26/archives/500-hail-carrier-on-return.html,article,"LONG BEACH, Calif., Dec. 25 (UPI)—About 500 relatives and friends and one Santa Claus were on hand in the morning fog today to offer a holiday greeting to the men of the attack carrier U.S.S. Oki nawa, returning from a nine‐ month tour in the Western Pa cific and off Vietnam. ",Archives,,Archives,,[]
The Earlier Reports,1972-12-26,https://www.nytimes.com/1972/12/26/archives/the-earlier-reports-us-renews-raids-on-north-vietnam-as-lull-ends.html,article,"SAIGON, South Vietnam, Tuesday, Dec. 26 — Informed American military officers said early today that the pause in bombing of North Vietnam that began on Christmas Eve re mained in effect past midnight. ",Archives,By Joseph B. Treaster Special to The New York Times,Archives,,['Vietnam']
"American Force in Vietnam Now 24,200, a Drop of 700",1972-12-26,https://www.nytimes.com/1972/12/26/archives/american-force-in-vietnam-now-24200-a-drop-of-700.html,article,"SAIGON, South Vietnam, Dec. 25 (UPI) — American military strength in Vietnam declined to 24.200 last week, a drop of 700 men from the previous week and the lowest total in almost eight years, the United States command said today. ",Archives,,Archives,,['Vietnam']
Issue and Debate,1972-12-26,https://www.nytimes.com/1972/12/26/archives/efficacy-of-the-bombing-of-north-vietnam.html,article,"WASHINGTON, Dec. 25— The resumption of sustained bombing by the United States throughout North Vietnam has revived the debate here and abroad over the efficacy of the bombing strategy. ",Archives,By David E. Rosenbaum Special to The New York Times,Archives,,['Vietnam']
Hanoi Reports Heavy Toll,1972-12-26,https://www.nytimes.com/1972/12/26/archives/hanoi-reports-heavy-toll.html,article,"HANOI, North Vietnam, Dec. 25 (Agence France‐Presse) — The North Vietnamese press agency reported today that American planes killed or wounded thousands in the Hanoi and Haiphong raids be tween Dec. 18 and Dec. 24 and that 40,000 tons of bombs were dropped on North Vietnam. ",Archives,,Archives,,['Vietnam']
Jersey Leader Picketed,1972-12-26,https://www.nytimes.com/1972/12/26/archives/jersey-leader-picketed.html,article,"MOUNTAIN LAKES, N. J., Dec. 25 (AP)—The home of Harry L. Sears, the New Jersey campaign chairman for Mr. Nixon, was picketed here this morning by about 75 Morris County peace activists. ",Archives,,Archives,,['Vietnam']
Truce Violations Charged,1972-12-26,https://www.nytimes.com/1972/12/26/archives/truce-violations-charged.html,article,"SAIGON, Dec. 25 (AP)—The South Vietnamese command to day reported 58 violations dur ing overlapping 24‐hour cease fires set by the Vietcong and the Saigon Government. Each side blamed the other for the violations. ",Archives,,Archives,,['Vietnam']
Gus Hall Sees ‘Swindle’,1972-12-27,https://www.nytimes.com/1972/12/27/archives/gus-hall-sees-swindle.html,article,"Gus Hall, general secretary of the Communist Party, U.S.A., said yesterday that President Nixon was “guilty of political treachery without precedent” and “never intended to sign” the Vietnam peace agreement. The President's adviser, Henry A. Kissinger, added to Mr. Nix on's “swindle,” Mr. Hall de clared, when he said the North Vietnamese “wanted to change the agreement,” The Associated Press reported.",Archives,,Archives,,['Vietnam']
Notes on People,1972-12-27,https://www.nytimes.com/1972/12/27/archives/castro-tries-a-toboggan-ride.html,article,"Premier Fidel Castro of Cuba made one of his rare, as far as is known, toboggan rides. It happened in the snows of Gander, Newfound land, while the plane taking the Premier home from Mos cow was refueling. The Pre mier laughed as he fell off the toboggan. And, judging from photographs of the event, some of those in the area of the fall laughed, too. There was no indication whether Mr. Castro had any snow fun in Moscow, which he had just visited for the second time in 1972.",Archives,James F. Clarity,Archives,,['Vietnam']
NEW U.S. BOMBING ASSAILED BY HANOI,1972-12-27,https://www.nytimes.com/1972/12/27/archives/new-us-bombing-assailed-by-hanoi-but-paris-statement-hints-talks.html,article,"PARIS, Dec. 26—North Viet nam denounced today the re sumption of American bombing of Hanoi but indicated it was willing to resume negotiation if the attacks halted. ",Archives,,Archives,,['Vietnam']
Flight From Hanoi Canceled,1972-12-27,https://www.nytimes.com/1972/12/27/archives/flight-from-hanoi-canceled.html,article,"VIENTIANE, Laos, Dec. 26— A. flight to and from Hanoi scheduled today by the three‐ nation International Control Commission was canceled at the last moment because of a radio communication from the con trol tower at Hanoi's Gia Lam Airport, saying it would be un safe to land. ",Archives,,Archives,,['Vietnam']
U.S. SAYS BOMBING IS BACK AT LEVEL PRECEDING PAUSE,1972-12-27,https://www.nytimes.com/1972/12/27/archives/us-says-bombing-is-back-at-level-preceding-pause-warplanes-from.html,article,"SAIGON, South Vietnam, Wednesday, Dec. 27—With its 36‐hour pause in the bombing of North Vietnam ended, the United States command said yesterday that the planes were once again operating as they had last week, when the raids were the heaviest of the war. ",Archives,By Joseph B. Treaster Special to The New York Times,Archives,,['Vietnam']
‘And This Should Outrage the Conscience of All Americans’,1972-12-27,https://www.nytimes.com/1972/12/27/archives/-and-this-should-outrage-the-conscience-of-all-americans.html,article,"WASHINGTON—In recent weeks President Nixon has had another op portunity to end the Indochina tragedy and accomplish the return of our pris oners of war — on a basis which would have had the support and praise of all Americans. But events suggest a return to the same old war. For we cannot read about the heavy bombing, the new targets, and the unprece dented loss of American pilots and planes, without a deep and despairing sense that peace is not at hand.",Archives,By Edward M. Kennedy,Archives,,['Vietnam']
Bombing and the Outlook for Business,1972-12-27,https://www.nytimes.com/1972/12/27/archives/bombing-and-the-outlook-for-business-economic-analysis.html,article,Economic Analysis,Archives,By Leonard Silk,Archives,,['Vietnam']
U.S. SAYS BOMBING IS BACK AT LEVEL PRECEDING PAUSE,1972-12-27,https://www.nytimes.com/1972/12/27/archives/us-says-bombing-is-back-at-level-preceding-pause.html,article,"SAIGON, South Vietnam, Wednesday, Dec. 27—With its 36‐hour pause in the bombing of North Vietnam ended, the United States command said yesterday that the planes were once again operating as they had last week, when the raids were the heaviest of the war. ",Archives,By Joseph B. Treaster Special to The New York Times,Archives,,[]
Raid on Hanoi Called Heaviest in War,1972-12-27,https://www.nytimes.com/1972/12/27/archives/raid-on-hanoi-called-heaviest-in-war.html,article,"HANOI, North Vietnam, Dec. 26 (Agence France‐Presse)— American bombers tonight con ducted the most violent air at tack on Hanoi since the begin ning of the war.",Archives,,Archives,,['Vietnam']
U.S. Calls Raids Major Effort,1972-12-27,https://www.nytimes.com/1972/12/27/archives/us-calls-raids-major-effort.html,article,"WASHINGTON, Dec. 26—A Pentagon spokesman said today the air war against Hanoi and Haiphong had resumed and “continues to be a very major effort.” ",Archives,,Archives,,['Vietnam']
WASHINGTON,1972-12-27,https://www.nytimes.com/1972/12/27/archives/power-without-pity.html,article,"WASHINGTON, Dec. 26—President Nixon has sent the bombers over North Vietnam again, but it is hard to see how this air war can go on for long at the present rate. ",Archives,By James Reston,Archives,,['Vietnam']
SWEDISH COMMENT BRINGS U.S. PROTEST,1972-12-27,https://www.nytimes.com/1972/12/27/archives/swedish-comment-brings-us-protest.html,article,"WASHINGTON, Dec. 26 (Reu ters)—The United States has strongly protested to Sweden over Premier Olof Palme's statement Saturday comparing the United States bombing of Hanoi to Nazi massacres in World War II, a State Depart ment spokesman said today. The Swedish Ambassador, Hu bert de Besche, was called to the department Saturday by Acting Secretary of State U. Alexis Johnson and was given the oral protest.",Archives,,Archives,,['Vietnam']
DA NANG BASE AREA IS HIT BY 35 ROCKETS,1972-12-27,https://www.nytimes.com/1972/12/27/archives/da-nang-base-area-is-hit-by-35-rockets.html,article,"SAIGON, Wednesday, Dec. 27 (UPI)—Communist gunners fired 35 rockets into the Ameri can‐Vietnamese air base at Da Nang and surrounding civilian areas just before dawn Monday. One American was slightly wounded and two Vietnamese civilians were killed. Five Amer ican helicopters were damaged or destroyed at the base, which is 370 miles north of Saigon. The attack was the first against the base since Dec. 3. ",Archives,,Archives,,['Vietnam']
What to Do?,1972-12-27,https://www.nytimes.com/1972/12/27/archives/what-to-do.html,article,"America's bombs sear through North Vietnam's cities and countryside again, perhaps even touching some of the camps where a tragically increasing company of American war prisoners sit helplessly. After a brief obeisance to Christmas, the spirit of war has re‐emerged untempered. Does the muted popular outcry against the renewed massive bombardments indicate that the Admin istration's grievous policy is having a grievous conse quence here at home: the apathetic withdrawal of con cerned citizens and their representatives in Congress into a mood of hopelessness and resignation? It needn't and mustn't be. ",Archives,,Archives,,['Vietnam']
Bengalis Burn U.S. Office To Protest Vietnam Bombing,1972-12-27,https://www.nytimes.com/1972/12/27/archives/bengalis-burn-us-office-to-protest-vietnam-bombing.html,article,"DACCA, Bangladesh, Dec. 26 (AP) — Students protesting against the bombing of North Vietnam set fire today to the United States Information Cen ter at Rajashahi, 90 miles north west of here, and caused con siderable damage. ",Archives,,Archives,,['Vietnam']
White House Is Silent,1972-12-27,https://www.nytimes.com/1972/12/27/archives/white-house-is-silent.html,article,"KEY BISCAYNE, Fla., Dec. 26 (AP)—The White House maintained silence on the re sumption of bombing attacks on North Vietnam today fol lowing the vain wait by Presi dent Nixon for a peace signal from Hanoi.",Archives,,Archives,,[]
Article 2 ‐‐ No Title,1972-12-28,https://www.nytimes.com/1972/12/28/archives/article-2-no-title.html,article,"SINGAPORE, Dec. 27 (Reu ters)—About 100 demonstra tors gathered outside the United States Embassy here today to protest the resumed American bombing of North Vietnam. ",Archives,,Archives,,['Vietnam']
On Resuming the Bombing,1972-12-28,https://www.nytimes.com/1972/12/28/archives/letter-to-the-editor-5-no-title.html,article,To the Editor:,Archives,(Prof.) Earl Miner,Archives,,['Vietnam']
U.S. LISTS TARGETS OF HEAVY ATTACKS IN NORTH VIETNAM,1972-12-28,https://www.nytimes.com/1972/12/28/archives/us-lists-targets-of-heavy-attacks-in-north-vietnam.html,article,"SAIGON, South Vietnam, Thursday, Dec. 28 — The United States military com mand, breaking a nine‐day si lence on damage inflicted in the intensive American air attacks against North Vietnam, listed nearly three dozen airfields, rail yards, power plants, supply depots and communications centers yesterday among the facilities that have been bombed. ",Archives,By Joseph B. Treaster Special to The New York Times,Archives,,[]
On Resuming the Bombing,1972-12-28,https://www.nytimes.com/1972/12/28/archives/letter-to-the-editor-2-no-title.html,article,To the Editor:,Archives,Margaret B. Morse,Archives,,['Vietnam']
AUSTRALIA HALTS SAIGON ARMS AID,1972-12-28,https://www.nytimes.com/1972/12/28/archives/australia-halts-saigon-arms-aid-nonmilitary-assistance-to-continue.html,article,"SYDNEY, Australia, Dec. 27 —Australia stopped military aid to South Vietnam today, ending the last vestige of this country's controversial partici pation in the Vietnam war.",Archives,By Robert Trumbull Special to The New York Times,Archives,,"['Vietnam', 'Vietnam', 'Vietnam']"
ALLIED PLANE KILLS 9 IN A BOMBING ERROR,1972-12-28,https://www.nytimes.com/1972/12/28/archives/allied-plane-kills-9-in-a-bombing-error.html,article,"SAIGON, South Vietnam, Dec. 27 (AP) — A South Viet namese F‐5 fighter‐bomber ac cidentally dropped a bomb in village 20 miles northeast of Saigon today, killing nine ci vilians and wounding 10, re ports from the area said. Six homes were reported destroyed.",Archives,,Archives,,['Vietnam']
U.S. to Seek Clarification,1972-12-28,https://www.nytimes.com/1972/12/28/archives/us-to-seek-clarification.html,article,"WASHINGTON, Dec. 27. (Reu ters) — State Department offi cials were taken by surprise to day by the Australian Govern ment's decision to halt military aid to South Vietnam. ",Archives,,Archives,,"['Vietnam', 'Vietnam']"
Poles List 4th Bomb Death,1972-12-28,https://www.nytimes.com/1972/12/28/archives/poles-list-4th-bomb-death.html,article,"WARSAW, Dec. 27 (AP) —A fourth Polish seaman has died in a Haiphong hospital as a result of injuries suffered in a United States air strike last week, the official Polish press agency said today. The Polish Government reported earlier that three Poles had been killed when their cargo ship, the Jo seph Conrad, was struck and sunk. ",Archives,,Archives,,['Vietnam']
The Longest War,1972-12-28,https://www.nytimes.com/1972/12/28/archives/the-longest-war.html,article,WASHINGTON—One of the primary reasons this tragic war continues is because a majority of the Congress has consistently refused to confront the executive branch with obvious in consistencies in its various statements about Vietnam. ,Archives,By Stuart Symington,Archives,,['Vietnam']
IN THE NATION,1972-12-28,https://www.nytimes.com/1972/12/28/archives/mr-truman-mr-nixon-and-the-press.html,article,"The late Harry S. Truman, who was anything but a cry‐baby like the pres ent incumbent of the White House, is famous for having said that “if you can't stand the heat, you better get out of the kitchen.” He also observed, almost jovially, that “whenever the press quits abusing me, I know I'm in the wrong pew.” That was in the middle of the 1948 campaign and Mr. Truman knew better than most that while the editorial writers and column ists were mostly against him, the front‐page headlines that reflected his “give 'em hell” style were working for him. ",Archives,By Tom Wicker,Archives,,['Vietnam']
"Speak Up, Mr. President",1972-12-28,https://www.nytimes.com/1972/12/28/archives/speak-up-mr-president.html,article,"Despite the communiqué tardily issued in Saigon yes terday, the Nixon Administration continues to evade the toughest and most pertinent questions about the mas sive new United States air assault against North Vietnam. ",Archives,,Archives,,['Vietnam']
On Resuming the Bombing,1972-12-28,https://www.nytimes.com/1972/12/28/archives/letter-to-the-editor-8-no-title.html,article,To the Editor:,Archives,Lester E. Waterbury,Archives,,['Vietnam']
Witness in Kitty Hawk Hearing Charges That Whites Beat Black Officer in October Rioting on Carrier,1972-12-28,https://www.nytimes.com/1972/12/28/archives/witness-in-kitty-hawk-hearing-charges-that-whites-beat-black.html,article,"SAN DIEGO, Dec. 27 — A black crewman of the aircraft carrier Kitty. Hawk testified at a Navy hearing today that he had seen white sailors knock down and beat the ship's executive officer during racial rioting aboard the carrier off the coast of Vietnam.",Archives,,Archives,,[]
VATICAN DENIES POPE SENT PLEA TO NIXON,1972-12-28,https://www.nytimes.com/1972/12/28/archives/vatican-denies-pope-sent-plea-to-nixon.html,article,"ROME, Dec. 27—Two leading Italian newspapers — Corriere Della Sera of Milan and Il Mes saggero of Rome—said today that Pope Paul VI was under stood to have sent a personal letter to President Nixon urging him to end the United States air strikes in North Vietnam. ",Archives,,Archives,,['Vietnam']
Article 1 ‐‐ No Title,1972-12-28,https://www.nytimes.com/1972/12/28/archives/article-1-no-title.html,article,"VIENNA, Dec. 27 (Reuters)— Demonstrators today daubed the entrance of a branch of the Bank of America here with red paint, protesting United States air raids on North Vietnam. ",Archives,,Archives,,['Vietnam']
