headline,date,web_url,doc_type,lead_paragraph,material_type,author,section,subsection,keywords
News Analysis,1972-12-20,https://www.nytimes.com/1972/12/20/archives/nixon-and-kissinger-and-the-collapse-of-the-paris-peace-talks.html,article,"WASHINGTON, Dec. 19—In the aftermath of the break down of the Paris negotiations, and the renewed bombing of Hanoi and Haiphong, some diplomats, officials and news men are wondering aloud whether any possible strains have developed between Presi dent Nixon and his chief nego tiator and foreign policy ad viser, Henry A, Kissinger. The speculation is based on both rea sonable deduc lions and inlangi ble evidence. The rumors have been magnified by the current con fusion in Washington about almost everything dealing with Vietnam. Despite Mr. Kissin ger's news conference on Saturday, there is uncertainty about the reasons for the col lapse of the Paris talks, and the brief White House an nouncement yesterday about the bombing fell short of an explanation of why it was or dered.",Archives,By Bernard Gwertzman Special to The New York Times,Archives,,['Vietnam']
Prices Decline on the Amex and O‐T‐C,1972-12-20,https://www.nytimes.com/1972/12/20/archives/prices-decline-on-the-amex-and-otc.html,article,The breakdown in the Viet nam peace talks announced on Saturday continued to have a depressing effect on prices on the American Stock Exchange and in the over‐the‐counter market yesterday.,Archives,,Archives,,['Vietnam']
Nixon Goal Held a ‘Fantasy’,1972-12-20,https://www.nytimes.com/1972/12/20/archives/new-jersey-pages-nixon-goal-held-a-fantasy-hanoi-terms-us-air.html,article,"HANOI, North Vietnam, Dec. 19—North Vietnam accused the United States today of premedi tated intensification of the Viet nam war and termed the action insane. ",Archives,,Archives,,[]
SHIPS POUND COAST,1972-12-20,https://www.nytimes.com/1972/12/20/archives/new-jersey-pages-ships-pound-coast-us-sources-report-third-big.html,article,"SAIGON, South Vietnam, Wednesday, Dec. 20—Two B‐52 heavy bombers and an F‐111 swing‐wing fighter‐bomber have been lost since the United States resumed full‐scale bomb ing of North Vietnam Monday, an American military spokes man said last night.",Archives,By Joseph B. Treaster Special to The New York Times,Archives,,[]
27th U.N. Assembly Ends; Results Prove to Be Mixed,1972-12-20,https://www.nytimes.com/1972/12/20/archives/27th-un-assembly-ends-results-prove-to-be-mixed.html,article,"UNITED NATIONS, N. Y., Dec. 19—The 27th annual ses sion of the General Assembly ended tonight with a mixed sense of accomplishment and failure. ",Archives,By Robert Alden Special to The New York Times,Archives,,['Vietnam']
Peking Pledges Support,1972-12-20,https://www.nytimes.com/1972/12/20/archives/new-jersey-pages-peking-pledges-support.html,article,"TOKYO, Dec. 19 (AP)— China's Acting President, Tung Pi‐wu, and Premier Chou En lai have promised the Vietcong that “so long as the United States does not stop its war of aggression, the Chinese people will, as always, resolutely sup port and assist the just struggle of the Vietnamese people.” ",Archives,,Archives,,[]
New U. S. Raids on North Are Denounced by Soviet,1972-12-20,https://www.nytimes.com/1972/12/20/archives/new-jersey-pages-new-us-raids-on-north-are-denounced-by-soviet.html,article,"MOSCOW, Dec. 19—The Soviet Government today de nounced the resumption of wide‐scale United States air raids over North Vietnam and said it was giving the develop ing situation its “most serious consideration.” ",Archives,By Theodore Shabad Special to The New York Times,Archives,,[]
Hanoi Displays 6 Prisoners,1972-12-20,https://www.nytimes.com/1972/12/20/archives/hanoi-displays-6-prisoners.html,article,"HANOI, North Vietnam, Dec. 19 (Agence France‐Presse)—Six United States airmen, sonic of whom were said to be crew, members of a B‐52 bomber, were presented to the press here today. They were said to have been captured last night. ",Archives,,Archives,,['Vietnam']
Hanoi Displays 6 Prisoners,1972-12-20,https://www.nytimes.com/1972/12/20/archives/new-jersey-pages-hanoi-displays-6-prisoners.html,article,"HANOI, North Vietnam, Dec. 19 (Agence France‐Presse)—Six United States airmen, some of whom were said to be crew members of a B‐52 bomber, were presented to the press here today. They were said to have been captured last night. ",Archives,,Archives,,[]
Hopes for Peace Dashed,1972-12-20,https://www.nytimes.com/1972/12/20/archives/new-jersey-pages-hopes-for-peace-dashed-in-saigon-us-gloom.html,article,"SAIGON, South Vietnam, Dec. 19—The United States bombs that fell on Hanoi and Haiphong today brought gloom to many American officials here and jubilation to members of the South Vietnamese Govern ment. ",Archives,By Sylvan Fox Special to The New York Times,Archives,,[]
CONTINUED TALKS EXPECTED BY U.S.,1972-12-20,https://www.nytimes.com/1972/12/20/archives/continued-talks-expected-by-us-technical-experts-are-to-meet-in.html,article,"WASHINGTON, Dec. 19— The White House said today that it expected low‐level tech nical talks on details of a set tlement in Vietnam to continue as scheduled this week in Paris despite the resumption of full scale bombing and mining of North Vietnam.",Archives,By Richard L. Madden Special to The New York Times,Archives,,['Vietnam']
2 SAILORS KILLED,1972-12-20,https://www.nytimes.com/1972/12/20/archives/2-sailors-killed-3-reported-wounded-15-airmen-missing-and-6-are.html,article,"SAIGON, South Vietnam, Wednesday, Dec. 20 — Three heavy B‐52 bombers and two smaller fighter‐bombers have been lost since the United States resumed full‐scale bomb ing and mining of North Viet nam Monday evening, an Amer ican military spokesman said today. ",Archives,By Joseph B. Treaster Special to The New York Times,Archives,,['Vietnam']
NEW JERSEY,1972-12-20,https://www.nytimes.com/1972/12/20/archives/new-jersey-pages-princeton-group-to-aid-activists-11-at-seminary.html,article,"PRINCETON, N.J., Dec. 19— A group of 11 students and fac ulty members of the Princeton Theological Seminary today es tablished a defense fund for five antiwar activists arrested yesterday for allegedly sabotag ing railroad equipment outside a defense plant in York, Pa. ",Archives,,Archives,,['Vietnam']
DOW INDEX DROPS 4.07 MORE POINTS,1972-12-20,https://www.nytimes.com/1972/12/20/archives/dow-index-drops-407-more-points-vietnam-bombing-renewal-contributes.html,article,The stock market sustained a second—and more modest— decline yesterday in the wake of the breakdown in Vietnam peace talks made public by American officials over the weekend.,Archives,By Vartanig G. Vartan,Archives,,['Vietnam']
Nixon and Kissinger and the Collapse of the Paris Peace Talks,1972-12-20,https://www.nytimes.com/1972/12/20/archives/new-jersey-pages-nixon-and-kissinger-and-the-collapse-of-the-paris.html,article,"WASHINGTON, Dec. 19—In the aftermath of the break down of the Paris negotiations, and the renewed bombing of Hanoi and Haiphong, some diplomats, officials and news men are wondering aloud whether any possible strains have developed between Presi dent Nixon and his chief nego tiator and foreign policy ad viser, Henry A. Kissinger. The speculation is based on both rea sonable deduc tions and intangi ble evidence. The rumors have been magnified by the current con fusion in Washington about almost everything dealing with Vietnam. Despite Mr. Kissin ger's news conference on Saturday, there is uncertainty about the reasons for the col lapse of the Paris talks, and the brief White House an nouncement yesterday about the bombing fell short of an explanation of why it was or dered.",Archives,By Bernard Gwertzman Special to The New York Times,Archives,,[]
Hanoi Reports 3 Ships Hit,1972-12-20,https://www.nytimes.com/1972/12/20/archives/hanoi-reports-3-ships-hit.html,article,"SAIGON, Wednesday, Dec. 20 (AP)—The Hanoi radio said to day that three American war ships were “set ablaze” Sunday night off the port city of Thanh, Hoa. ",Archives,,Archives,,['Vietnam']
New U.S. Raids on North Are Denounced by Soviet,1972-12-20,https://www.nytimes.com/1972/12/20/archives/new-us-raids-on-north-are-denounced-by-soviet.html,article,"MOSCOW, Dec. 19—The Soviet Government today de nounced the resumption of wide‐scale United States air raids over North Vietnam and said it was giving the develop ing situation its “most serious consideration.” ",Archives,By Theodore Shabad Special to The New York Times,Archives,,['Vietnam']
Hopes for Peace Dashed,1972-12-20,https://www.nytimes.com/1972/12/20/archives/hopes-for-peace-dashed-in-saigon-us-gloom-government-joy.html,article,"SAIGON, South Vietnam, Dec. 19—The United States bombs that fell on Hanoi and Haiphong today brought gloom to many American officials here and jubilation to members of the South Vietnamese Govern ment. ",Archives,By Sylvan Fox Special to The New York Times,Archives,,['Vietnam']
Other War Developments,1972-12-20,https://www.nytimes.com/1972/12/20/archives/front-page-1-no-title.html,article,"The Soviet Union denounced the resumption of heavy American bombing of North Vietnam but did so in statement whose tone appeared to reflect embarrassment among Soviet leaders at the latest turn of events. The statement, by Tass, the official press agency, said that the Soviet people demanded that the raids be halted promptly and that an agreement be quickly signed end the war. [Page 14.] ",Archives,,Archives,,[]
Nixon Goal Held a ‘Fantasy’,1972-12-20,https://www.nytimes.com/1972/12/20/archives/nixon-goal-held-a-fantasy-hanoi-terms-us-air-attacks-insane-action.html,article,"HANOI, North Vietnam, Dec. 19—North Vietnam accused the United States today of premedi tated intensification of the Viet nam war and termed the action insane. ",Archives,,Archives,,['Vietnam']
Back to the Stone Age,1972-12-20,https://www.nytimes.com/1972/12/20/archives/back-to-the-stone-age.html,article,"With the opportunity safely to disengage American military personnel and prisoners from the Vietnamese conflict now rapidly receding, President Nixon has resort ed once more to naked force to try to obtain his own larger objectives in Southeast Asia—objectives which are neither realistic nor essential to this country's secu rity interests. However much Hanoi may be responsible for disrupting the negotiations—which is a highly dis puted point—civilized man will be horrified at the re newed spectacle of the world's mightiest air force merci lessly pounding a small Asian nation in an abuse national power and disregard of humanitarian principles. ",Archives,,Archives,,['Vietnam']
Nixon's Sincerity Doubted,1972-12-20,https://www.nytimes.com/1972/12/20/archives/nixons-sincerity-doubted.html,article,"PARIS, Dec. 19—The Soviet Ambassador to France, de nouncing the renewed bombing, today questioned the sincerity of American peace pledges de livered during President Nix on's visit to Moscow in the spring. ",Archives,,Archives,,['Vietnam']
Thuy Statement Denied,1972-12-20,https://www.nytimes.com/1972/12/20/archives/new-jersey-pages-thuy-statement-denied.html,article,"WASHINGTON, Dec. 19 (Reuters)—The White House took issue today with the statement by Xuan Thuy, chief of the North Vietnamese dele gation in Paris that the United States had insisted on introduc ing 126 modifications to the tentative cease‐fire accord of Oct. 20. ",Archives,,Archives,,[]
Peking Pledges Support,1972-12-20,https://www.nytimes.com/1972/12/20/archives/peking-pledges-support.html,article,"TOKYO, Dec. 19 (AP) — China's Acting President, Tung Pi‐wu, and Premier Chou En lai have promised the Vietcong that “so long as the United States does not stop its war of aggression, the Chinese people will, as always, resolutely sup port and assist the just struggle of the Vietnamese people.” ",Archives,,Archives,,['Vietnam']
Hanoi Halts Technical Talks in Paris,1972-12-21,https://www.nytimes.com/1972/12/21/archives/hanoi-halts-technical-talks-in-paris.html,article,"PARIS, Dec. 20 — North Vi etnam today announced the “postponement” of further talks here with the United States on technical details of a Vietnam cease‐fire. ",Archives,By Flora Lewis Special to The New York Times,Archives,,[]
Concessions by Both Sides Reported Urged by Nixon,1972-12-21,https://www.nytimes.com/1972/12/21/archives/concessions-by-both-sides-reported-urged-by-nixon-nixon-is-reported.html,article,"SAIGON, South Vietnam, Thursday, Dec. 21—Official South Vietnamese sources said today that President Nixon had urged both North Vietnam and South Vietnam to make con cessions toward a peace settle ment. ",Archives,,Archives,,['Vietnam']
Is Prosperity at Hand?,1972-12-21,https://www.nytimes.com/1972/12/21/archives/is-prosperity-at-hand.html,article,"The stock market has registered its disappointment at fading hopes for an early peace settlement in Vietnam. In three days the Dow‐Jones industrial average has dropped more than 22 points, and now threatens to under the 1,000 mark it attained soon after President Nixon's re‐election.",Archives,,Archives,,['Vietnam']
Arrives in Vientiane,1972-12-21,https://www.nytimes.com/1972/12/21/archives/arrives-in-vientiane.html,article,"VIENTIANE, Laos, Dec. 20— General Haig spent an hour and 15 minutes with the Laotian Premier, Prince Souvanna Phou ma, today, briefing him on the impasse in the Paris peace negotiations. ",Archives,,Archives,,['Vietnam']
Hanoi Reports Casualties,1972-12-21,https://www.nytimes.com/1972/12/21/archives/hanoi-reports-casualties.html,article,"SAIGON, South Vietnam, Dec. 20 (AP) — The Hanoi radio reported today that 215 persons were killed and 325 were wounded in the North Vi etnamese capital in raids on Monday and yesterday. In Hai phong, it added, 45 persons were killed and 131 wounded on Monday. ",Archives,,Archives,,['Vietnam']
Senate Leaders Differ,1972-12-21,https://www.nytimes.com/1972/12/21/archives/senate-leaders-differ.html,article,"WASHINGTON, Dec. 20 (AP) —The Republican leader of the Senate said today that Presi dent Nixon's bombing decision should be supported, but his Democratic counterpart said that it would only prolong the war.",Archives,,Archives,,['Vietnam']
PENTAGON SAYS BOMBINGS WRECK MILITARY TARGETS; IT DENIES ‘TERROR’ RAIDS,1972-12-21,https://www.nytimes.com/1972/12/21/archives/pentagon-says-bombings-wreck-military-targets-it-denies-terror.html,article,"WASHINGTON, Dec. 20—The Defense Department said today that the intensive American bombing of North Vietnam in the last two clays had caused “very significant damage” to a broad range of military targets. ",Archives,By John W. Finney Special to The New York Times,Archives,,"['Vietnam', 'Vietnam']"
2 Airport Guards Shot,1972-12-21,https://www.nytimes.com/1972/12/21/archives/new-jersey-pages-2-airport-guards-shot.html,article,"A Vietnam veteran who had been confined for mental illness shot and wounded two Federal security officers yes terday at Kennedy Interna tional Airport before being captured, the police said. De tails on Page 70. ",Archives,,Archives,,[]
Stock Prices Off Again On Stalemate in Vietnam,1972-12-21,https://www.nytimes.com/1972/12/21/archives/stock-prices-off-again-on-stalemate-in-vietnam-big-board-prices.html,article,"Stock prices continued to decline yesterday in reaction to stalemated peace efforts and a resumption of full‐scale bombing and mining of North Vietnam. Statistically, the market was a virtual replay of Tuesday's performance. The Dow‐Jones industrial average slipped 4.36 points to 1,004.82 and declines outpaced ad vances on the New York Stock Exchange by a 9‐to‐5 ratio.",Archives,By Vartanig G. Vartan,Archives,,['Vietnam']
Much European Criticism,1972-12-21,https://www.nytimes.com/1972/12/21/archives/much-european-criticism.html,article,"LONDON, Dec. 20 (AP)— President Nixon's bombing de cision produced criticism today in much of Europe and espe cially in the Nordic countries. In Finland, where criticism of United States policies in Vietnam has been muted in the past, Foreign Minister Ahti Karjalainen declared: “It is es pecially difficult to understand on what arguments the vast bombardment of the North Vietnamese territory has been based.”",Archives,,Archives,,['Vietnam']
Polish Tell of Attack,1972-12-21,https://www.nytimes.com/1972/12/21/archives/polish-tell-of-attack.html,article,"WARSAW, Dec. 20 (Reuters) —A Polish freighter was sunk and three Polish seamen were killed in an American bombing attack on the North Vietnamese port of Haiphong today, the Polish press agency reported. ",Archives,,Archives,,"['Vietnam', 'Vietnam']"
Pope Deplores Bombing,1972-12-21,https://www.nytimes.com/1972/12/21/archives/pope-deplores-bombing.html,article,"ROME, Dec. 20—Pope Paul VI today deplored the resumption of United States bombing deep in North Vietnam and called for patient negotiations to seek peace. ",Archives,By Tom Wicker,Archives,,['Vietnam']
Concessions by Both Sides Reported Urged by Nixon,1972-12-21,https://www.nytimes.com/1972/12/21/archives/new-jersey-pages-concessions-by-both-sides-reported-urged-by-nixon.html,article,"SAIGON, South Vietnam, Thursday, Doc. 21—Official South Vietnamese sources said today that President Nixon had urged both North Vietnam and South Vietnam to make con cessions toward a peace settle ment. ",Archives,,Archives,,[]
HANOI iS BLAMED,1972-12-21,https://www.nytimes.com/1972/12/21/archives/new-jersey-pages-hanoi-is-blamed-lack-of-seriousness-at-paris-talks.html,article,"WASHINGTON, Dec. 20—The Defense Department said today that the intensive American bombing of North Vietnam in the last two days had caused “very significant damage” to a broad range of military targets.",Archives,By John W. Finney Special to The New York Times,Archives,,[]
U.S. REPORTS LOSS OF A FOURTH B‐52,1972-12-21,https://www.nytimes.com/1972/12/21/archives/us-reports-loss-of-a-fourth-b52-spokesman-says-crewmen-are-safe.html,article,"SAIGON, South Vietnam, Thursday, Dec. 21—A United States military spokesman dis closed this morning that a fourth B‐52 Stratofortress was struck by antiaircraft fire and crashed late last night as what is believed to be the heaviest bombing of the war apparently continued in North Vietnam. ",Archives,By Joseph B. Treaster Special to The New York Times,Archives,,"['Vietnam', 'Vietnam']"
"In Capitals, Bombing Draws Protests, Some Support",1972-12-21,https://www.nytimes.com/1972/12/21/archives/in-capitals-bombing-draws-protests-some-support.html,article,"As waves of American planes continued to sweep over North Vietnam, new protests were voiced in many parts of the world yesterday against Presi dent Nixon“s decision to re sume the heavy attacks, but there were also some expres sions of support. ",Archives,,Archives,,['Vietnam']
SAIGON REPORTS ON TWO BATTLES,1972-12-21,https://www.nytimes.com/1972/12/21/archives/saigon-reports-on-two-battles-enemy-deaths-put-at-154-in-quang-tri.html,article,"SAIGON, South Vietnam, Thursday, Dec. 21 (UPI) — Heavy ground fighting was re ported yesterday on South Viet nam's northernmost front, with two battles fought near Quang Tri city. ",Archives,,Archives,,['Vietnam']
Last of Australians Home From Vietnam To Muted Welcome,1972-12-21,https://www.nytimes.com/1972/12/21/archives/last-of-australians-home-from-vietnam-to-muted-welcome.html,article,"SYDNEY, Australia, Dec. 20 —The last Australian troops in Vietnam came home today to muted welcome, ending a 10‐ year commitment that had divided the nation. ",Archives,By Robert Trumbull Special to The New York Times,Archives,,"['Vietnam', 'Vietnam', 'Vietnam']"
Cambodia Endorses Move,1972-12-21,https://www.nytimes.com/1972/12/21/archives/cambodia-endorses-move.html,article,"Special to The New York TimesPHNOM PENH, Cambodia, Dec. 20—The Cambodian Gov ernment today endorsed the re sumption of full‐scale bombing of North Vietnam by the United States as a necessary step to force Hanoi to adopt a more conciliatory attitude at the negotiating table. ",Archives,,Archives,,['Vietnam']
Meets That Premier Today,1972-12-21,https://www.nytimes.com/1972/12/21/archives/meets-thai-premier-today.html,article,"BANGKOK, Thailand, Dec. 20 (AP)—General Haig arrived. in Bangkok from Vientiane to day.",Archives,,Archives,,['Vietnam']
Two Airport Guards at Kennedy Shot; Veteran Seized in Struggle on a Ramp,1972-12-21,https://www.nytimes.com/1972/12/21/archives/two-airport-guards-at-kennedy-shot-veteran-seized-in-struggle-on-a.html,article,"A Vietnam veteran who had twice fled Rockland State Hos pital after confinement for men tal illness shot and wounded two Federal security officers at Kennedy International Air port yesterday with a gun grabbed from one of the guards, the police reported. ",Archives,By Richard Witkin,Archives,,[]
By CRAIG R. WHITNEY,1972-12-21,https://www.nytimes.com/1972/12/21/archives/article-2-no-title.html,article,"SAIGON, South Vietnam, Dec. 20—Gen. Alexander M. Haig Jr. met for half an hour today with President Nguyen Van Thieu. It was General Haig's second meeting with Mr. Thieu since he arrived here yes terday.",Archives,,Archives,,['Vietnam']
Soviet Urges Speedy Truce,1972-12-21,https://www.nytimes.com/1972/12/21/archives/soviet-urges-speedy-truce.html,article,"MOSCOW, Dec. 20—The So viet Union reiterated today its call for a speedy signing by Washington of the cease‐fire accord negotiated in Paris last October. ",Archives,,Archives,,['Vietnam']
Administration Aides Insist That Hanoi Is Solely to Blame for Talk Breakdown,1972-12-21,https://www.nytimes.com/1972/12/21/archives/administration-aides-insist-that-hanoi-is-solely-to-blame-for-talk.html,article,"WASHINGTON, Dec. 20 — Administration officials insisted today that North Vietnam was entirely to blame for the break down in the Vietnam talks and said that the United States had resumed heavy bombing be cause of Hanoi's lack of “seri ousness” at the Paris negotiations. ",Archives,By Bernard Gwertzman Special to The New York Times,Archives,,"['Vietnam', 'Vietnam']"
2 Airport Guards Shot,1972-12-21,https://www.nytimes.com/1972/12/21/archives/2-airport-guards-shot.html,article,"A Vietnam veteran who had been confined for mental illness shot and wounded two Federal security officers yes terday at Kennedy Interna tional Airport before being captured, the police said. De tails on Page 70. ",Archives,,Archives,,[]
China Denounces Move,1972-12-21,https://www.nytimes.com/1972/12/21/archives/china-denounces-move.html,article,"PEKING, Dec. 20—China ac cused the United States today of having committed “a new barbarous crime” with its in tensified bombing of North Vietnam and declared that it would never succeed in impos ing peace terms unacceptable to Hanoi. ",Archives,,Archives,,[]
Harbor First Developed by French,1972-12-21,https://www.nytimes.com/1972/12/21/archives/harbor-first-developed-by-french.html,article,"Situated 60 miles southeast of Hanoi on the Cua Cam, an arm of the Thai Binh River, which flows into the Gulf of Tonkin, Haiphong is the principal port of North Vietnam and as such a target of vital importance. ",Archives,,Archives,,['Vietnam']
Cultural and Manufacturing Center,1972-12-21,https://www.nytimes.com/1972/12/21/archives/cultural-and-manufacturing-center.html,article,"Hanoi, which stands beside the Red River, is a port, railroad and industrial center whose population has in creased from 120,000 to about 500,000 in 30 years. ",Archives,,Archives,,['Vietnam']
Hanoi Charges Insolence,1972-12-22,https://www.nytimes.com/1972/12/22/archives/hanoi-charges-insolence.html,article,"SAIGON, South Vietnam, Dec. 21 (AP) — North Vietnam said tonight that it would not he intimidated by a reported ulti matum from President Nixon to sign a peace agreement or face continued heavy air and naval attacks.",Archives,,Archives,,['Vietnam']
11 IN CONGRESS URGE ANTIBOMBING STAND,1972-12-22,https://www.nytimes.com/1972/12/22/archives/11-in-congress-urge-antibombing-stand.html,article,"WASHINGTON, Dec. 21 (AP) —The House Democratic cau cus will he asked at its Jan. 2 meeting before the opening of the new Congress to go on record against the renewed bombing of North Vietnam, it was announced today. ",Archives,,Archives,,['Vietnam']
All‐Out Attack Reported,1972-12-22,https://www.nytimes.com/1972/12/22/archives/allout-attack-reported.html,article,"PHNOM PENH, Cambodia, Dec. 21 (Reuters)—The Cam bodian command said today that. North Vietnamese forces began an all‐out attack last night on Kompong Thom, the provincial capital 77 miles north of here that has been under siege since Dec. 7. ",Archives,,Archives,,[]
Excerpts From the Kremlin Address of Soviet Leader,1972-12-22,https://www.nytimes.com/1972/12/22/archives/excerpts-from-the-kremlin-address-of-soviet-leader.html,article,"MOSCOW, Dec. 21—Fol lowing, in official translation, are excerpts front an address by Leonid I. Brezhnev, the So viet Communist party leader, at a celebration in the Kremlin Hall of Congresses today in honor of the 50th anniversary of the formation of the Soviet Union: ",Archives,,Archives,,['Vietnam']
One American Died in War Last Week,1972-12-22,https://www.nytimes.com/1972/12/22/archives/one-american-died-in-war-last-week-six-were-hurt.html,article,"SAIGON, South Vietnam, Dec. 21 (AP)—The United States command announced today that one American was killed in ac tion and six were wounded in Indochina last week. ",Archives,,Archives,,['Vietnam']
Ground Action Light Except in the Region Around Quang Tri,1972-12-22,https://www.nytimes.com/1972/12/22/archives/ground-action-light-except-in-the-region-around-quang-tri.html,article,"SAIGON, South Vietnam, Fri day, Dec. 22 (AP)—Major fight ing reportedly continued yes terday in the northernmost part of South Vietnam, but elsewhere in the country, ac tion on the ground was said to he at a low level. ",Archives,,Archives,,['Vietnam']
