headline,date,web_url,doc_type,lead_paragraph,material_type,author,section,subsection,keywords
Notes on People,1972-08-08,https://www.nytimes.com/1972/08/08/archives/new-senator-sworn.html,article,"Taking the oath of office, Elaine Edwards of Louisiana became the 10th woman to bear the title of United States Senator. Then, Mrs. Ed wards, who was named to succeed the late Allen J. Ellen der by her husband, Gov. Edwin W. Edwards faced the press.",Archives,,Archives,,['Vietnam']
SUIT OPPOSING WAR REJECTED BY JUDGES,1972-08-08,https://www.nytimes.com/1972/08/08/archives/suit-opposing-war-rejected-by-judges.html,article,"PHILADELPHIA, Aug. 7 (AP) A special three‐judge Federal court turned down today a suit by peace activists who challenged the constitutionality of the Vietnam war and sought to cut off funding for it.",Archives,,Archives,,['Vietnam']
Saigon Reports Enemy Releases 7 Frenchmen,1972-08-08,https://www.nytimes.com/1972/08/08/archives/saigon-reports-enemy-releases-7-frenchmen.html,article,"SAIGON, South Vietnam, Tuesday, Aug. 8 (Reuters)— Seven Frenchmen, under stood to he employes of rub ber plantations, have been released after two months of captivity by Communist troops north of Saigon, it was reported today.",Archives,,Archives,,[]
Beauty Queens to Visit Bases,1972-08-08,https://www.nytimes.com/1972/08/08/archives/beauty-queens-to-visit-bases.html,article,"SAN FRANCISCO, Aug. 7 (AP)—Miss America and six other beauty queens left today on a 21‐day entertainment tour of United States military bases) in Southeast Asia after a news conference at which they sup ported President Nixon's Viet nam policy. Laurie Lea Schaefer, Miss America of 1972, told newsmen last night that Mr. Nixon's policies “have helped to retain the honor of the United States.”",Archives,,Archives,,['Vietnam']
"QUANGTRI REFUGEES SHELLED, U.S. SAYS",1972-08-08,https://www.nytimes.com/1972/08/08/archives/quangtri-refugees-shelled-us-says.html,article,"WASHINGTON, Aug. 7—The State Department said today that North Vietnamese forces had deliberately poured shells into columns of South Vietnam ese civilian refugees last April 29 and 30, resulting in the deaths of 1,000 to 2,000 civil ians.",Archives,,Archives,,['Vietnam']
Saigon Decree on Press Shuts 2 Opposition Papers,1972-08-08,https://www.nytimes.com/1972/08/08/archives/saigon-decree-on-press-shuts-2-opposition-papers.html,article,"SAIGON, South Vietnam, Tuesday, Aug. 8 (Reuters) Two opposition Saigon dailies have folded because of a new government crackdown on the press requiring heavy financial deposits from all newspapers, it was reported today.",Archives,,Archives,,"['Vietnam', 'Vietnam']"
"Latest Vietnam Withdrawal Leaves 44,600 U.S. Troops",1972-08-08,https://www.nytimes.com/1972/08/08/archives/latest-vietnam-withdrawal-leaves-44600-us-troops.html,article,"SAIGON, South Vietnam, Aug. 7 (AP)—American troop strength in South Vietnam was reduced by 1,400 men last week, to a total of 44,600, the United States command an nounced today.",Archives,,Archives,,['Vietnam']
Letters to the Editor,1972-08-09,https://www.nytimes.com/1972/08/09/archives/the-nonfeelers.html,article,To the Editor:,Archives,Maximilian Wolff,Archives,,['Vietnam']
Defensive D.A.'s,1972-08-09,https://www.nytimes.com/1972/08/09/archives/defensive-das.html,article,The reaction of New York City's District Attorneys to the Knapp Commission report on police corruption has been almost hysterical. It has also been disappoint ing. Typical was the forecast of Bronx District Attorney Burton Roberts that the report would so undermine public confidence in law enforcement as to provoke “anarchy the streets which will make Vietnam look like a picnic.” ,Archives,,Archives,,[]
Nixon's Acceptance Speech Will Signal Street Protests,1972-08-09,https://www.nytimes.com/1972/08/09/archives/nixons-acceptance-speech-will-signal-street-protests.html,article,"MIAMI BEACH, Aug. 8 (AP) —When President Nixon begins his acceptance speech inside convention hall, demonstrators will flood into the streets for “nonviolent civil disobedi ences,” according to the plan of the protest leaders. ",Archives,,Archives,,['Vietnam']
Mrs. Nixon Asserts Jane Fonda Should Have Bid Hanoi End War,1972-08-09,https://www.nytimes.com/1972/08/09/archives/mrs-nixon-asserts-jane-fonda-should-have-bid-hanoi-end-war.html,article,"WASHINGTON, Aug. 8 (UPI) —Mrs. Richard Nixon, criticiz ing Jane Fonda's charges of American bombing damage in North Vietnam, said today that the actress should have asked Hanoi “to stop their aggres sion,” ",Archives,,Archives,,['Vietnam']
BATTLE DEVELOPS TO EAST OF SAIGON,1972-08-09,https://www.nytimes.com/1972/08/09/archives/battle-develops-to-east-of-saigon-fight-17-miles-from-capital.html,article,"SAIGON, South Vietnam, Wednesday, Aug. 9—South Viet namese soldiers reportedly fought enemy forces in rubber plantations 17 miles east of Sai gon yesterday and early reports from the field said that Gov ernment casualties were heavy. ",Archives,,Archives,,['Vietnam']
Letters to the Editor,1972-08-09,https://www.nytimes.com/1972/08/09/archives/letter-to-the-editor-1-no-title.html,article,To the Editor:,Archives,James R. Bruce,Archives,,['Vietnam']
Letters to the Editor,1972-08-09,https://www.nytimes.com/1972/08/09/archives/dikes-and-bombs-which-side-is-telling-the-truth.html,article,To the Editor:,Archives,,Archives,,['Vietnam']
Ramsey Clark Describes Destruction in Haiphong,1972-08-09,https://www.nytimes.com/1972/08/09/archives/ramsey-clark-describes-destruction-in-haiphong.html,article,"TOKYO, Wednesday, Aug. 9 (AP)—The Hanoi radio quoted. Ramsey Clark today as having said that he had seen “massive destruction” in many parts of Haiphong and that many people must have been killed by American bombing. ",Archives,,Archives,,['Vietnam']
Napalmed Girl Recovering in Saigon,1972-08-09,https://www.nytimes.com/1972/08/09/archives/napalmed-girl-recovering-in-saigon.html,article,"SAIGON, South Vietnam, Aug. 8 (AP)—Two months after napalm dropped by a South Vietnamese plane sent Phan Thi Kim Phuc, who is 9 years old, screaming in pain and panic down a high way northwest of Saigon, she has nearly recovered from her burns. ",Archives,,Archives,,"['Vietnam', 'Vietnam']"
Bahrain and Emirates Given Seats at Nonaligned Parley,1972-08-10,https://www.nytimes.com/1972/08/10/archives/bahrain-and-emirates-given-seats-at-nonaligned-parley.html,article,"GEORGETOWN, Guyana, Aug. 9 (AP)—The Union of Arab Emirates and Bahrain, newly independent Persian Gulf countries, were admitted as participants in the conference of nonaligned nations here yes terday, but a bid from the Viet cong ran into resistance. The 64 countries attending the con ference admitted Oman, also on the Arabian peninsula, as an observer. ",Archives,,Archives,,['Vietnam']
Vietnamese Tell of Grim Life After Communists Came,1972-08-10,https://www.nytimes.com/1972/08/10/archives/vietnamese-tell-of-grim-life-after-communists-came-vietnamese.html,article,"BONGSON, South Vietnam, Aug. 6—“When the Commu nists came a lot of people here were very happy,” the bony jawed old farmer said bitterly. “Only now, people have had their eyes opened. The Com munists made nice speech es. But look at what happened.” ",Archives,By Joseph B. Treaster Special to The New York Times,Archives,,['Vietnam']
4 Vietnam Veterans Jailed In Florida Contempt Case,1972-08-10,https://www.nytimes.com/1972/08/10/archives/4-vietnam-veterans-jailed-in-florida-contempt-case.html,article,"TALLAHASSEE, Fla., Aug. 9 (AP)—Four Vietnam Veterans Against the War went to jail, today for refusing to answer, questions about alleged plans for violence at the national po litical conventions in Miamil Beach. ",Archives,,Archives,,['Vietnam']
Span in North Reported Hit,1972-08-10,https://www.nytimes.com/1972/08/10/archives/span-in-north-reported-hit.html,article,"SAIGON, Aug. 9 (AP)—United States F‐4 Phantom jets for the second time in three months knocked out the bridge at Thanhhoa in North Viet nam, the Seventh Air Force re ported today. ",Archives,,Archives,,['Vietnam']
100 Militiamen Reported Killed in Clash Near Saigon,1972-08-10,https://www.nytimes.com/1972/08/10/archives/100-militiamen-reported-killed-in-clash-near-saigon.html,article,"SAIGON, South Vietnam, Thursday, Aug. 10—Nearly 100 Government militiamen report edly have been killed or wound ed in clashes in the jungles and rubber plantations east of Saigon. ",Archives,By Malcolm W. Browne Special to The New York Times,Archives,,['Vietnam']
Big Raid on Town Charged,1972-08-10,https://www.nytimes.com/1972/08/10/archives/big-raid-on-town-charged.html,article,"PARIS, Aug. 9 (Reuters)— The North Vietnamese News Agency charged in a dispatch received here today that Ameri can bombers carried out an “extermination” raid yesterday on Haiduong, a town about 30 miles east of Hanoi. It said that the bombs hit a medical school, a factory and cafes, killing and wounding “a large number of people.”",Archives,,Archives,,['Vietnam']
I.T.U. Rejects McGovern,1972-08-10,https://www.nytimes.com/1972/08/10/archives/itu-rejects-mcgovern.html,article,"MILWAUKEE, Aug. 9 (AP)— Delegates to the International Typographical Union conven tion today overwhelmingly re jected resolutions supporting Senator George McGovern, the Democratic Presidential nomi nee, and calling for immediate withdrawal of American forces from Southeast Asia. ",Archives,,Archives,,['Vietnam']
"U.S. War Toll for Week Rises to 7 Dead, 36 Hurt",1972-08-11,https://www.nytimes.com/1972/08/11/archives/us-war-toll-for-week-rises-to-7-dead-36-hurt.html,article,"SAIGON, South Vietnam, Aug. 10 (UPI)—American com bat casualties increased last week to seven killed and 36 wounded because of enemy rocket attacks on United States bases, military spokesmen said today.",Archives,,Archives,,['Vietnam']
What Is Indochina?,1972-08-11,https://www.nytimes.com/1972/08/11/archives/what-is-indochina.html,article,"To the Editor: When Senator McGovern talks about Indochina, he means Vietnam, Laos and Cambodia. But I, as a Chinese, understand that Indochina is “the peninsula in Southeast Asia between the Bay of Bengal and the South China Sea, comprising South Vietnam, North Vietnam, Cambodia, Laos, Thailand, Malaya and Burma.” So if McGovern means to “withdraw all U.S. forces from Indochina,” he cannot leave any military personnel in Thailand. I be lieve the North Vietnamese use the same definition of “Indochina” that I use.",Archives,"CORINNA Wu Wappinger Falls, N. Y., Aug. 1, 1972",Archives,,['Vietnam']
Renewed Bombing Adds $1.1‐Billion to War's Cost,1972-08-11,https://www.nytimes.com/1972/08/11/archives/renewed-bombing-adds-11billion-to-wars-cost-renewed-bombing-in-war.html,article,"WASHINGTON, Aug. 10 — The extra cost of the Vietnam war, resulting from the renewal of heavy bombing and other United States air and naval ac ivity since the North Vietna mese offensive, will be $1.1‐ billion in the current fiscal year, the Defense Department disclosed today. This is less than the Nixon Administration previously estimated.",Archives,,Archives,,['Vietnam']
U.S. IS WITHDRAWING LAST COMBAT UNITS,1972-08-11,https://www.nytimes.com/1972/08/11/archives/us-is-withdrawing-last-combat-units.html,article,"SAIGON, South Vietnam, Fri day, Aug. 11—The United States military command an nounced today that the last two infantry combat units in South Vietnam had been with drawn from the field.",Archives,,Archives,,['Vietnam']
News Analysis,1972-08-11,https://www.nytimes.com/1972/08/11/archives/us-and-saigon-differing-views.html,article,"PARIS, Aug. 10—The former Hotel Majestic on Avenue Kle ber, where the American and Vietnamese delegates to the peace talks perform their week ly ritual, seems much more than half a world away from the agonizing realities of the war.",Archives,By Flora Lewis Special to The New York Times,Archives,,['Vietnam']
Saigon Muzzle,1972-08-11,https://www.nytimes.com/1972/08/11/archives/saigon-muzzle.html,article,"As President Nixon seeks a pre‐election finale to the Vietnam war, President Thieu continues to play havoc with political freedom in South Vietnam. After a cam paign of mass arrests, in which thousands of Commu nist and non‐Communist critics of the regime were herded to detention camps, Mr. Thieu has now moved to silence opposition from an already intimidated press.",Archives,,Archives,,"['Vietnam', 'Vietnam']"
House Committee Refuses To Subpoena Jane Fonda,1972-08-11,https://www.nytimes.com/1972/08/11/archives/house-committee-refuses-to-subpoena-jane-fonda.html,article,"WASHINGTON, Aug. 10 (AP) —An attempt to subpoena Jane Fonda, the actress, to testify about her Hanoi visit and anti war broadcasts was rejected by the House Internal Security Committee today.",Archives,,Archives,,['Vietnam']
Lavelle's Disability Rating Is Questioned,1972-08-11,https://www.nytimes.com/1972/08/11/archives/lavelles-disability-rating-is-questioned.html,article,"WASHINGTON, Aug. 10— Representative Les Aspin has charged that Lieut. Gen. John D. Lavelle, who was removed as the American Air Force com mander in Vietnam after he ordered unauthorized bombing raids on the North, was retired a month later with a 70 per cent disability rating unsup ported by medical evidence.",Archives,,Archives,,['Vietnam']
END‐WAR MEASURE BEATEN IN HOUSE BY 228‐178 VOTE,1972-08-11,https://www.nytimes.com/1972/08/11/archives/endwar-measure-beaten-in-house-by-228178-vote-margin-is-said-to-bar.html,article,"WASHINGTON, Aug. 10—In a crucial setback for the anti war movement in Congress, the House of Representatives re jected today an amendment de manding the withdrawal of all American forces from Indo china.",Archives,By John W. Finney Special to The New York Times,Archives,,['Vietnam']
Vietcong in Paris Again Insist U.S. End Its Support of Thieu,1972-08-11,https://www.nytimes.com/1972/08/11/archives/vietcong-in-paris-again-insist-us-end-its-support-of-thieu.html,article,"PARIS, Aug. 10 (AP)—The Vietcong delegation to the peace talks insisted today “there is no other way” to end the Vietnam war except for the United Stales to get out and stop supporting the present Saigon Government.",Archives,,Archives,,['Vietnam']
Saigon Reports Gains in Quangtri City,1972-08-11,https://www.nytimes.com/1972/08/11/archives/saigon-reports-gains-in-quangtri-city.html,article,"SAIGON, South Vietnam, Friday, Aug. 11 (AP)—South Vietnamese forces reportedly cleared the southern sector of Quangtri city yesterday and destroyed 14 North Vietnamese tanks in an air attack outside the northern provincial capital.",Archives,,Archives,,['Vietnam']
Rogers Asserts Shriver Talks ‘Bunk’ About War,1972-08-12,https://www.nytimes.com/1972/08/12/archives/rogers-asserts-shriver-talks-bunk-about-war-rogers-criticizes.html,article,"WASHINGTON, Aug. 11— Secretary of State William P. Rogers said today that Sargent Shriver, the Democratic Vice Presidential nominee, was talk ing “bunk” and engaging in “political fantasy” when he as serted yesterday that President Nixon “blew” a chance to end the Vietnam war in 1969. ",Archives,By Bernard Gwertzman Special to The New York Times,Archives,,['Vietnam']
Dike Bombing Denied By U. S. Carrier Pilots,1972-08-12,https://www.nytimes.com/1972/08/12/archives/dike-bombing-denied-by-us-carrier-pilots-we-do-not-go-after-dikes.html,article,"ABOARD U.S.S. SARATOGA IN THE GULF OF TONKIN, Aug. 8—The pilots aboard this aircraft carrier swear that they have never tried to bomb the dikes of North Vietnam and they say they are hurt and irritated that so many Ameri cans at home do not seem to believe them. ",Archives,By Joseph B. Treaster Special to The New York Times,Archives,,['Vietnam']
Wiretaps on Antiwar Units Laid to Federal Agencies,1972-08-12,https://www.nytimes.com/1972/08/12/archives/wiretaps-on-antiwar-units-laid-to-federal-agencies.html,article,"BOSTON, Aug. 11 (AP) — The Federal Bureau of In vestigation, Internal Revenue Service, Defense Secretary Mel vin R. Laird and Attorney Gen eral Richard G. Kleindienst were named as defendants to day in a suit over alleged wire taps on phones of four Cam bridge‐based antiwar groups, ",Archives,,Archives,,['Vietnam']
Vietnam Mirage,1972-08-12,https://www.nytimes.com/1972/08/12/archives/vietnam-mirage.html,article,The removal from field duty in South Vietnam yester day of the last United States ground combat troops a landmark that unfortunately does not signify meaning ful progress toward peace in Indochina. The rejoicing would be vastly greater if there were genuine evidence of progress in the deadlocked negotiations in Paris if Congress were not throwing up its hands in resigna tion to an Administration apparently still unwilling to recognize that military victory is unattainable for either side in this tragic conflict. ,Archives,,Archives,,"['Vietnam', 'Vietnam']"
Mrs. Birth Says Key Issue In Talks Is Saigon's Rule,1972-08-12,https://www.nytimes.com/1972/08/12/archives/mrs-binh-says-key-issue-in-talks-is-saigons-rule-chief-vietcong.html,article,"PARIS, Aug. 11—Mrs. Ngu yen TM Binh, the chief Viet cong delegate to the Paris peace talks, made it clear to day that the issue of American withdrawal from Vietnam, the focus of argument in the first years of the long‐drawn ‐ out talks, has now been replaced by the issue of organizing pow er in Saigon. ",Archives,By Flora Lewis Special to The New York Times,Archives,,['Vietnam']
Notes On Metropolitan Congressmen,1972-08-12,https://www.nytimes.com/1972/08/12/archives/-end-war-measures-put-liberals-in-dilemma.html,article,"WASHINGTON, Aug. 11— Although they were defeated in efforts to keep a deadline for the withdrawal of Amer ican forces from Indochina in a foreign‐aid bill on the House floor yesterday, most of the more liberal Democratic Rep resentatives from New York City voted to pass the aid bill any way. A major reason was that the meas ure, authoriz ing $2.1‐billion in foreign military assistance, contained $350‐million for Israel, mostly for credit pur chases of planes and other weapons.",Archives,By Richard L. Madden Special to The New York Times,Archives,,['Vietnam']
Enemy Steps Up Attacks Throughout South Vietnam,1972-08-12,https://www.nytimes.com/1972/08/12/archives/enemy-steps-up-attacks-throughout-south-vietnam.html,article,"SAIGON, South Vietnam, Sat urday, Aug. 12 — Commando I raids, shelling and ground as saults by the North Vietnamese and Vietcong stepped up all over South Vietnam in the last 24 hours. ",Archives,By Sydney B. Schanberg Special to The New York Times,Archives,,['Vietnam']
Vietnam Hijacker's Father Is Freed Quietly by Police,1972-08-12,https://www.nytimes.com/1972/08/12/archives/vietnam-hijackers-father-is-freed-quietly-by-police.html,article,"SAIGON, South Vietnam, Aug. 11 (AP) — South Viet namese police have quietly re leased the father of Nguyen Thai Binh, an airplane hijacker slain here July 2. Nguyen Van Hai, who supports a wife and eight surviving children as a clerk‐typist in the civil service, was held without charges for almost a month after his 24‐ year‐old son was shot to death aboard a Pan American 747 he sought to take to Hanoi. ",Archives,,Archives,,['Vietnam']
Last American Ground Combat Unit Is Deactivated in South Vietnam,1972-08-12,https://www.nytimes.com/1972/08/12/archives/last-american-ground-combat-unit-is-deactivated-in-south-vietnam.html,article,"SAIGON, South Vietnam, Aug. 11—The last American ground‐combat unit in Viet nam was deactivated today, a day after one of its com panies returned from a four‐ day mission during which two Men were wounded by booby traps. The unit, the Third Battalion of the 21st Infantry, with supporting ar tillery and a medical detach ment, guarded the big United States air base at Danang. The battalion has 1,043 men. The United States command said that most of the battalion's men would be going home in the next few days, but those with job specialties still needed in Vietnam and those with less than six months' Vietnam service would stay. As of last week 44,600 Amer ican servicemen were left in South Vietnam, not including sailors in the Seventh Fleet off the coast or airmen in Thailand and Guam who fly missions over North and South Vietnam. The first American ground combat bat talion landed in Vietnam March 8, 1965. It was the Third Battalion, Ninth Marine Regiment. At the height of its involvement in 1968, the Unit ed States had 112 ground com bat battalions in Vietnam.",Archives,,Archives,,"['Vietnam', 'Vietnam']"
Vietcong Still Collect Taxes Near Saigon,1972-08-12,https://www.nytimes.com/1972/08/12/archives/vietcong-still-collect-taxes-near-saigon.html,article,"BINHLAM, South Vietnam, Aug. 11—Despite a decade of pacification efforts throughout South Vietnam, Vietcong agents have apparently been collecting monthly taxes from rubber plantation workers within 20 miles of Saigon without inter ruption since at least 1967. ",Archives,By Malcolm W. Browne Special to The New York Times,Archives,,['Vietnam']
Trade Pact With Soviet Seen by End of Year,1972-08-12,https://www.nytimes.com/1972/08/12/archives/trade-pact-with-soviet-seen-by-end-of-year-peterson-says-talks.html,article,"WASHINGTON, Aug. 11 — Peter G. Peterson, Secretary of Commerce, who returned from talks in Moscow 10 days ago without the Soviet‐American trade agreement the President wants, said today he is confi dent the pact will be achieved by the end of the year. ",Archives,,Archives,,['Vietnam']
Letters to the Editor,1972-08-13,https://www.nytimes.com/1972/08/13/archives/jane-fonda-upheld.html,article,To the Editor:,Archives,Faris Bouhafa,Archives,,['Vietnam']
Last G.I. Combat Troops Leave Quietly,1972-08-13,https://www.nytimes.com/1972/08/13/archives/last-gi-combat-troops-leave-quietly-the-combat-gis-depart-quietly.html,article,"SAIGON, South Vietnam, Aug. 12—In Danang this morn ing there were no flourishes, not even a parade, as the Third Battalion of the 21st Infantry and other components of what had been Task Force Gimlet said good‐by to the war. Maj. Gen. H. H. Cooksey said a few words, pinned on some ribbons and then, for all practical pur poses, the last American ground troops were gone. ",Archives,By Joseph B. Treaster Special to The New York Times,Archives,,"['Vietnam', 'Vietnam', 'Vietnam']"
The World,1972-08-13,https://www.nytimes.com/1972/08/13/archives/he-calls-it-closing-the-gates-to-communism-thieus-crackdown.html,article,"SAIGON—Police crackdowns, prison torture and arbitrary government be havior in general are nothing new to the South Vietnamese, but President Nguyen Van Thicu's latest steps to tighten his control over all aspects or life here have alarmed even his long suffering countrymen. ",Archives,&#8212;Sydney H. Schanberg,Archives,,[]
Letters to the Editor,1972-08-13,https://www.nytimes.com/1972/08/13/archives/mcgovern-erred-again.html,article,To the Editor:,Archives,Richard V. Grulich,Archives,,['Vietnam']
Dr. Blake Faults U.S. on Dike Reply,1972-08-13,https://www.nytimes.com/1972/08/13/archives/dr-blake-faults-us-on-dike-reply.html,article,"UTRECHT, The Netherlands, Aug. 12—The Rev. Dr. Eugene Carson Blake, general secre tary of the World Council of Churches, said today that the White House's reaction to his recent letter to President Nixon denouncing the alleged United States bombings of the dikes in North Vietnam was “unsatis factory.” ",Archives,,Archives,,['Vietnam']
Mitchell Attacks Clark,1972-08-13,https://www.nytimes.com/1972/08/13/archives/mitchell-attacks-clark.html,article,"WASHINGTON, Aug. 12 (AP) —Mr. Mitchell called on Sen ator George McGovern today to repudiate publicly what Mr. Mitchell Called “the outrageous conduct” of Ramsey Clark in Hanoi. ",Archives,,Archives,,['Vietnam']
The bonus and the onus,1972-08-13,https://www.nytimes.com/1972/08/13/archives/the-air-war-in-indochina-revised-edition-edited-by-raphael-littauer.html,article,"One of the indestructible myths about the Vietnam war is that the nation's leaders drifted into it, un aware of where step‐by‐step decisions were leading. But as the scenario starts to unroll all over again, with massive bombing mounting toward the peak levels of the past, the myth needs close re‐examination. ",Archives,By Robert Kleiman,Archives,,['Vietnam']
World News Briefs,1972-08-13,https://www.nytimes.com/1972/08/13/archives/nonaligned-nations-end-guyana-parley.html,article,"GEORGETOWN, Guyana, Aug. 12—Foreign ministers of more than 60 countries ended a conference of non aligned nations here today and welcomed the recent improve ment in East‐West relations. But they said that while the easing of tensions reduced the threat of nuclear war, its ef fects were geographically lim ited. ",Archives,By Reutern,Archives,,['Vietnam']
The famous little sting,1972-08-13,https://www.nytimes.com/1972/08/13/archives/medina-by-mary-mccarthy-87-pp-new-york-harcourt-brace-jovanovich.html,article,"The witnesses included a chicken farmer, some students, a pipe fitter, an undertaker and a man who had been a brassiere salesman at the time of the trial of Lieut William Calley but was now a carpet installer. They were once more in the long file of ex‐G.I.'s taking the stand to describe what had happened at Mylai. This time, the accused was Capt. Ernest Medina. It puzzled Mary McCarthy, the novelist and critic who has written this book about the pro ceedings, to “see no traces whatever of the crime and its aftermath either in Medina, joking and whispering with counsel” or in the men who testified. ",Archives,By Gloria Emerson,Archives,,['Vietnam']
