headline,date,web_url,doc_type,lead_paragraph,material_type,author,section,subsection,keywords
AIR UNITS REPORT HEAVIEST ATTACK BY B‐52'S IN NORTH,1972-08-13,https://www.nytimes.com/1972/08/13/archives/air-units-report-heaviest-attack-by-b52s-in-north-13-missions-flown.html,article,"SAIGON, South Vietnam, Aug. 12—In the last 24 hours B‐52 bombers carried out what a spokesman described as “prob ably their heaviest raids ever” over North Vietnam.",Archives,By Malcolm W. Browne Special to The New York Times,Archives,,[]
Government Accused of Speech Curb,1972-08-13,https://www.nytimes.com/1972/08/13/archives/government-accused-of-speech-curb.html,article,The American Civil Liberties Union and the New York Civil Liberties Union accused the Federal Government yesterday of trying to use the Federal Election Act of 1971 to curb free speech. ,Archives,,Archives,,['Vietnam']
In Defense Of McGovern,1972-08-13,https://www.nytimes.com/1972/08/13/archives/in-defense-of-mcgovern-aide-says-business-need-not-be-afraid.html,article,The McGovern candidacy has evoked more sound and fury from vociferous ele ments or the business com munity than that of any any nominee since Franklin D. Roosevelt. Yet the fact is that Senator George McGovern's views are closely allied with the long‐run interests of an enlightened business commu nity and should command its support. ,Archives,By Robert K. Lifton,Archives,,['Vietnam']
NELSON DENOUNCES USE OF A DEFOLIANT,1972-08-13,https://www.nytimes.com/1972/08/13/archives/nelson-denounces-use-of-a-defoliant.html,article,"MADISON, Wis., Aug. 12— Senator Gaylord Nelson charged yesterday that several hundred acres of hillside forest land in Grant County had been “scarred” by a defoliant that has been banned for military use in Vietnam. ",Archives,,Archives,,[]
SAIGON TORTURE IN JAILSREPORTED,1972-08-13,https://www.nytimes.com/1972/08/13/archives/saigon-torture-in-jails-reported-documents-and-interviews-indicate.html,article,"SAIGON, South Vietnam, Aug. 12—Documents smuggled out of South Vietnamese pris ons and extensive interviews with former prisoners paint picture of widespread torture of people jailed by the Saigon Government since the North Vietnamese offensive started four and a half months ago.",Archives,By Sydney H. Schanberg Special to The New York Times,Archives,,"['Vietnam', 'Vietnam', 'Vietnam', 'Vietnam']"
"Clark, in Hanoi, Is Said to Find U.S. Prisoners in Good Health",1972-08-13,https://www.nytimes.com/1972/08/13/archives/clark-in-hanoi-is-said-to-find-us-prisoners-in-good-health.html,article,"SAIGON, South Vietnam, Aug. 12 (UPI)—The former United States Attorney Gen eral, Ramsey Clark, reportedly said in Hanoi today that the health of American prisoners of war in North Vietnam whom he had visited was “better than mine, and I am a healthy man.” ",Archives,,Archives,,['Vietnam']
The World,1972-08-13,https://www.nytimes.com/1972/08/13/archives/-its-gotta-be-better-than-nothing-air-war.html,article,"SAIGON—The American company returned last Thursday from patrol. It had been an uneventful four‐day affair; two of the men were wounded by booby traps. It was also the last ground combat mission to be per formed by the Americans in South Vietnam. The next day the company's parent outfit, the Third Battalion of the 21st Infantry—the last American ground‐combat unit in Vietnam— was deactivated at Danang, the air base where the first American ground combat unit landed in Vietnam March 8, 1965. Most of the men of the Third Battalion are going home. ",Archives,&#8208;Joseph B. Treaster,Archives,,[]
Harriman and Vance Back Shriver's Charge on War,1972-08-13,https://www.nytimes.com/1972/08/13/archives/harriman-and-vance-bach-shrivers-charge-on-war-harriman-and-vance.html,article,"WASHINGTON, Aug. 12 — W. Averell Harriman and Cyrus R. Vance supported today the assertion of Sargent Shriver, the Democratic Vice‐Presidential nominee, that President Nixon, at the outset of his Adminis tration, “blew” an opportunity for a negotiated peace in Viet nam. ",Archives,By E. W. Kenworthy Special to The New York Times,Archives,,['Vietnam']
Informer Appears Key to U.S. Case Against 6 Antiwar Veterans,1972-08-14,https://www.nytimes.com/1972/08/14/archives/informer-appears-key-to-us-case-against-6-antiwar-veterans.html,article,"TALLAHASSEE, Fla„ Aug, I3—The Government's case against six members of the Vietnam Veterans Against the War charged with plotting an assault on the Republican Na tional Convention appears to rest primarily on the testimony of an informer for the Federal Bureau of Investigation who had established a reputation as one of the antiwar group's more militant and vociferous members.",Archives,By John Kifner Special to The New York Times,Archives,,['Vietnam']
"Hanoi Wants to Use P.O.W.'s as Barter, Freed Priest Says",1972-08-14,https://www.nytimes.com/1972/08/14/archives/hanoi-wants-to-use-pows-as-barter-freed-priest-says.html,article,"SAIGON, South Vietnam, Aug. 13 (AP) — A Vietnamese priest, taken to Hanoi after his parish was overrun in the enemy offensive, says North Vietnam wants to barter Ameri can prisoners for the rebuilding of the country.",Archives,,Archives,,['Vietnam']
THIEU QUESTIONS ES. COMMITMENT,1972-08-14,https://www.nytimes.com/1972/08/14/archives/thieu-questions-us-commitment-speech-asking-relentless-bombing.html,article,"SAIGON, South Vietnam, Aug. 13—President Nguyen Van Thieu, in a major speech, has said that to save South Viet nam, the United States must “keep up relentless bombing” of North Vietnam for another six or seven months, but at the same time he raised ap parent doubts about Washing ton's willingness to go on bombing at the same intensity.",Archives,By Sydney H. Schanberg Special to The New York Times,Archives,,['Vietnam']
THE 1972 CAMPAIGN,1972-08-14,https://www.nytimes.com/1972/08/14/archives/dole-rejects-charge.html,article,"MIAMI BEACH, Aug. 13 (UPI)—Senator Robert J. Dole of Kansas, the Republican Na tional Chairman, termed “pre posterous” today the charge by Mr. Shrivel that President Nixon missed a “golden oppor tunity” to end the Vietnam war in 1969.",Archives,,Archives,,['Vietnam']
Letters to the Editor,1972-08-14,https://www.nytimes.com/1972/08/14/archives/to-silence-antiaircraft-gulls.html,article,To the Editor:,Archives,"GEORGE P. BROCKWAY New York, Aug. 7, 1972",Archives,,['Vietnam']
Comment from Clark,1972-08-14,https://www.nytimes.com/1972/08/14/archives/comment-from-clark.html,article,"BANGKOK, Thailand, Aug. 13 (UPI)—Ramsey Clark, re turning from an inspection tour of North Vietnam, said today that he had seen extensive damage, including damage to dikes, from United States bombing raids. He said the bombing could not be justified.",Archives,,Archives,,['Vietnam']
2 EX‐U.N. DELEGATES ASSAIL U.S. ON DIKES,1972-08-14,https://www.nytimes.com/1972/08/14/archives/2-exun-delegates-assail-us-on-dikes.html,article,Two former United States delegates to the United Na tions have accused President Nixon and other Administration officials of misleading the pub lic about the bombing of dikes in North Vietnam.,Archives,,Archives,,['Vietnam']
M'GOVERN PROPOSAL HIT AS ISOLATIONIST,1972-08-14,https://www.nytimes.com/1972/08/14/archives/mgovern-proposal-hit-as-isolationist.html,article,"MIAMI BEACH, Aug. 13 (UPI) — Representative John J. Rhodes, of Arizona, chairman of the Republican National Con vention Platform Committee, said today that Senator George McGovern's proposed defense spending cuts would make the United. States a second‐rate power that would have diffi culty defending even Hawaii.",Archives,,Archives,,['Vietnam']
McGovern Accuses Nixon Of a ‘Low Road’ Campaign,1972-08-14,https://www.nytimes.com/1972/08/14/archives/mcgovern-accuses-nixon-of-a-low-road-campaign-mcgovern-scores-nixon.html,article,"WASHINGTON, Aug. 13—Senator George McGovern accused President Nixon today of directing subordinates question the loyalty of Ramsey Clark, former Attorney General of the United States, as part of a “low road” campaign for re‐election.",Archives,By Bill Kovach Special to The New York Times,Archives,,['Vietnam']
VIETCONG ATTACK NEAR TWO CITIES,1972-08-14,https://www.nytimes.com/1972/08/14/archives/vietcong-attack-near-two-cities-ammunition-dumps-and-a-bridge-are.html,article,"SAIGON, South Vietnam, Monday, Aug. 14 (AP)—Viet cong troops blew up two am munition dumps and a bridge near South Vietnam's two larg est cities yesterday in the latest of a series of demolition attacks, the Saigon command reported.",Archives,,Archives,,['Vietnam']
Rep. Ichord Requests Laws Covering Jane Fonda Trip,1972-08-15,https://www.nytimes.com/1972/08/15/archives/rep-ichord-requests-laws-covering-jane-fonda-trip.html,article,"WASHINGTON, Aug. 14 (UPI) —If the Justice Department de cides not to prosecute Jane Fonda for her radio broadcasts from Hanoi, it should recom mend legislation to provide criminal penalties for similar cases in the future, the House Internal Security Committee said today.",Archives,,Archives,,['Vietnam']
Saigon's Commanders Say the War Can Last for Years,1972-08-15,https://www.nytimes.com/1972/08/15/archives/saigons-commanders-say-the-war-can-last-for-years.html,article,"SAI GON, South Vietnam, Aug. 14—Provided that Ameri can support of the war effort here is not radically reduced by Congress or the election to the Presidency of Senator George McGovern, South Viet namese commanders foresee an indefinite military conflict with Hanoi that could last years or decades.",Archives,By Malcolm W. Browne Special to The New York Times,Archives,,['Vietnam']
KISSINGER HOLDS ANOTHER SESSION WITH HANOI AIDES,1972-08-15,https://www.nytimes.com/1972/08/15/archives/kissinger-holds-another-session-with-hanoi-aides-meets-with-thuy.html,article,"WASHINGTON, Aug. 14 — Henry A. Kissinger, President Nixon's adviser on national se curity, held another private meeting with North Vietnam's negetiators in Paris today, the White House announced.",Archives,By Bernard Gwertzman Special to The New York Times,Archives,,['Vietnam']
"Vietnam Withdrawals Now Top 500,000 Mark",1972-08-15,https://www.nytimes.com/1972/08/15/archives/vietnam-withdrawals-now-top-500000-mark.html,article,"SAIGON, South Vietnam, Aug? 1.4 (UPI) — The with drawal of 2,200 Americans last week raised to more than 500,000 the number of United States troops pulled out of South Vietnam since President Nixon began the military cutback here three years ago, the United States command said today.",Archives,,Archives,,['Vietnam']
Article 1 ‐‐ No Title,1972-08-15,https://www.nytimes.com/1972/08/15/archives/article-1-no-title.html,article,"SAN FRANCISCO, Aug. 14— Mr. Kleindienst said at a news conference here that the Justice Department had found no evi dence of criminal violations by Miss Fonda.",Archives,,Archives,,['Vietnam']
Foe in Vietnam Blows Up Another Munitions Depot,1972-08-15,https://www.nytimes.com/1972/08/15/archives/foe-in-vietnam-blows-up-another-munitions-depot.html,article,"SAIGON, South Vietnam, Tuesday, Aug. 15 — Another South Vietnamese ammunition dump was blown up early yes terday as Communist com mando attacks, urban terrorism and shelling continued to in crease.",Archives,,Archives,,['Vietnam']
Saigon Denies Report Of Torture in Prisons,1972-08-15,https://www.nytimes.com/1972/08/15/archives/saigon-denies-report-of-torture-in-prisons.html,article,"SAIGON, Aug. 14 (Reuters) —A South Vietnamese Gov ernment official today denied a report in The New York Times that political prison ers were being tortured in South Vietnamese jails.",Archives,,Archives,,"['Vietnam', 'Vietnam']"
Clark Says North Vietnam May Free a Few P.O. W.'s,1972-08-15,https://www.nytimes.com/1972/08/15/archives/clark-says-north-vietnam-may-free-a-few-pows-clark-says-a-few.html,article,"SAN FRANCISCO, Aug. 14— Ramsey Clark, a former United States Attorney General, said here today that he thought that a few American prisoners of war would be released soon by North Vietnam.",Archives,By Wallace Turner Special to The New York Times,Archives,,['Vietnam']
CLARK DEPLORES SILENCE ON WAR,1972-08-16,https://www.nytimes.com/1972/08/16/archives/clark-deplores-silence-on-war-says-he-should-have-taken-stand-when.html,article,"SAN FRANCISCO, Aug. 15— Ramsay Clark said here last night that he had been wrong not to speak out against the Vietnam war when he was Deputy Attorney General and then Attorney General in Pres ident Johnson's Cabinet while the war was expanding.",Archives,By Wallace Turner Special to The New York Times,Archives,,['Vietnam']
U.S. Air Force Apologizes For Distributing Editorial,1972-08-16,https://www.nytimes.com/1972/08/16/archives/us-air-force-apologizes-for-distributing-editorial.html,article,"SAIGON, South Vietnam, Aug. 15 (AP) — The United States Seventh Air Force apologized today for baying distributed to about 25 newsmen copies of an editorial in the Aug. 7 issue of Aviation Week & Space Technology that reflected the official Government position on the bombing of North Vietnam.",Archives,,Archives,,"['Vietnam', 'Vietnam']"
McGovern Bars Briefings By Kissinger as Unhelpful,1972-08-16,https://www.nytimes.com/1972/08/16/archives/mcgovern-bars-briefings-by-kissinger-as-unhelpful-mcgovern-declines.html,article,"YOUNGSTOWN, Ohio, Aug. 15—Senator George McGovern declined a Presidential invita tion to be briefed on the Vietnam situation by Henry A. Kissinger because, he said here today, official White House briefings customarily “go wide of the mark.”",Archives,By James M. Naughton Special to The New York Times,Archives,,['Vietnam']
"920 INNOCENT IN JAIL, SAIGONSENATORSAYS",1972-08-16,https://www.nytimes.com/1972/08/16/archives/920-innocent-in-jail-saigon-senator-says.html,article,"SAIGON, South Vietnam, Aug. 15 (UPI)—An influential South Vietnamese senator said to day that 920 innocent people, “mostly women and children,” were being held at suspected Communist sympathizers with out trial in the Con on island prison.",Archives,,Archives,,"['Vietnam', 'Vietnam']"
Focus of Dispute: Peace Signal in '68 or Politics in '72,1972-08-16,https://www.nytimes.com/1972/08/16/archives/focus-of-dispute-peace-signal-in-68-or-politics-in-72.html,article,"WASHINGTON, Aug. 15—The charge by Sargent Shriver, the Democratic Vice Presidential nominee, that President Nixon “blew” a chance to end the Vietnam war in 1969 has pro duced a stormy political debate in Washington, but as with many controversies over Viet nam, the historical truth re mains murky and subject to many interpretations.",Archives,,Archives,,['Vietnam']
MITCHELL ASSERTS CLARK WAS DUPED,1972-08-16,https://www.nytimes.com/1972/08/16/archives/mitchell-asserts-clark-was-duped-exnixon-aide-charges-trip-is-used.html,article,"WASHINGTON, Aug. 15 — John N. Mitchell, the former head of President Nixon's re election organization, said to day that RaMsey Clark had been “duped” during a recent visit to North Vietnam and had al lowed himself to he used by that country in a propaganda campaign.",Archives,By James T. Wooten Special to The New York Times,Archives,,['Vietnam']
WASHINGTON,1972-08-16,https://www.nytimes.com/1972/08/16/archives/kissingers-diplomacy.html,article,"WASHINGTON, Aug. 15—Henry Kis singer's trips to Paris are good news and good politics, since they suggest that there is some movement toward peace, but the fact is that even Kis singer does not expect any real change in the Paris talks until late in the elec tion campaign.",Archives,By James Reston,Archives,,['Vietnam']
Fumbled Opportunity,1972-08-16,https://www.nytimes.com/1972/08/16/archives/fumbled-opportunity.html,article,"Secretary Rogers, former Ambassador Lodge and the State Department are being disingenuous, to put it mildly, in denying “any” knowledge of the 1969 chance for peace in Vietnam that Democratic Vice‐Presidential nominee Sargent Shriver and former Ambassadors Harriman and Vance claim President Nixon “blew.” Interpretations of the events of that period may differ, but there can be little dispute on the facts or the Nixon Administration's detailed knowledge of them now and then.",Archives,,Archives,,['Vietnam']
U.S. B‐52's Strike at Positions Of Enemy's Units Near Saigon,1972-08-16,https://www.nytimes.com/1972/08/16/archives/us-b52s-strike-at-positions-of-enemys-units-near-saigon-600-tons-of.html,article,"SAIGON, South Vietnam, Wednesday, Aug. 16 (AP)— United States B‐52 bombers flew heavy raids in the Saigon area early yesterday, striking at enemy positions as close as 24 miles from the capital.",Archives,,Archives,,['Vietnam']
KISSINGER ON WAY TO Soul VIETNAM TO CONSULT THIEU,1972-08-16,https://www.nytimes.com/1972/08/16/archives/kissinger-on-way-to-south-vietnam-to-consult-thieu-after-secret.html,article,"WASHINGTON, Aug. 15— President Nixon's adviser for national security, Henry A. Kissinger, left Switzerland to night for Saigon to consult with President Nguyen Van Thieu of South Vietnam on efforts to negotiate a settlement of the Vietnam war.",Archives, By Bernard Gwertzman Special to The New York Times,Archives,,['Vietnam']
Pentagon Seeks Report,1972-08-16,https://www.nytimes.com/1972/08/16/archives/pentagon-seeks-report.html,article,"WASHINGTON, Aug. 15— A Defense Department spokes man said today that depart ment officials were looking for the report described by Mr. Engstrom and that no comment could be made on his charges until the report had been found and reviewed. The spokesman added that a urinalysis study conducted last year among American troops in South Viet nam had showed that 5.54 per cent of those tested used heroin.",Archives,,Archives,,['Vietnam']
Ex‐Officer Says Vietnam Report On G. I. Addicts Was Withheld,1972-08-16,https://www.nytimes.com/1972/08/16/archives/exofficer-says-vietnam-report-on-gi-addicts-was-withheld.html,article,"WICHITA, Kan., Aug. 15 (UPI) — A former Army cap tain said in an interview yes terday that a 1971 military re port estimating that 25 per cent of the lower‐ranking en listed men in Vietnam were addicted to heroin had deliber ately been withheld.",Archives,,Archives,,['Vietnam']
THE 1972 CAMPAIGN,1972-08-16,https://www.nytimes.com/1972/08/16/archives/laird-bids-g-o-p-back-nixon-policy-leads-cabinet-aides-attack-on.html,article,"MIAMI BEACH, Aug. 15— Secretary of Defense Melvin R. Laird urged Republicans to day to adopt a platform that “will reject policies of planned weakness, of white‐flag wav ing, of begging and of aban donment of our nation's role in helping to maintain peace.”",Archives,By John Herbers Special to The New York Times,Archives,,['Vietnam']
STUDY FINDS ELITE DOVES ON THE WAR,1972-08-17,https://www.nytimes.com/1972/08/17/archives/study-finds-elite-doves-on-the-war-poll-of-456-leaders-notes-most.html,article,"A survey of 456 of the richest, most powerful and most influ ential persons in the United States reveals a high level of acceptance of Government in tervention in the economy, ap proval of most of the things that make up the welfare state and rejection of hard‐line anti communism in foreign policy. ",Archives,By Glenn Fowler,Archives,,['Vietnam']
Notes on People,1972-08-17,https://www.nytimes.com/1972/08/17/archives/wallace-has-another-operation.html,article,"George C. Wallace, the Governor of Alabama, under went surgery for the second time in a month to drain an abcess caused by the gunshot wounds that felled him in May. The operation, at the University of Alabama Hos pital in Birmingham, was completed “without compli cations,” according to a hos pital spokesman. ",Archives,James F. Clarity,Archives,,['Vietnam']
"The Longest Day, 1972",1972-08-17,https://www.nytimes.com/1972/08/17/archives/the-longest-day-1972.html,article,"WASHINGTON—Aug. 10, 1972 was my most depressing day as a member of Congress. On that black Thursday the House rejected, by 228 to 178, its last clear chance in this Congress to set a date for total U.S. military with drawal from Indochina. ",Archives,By Robert F. Drevan,Archives,,['Vietnam']
McGovern Adviser Comments,1972-08-17,https://www.nytimes.com/1972/08/17/archives/mcgovern-adviser-comments.html,article,"WASHINGTON, Aug. 16— Paul C. Warnke, the former Defense Department official named by Senator George Mc Govern yesterday as his for eign policy liaison with the White House, agreed with oth er Democrats today that Pres ident Nixon “blew” an opportunity for peace in Vietnam.",Archives,,Archives,,['Vietnam']
Speculation Greets Kissinger in Saigon,1972-08-17,https://www.nytimes.com/1972/08/17/archives/speculation-greets-kissinger-in-saigon.html,article,"SAIGON, South Vietnam, Thursday, Aug. 17—Henry A. Kissinger, President Nixon's adviser for national security, arrived in Saigon last night amid lightning and rain and much speculation about the purpose of his trip. ",Archives,By Sydney H. Schanberg Special to The New York Times,Archives,,['Vietnam']
THE 1972 CAMPAIGN,1972-08-17,https://www.nytimes.com/1972/08/17/archives/javits-at-platform-hearing-opposes-nixons-policies.html,article,"MIAMI BEACH, Aug. 16 — Senator Jacob K, Javits, who was chosen by Administration leaders to present dissent from the left before the Platform Committee of the Republican National Convention, opposed President Nixon's policies on Vietnam, busing and drugs to day.",Archives,By John Berbers Special to The New York Times,Archives,,['Vietnam']
THE 1972 CAMPAIGN,1972-08-17,https://www.nytimes.com/1972/08/17/archives/eagleton-says-war-policy-is-raw-retaliation.html,article,"WASHINGTON, Aug. 16 — Senator Thomas F. Eagleton, in his first major appearance in support of the Democratic tick et since leaving it two weeks ago, charged the Nixon Admin istration today with having “embarked on a course of raw retaliation” in Vietnam. ",Archives,,Archives,,['Vietnam']
RUSK DENIES NIXON MISSED PEACE SIGN,1972-08-17,https://www.nytimes.com/1972/08/17/archives/rusk-denies-nixon-missed-peace-sign-he-disputes-shriver-view-of.html,article,"SAN FRANCISCO, Aug. 16 (UPI) — Former Secretary of State Dean Rusk disagrees with some of his former colleagues that the Nixon Administration muffed a chance to end the Vietnam war early in 1969. ",Archives,,Archives,,['Vietnam']
Ramsey Clark in Hanoi,1972-08-17,https://www.nytimes.com/1972/08/17/archives/ramsey-clark-in-hanoi.html,article,Former Attorney General Ramsey Clark used poor judgment in publicly criticizing American war policies while on his fact‐finding mission to North Vietnam. For one so prominent in American governmental affairs to denounce United States actions in the capital of a nation with which this country is involved in combat was bound to detract from the humane course he hoped to advance.,Archives,,Archives,,['Vietnam']
THE 1972 CAMPAIGN,1972-08-17,https://www.nytimes.com/1972/08/17/archives/article-2-no-title.html,article,"WASHINGTON, Aug. 16 (UPI) —Ramsey Clark, at one point holding up a United States “bomblet” given him by Hanoi's Mayor, told a Senate subcom mittee today of seeing exten sive damage to dikes, homes and hospitals during his visit to North Vietnam. ",Archives,,Archives,,['Vietnam']
Books of The Times,1972-08-17,https://www.nytimes.com/1972/08/17/archives/awakening-to-the-nightmare.html,article,"FIRE IN THE LAKE: THE VIETNAMESE AND THE AMERICANS IN VIETNAM, By Fran ces FitzGerald. 491 pages. Illustrated with maps, Atlantic‐Littie, Brown, $12.50.",Archives,,Archives,,"['Vietnam', 'Vietnam']"
Antiwar Veterans Go On,1972-08-17,https://www.nytimes.com/1972/08/17/archives/antiwar-veterans-go-on.html,article,"WEST PALM BEACH, Fla., Aug. 16 (AP)—Forty Vietnam Veterans Against the War, whose leaders are charged with conspiring to disrupt the Re publican National Convention next week marched peaceably through this city today on the way to Miami Beach. ",Archives,,Archives,,['Vietnam']
KISSINGER'S MISSION ASSAILED BY SHRIVER,1972-08-17,https://www.nytimes.com/1972/08/17/archives/kissingers-mission-assailed-by-shriver.html,article,"SAN FRANCISCO, Aug. 16— Sargent Shriver attacked Henry A. Kissinger's mission to Saigon today as late, “frenetic” and political. ",Archives,,Archives,,['Vietnam']
Convention Protesters Plan Sit‐Down,1972-08-17,https://www.nytimes.com/1972/08/17/archives/convention-protesters-plan-sitdown.html,article,David T. Dellinger and the Rev. Daniel J. Berrigan announced yesterday that dem onstrations at the Republican National Convention in Miami Beach next week would include evidence of dike bombing in North Vietnam and would cul minate in a massive sit‐down Wednesday outside the conven tion hall. ,Archives,By Eleanor Blau,Archives,,['Vietnam']
SALINGER TALKED TO FOE ON P.O.W.'S AS M'GOVERN AIDE,1972-08-17,https://www.nytimes.com/1972/08/17/archives/salinger-talked-to-foe-on-pows-as-mgovern-aide-says-he-detected-no.html,article,"WASHINGTON, Aug. 16— Senator George McGovern con firmed today that Pierre Salin ger, the former Presidential press secretary, had met with North Vietnamese negotiators in Paris at his request to dis cuss the prisoner of war situ ation. ",Archives,By Bill Kovach Special to The New York Times,Archives,,['Vietnam']
"Enemy Plant Again Crippled, U.S. Says",1972-08-17,https://www.nytimes.com/1972/08/17/archives/enemy-plant-again-crippled-us-says.html,article,"SAIGON, South Vietnam, Thursday, Aug. 17—American bombers have crippled anew a key North Vietnamese power plant that was extensively damaged in a raid two months ago and subsequently rebuilt, the United States command re ported yesterday.",Archives,,Archives,,['Vietnam']
