headline,date,web_url,doc_type,lead_paragraph,material_type,author,section,subsection,keywords
Pullout Decisions Explained,1970-05-14,https://www.nytimes.com/1970/05/14/archives/pullout-decisions-explained.html,article,"WASHINGTON, May 13— A Pentagon source, comment ing today on the first with drawals of American troops from Cambodia, suggested that the Sesan area had proved “less productive” than some of the others in terms of supply caches.",Archives,,Archives,,['Vietnam']
21 Welfare Protesters Arrested After a Sit‐In,1970-05-14,https://www.nytimes.com/1970/05/14/archives/21-welfare-protesters-arrested-after-a-sitin.html,article,"WASHINGTON, May 13 (AP)—Twenty‐one welfare mothers and student support ers were arrested tonight after they staged an eight‐ hour sit‐in in the office of Robert H. Finch, Secretary of Health, Education and Wel fare.",Archives,,Archives,,['Vietnam']
ROGERS RULES OUT TROOPS TO DEFEND CAMBODIA REGIME,1970-05-14,https://www.nytimes.com/1970/05/14/archives/rogers-rules-out-troops-to-defend-cambodia-regime-also-bars-us.html,article,"WASHINGTON, May 1— Secretary of State William P. Rogers said today that the United States would not become “militarily involved” with troop or air support to defend the Cambodian Government, but was encouraging South Viet nam and Thailand to cooperate with Cambodia in meeting Communist threats.",Archives,By Peter Grose Special to The New York Times,Archives,,"['Vietnam', 'Vietnam', 'Vietnam']"
"In The Nation: Curbing the Man, Not the Office",1970-05-14,https://www.nytimes.com/1970/05/14/archives/in-the-nation-curbing-the-man-not-the-office.html,article,"WASHINGTON, May 13—As the Senate moves toward a vote on limiting military operations in Southeast Asia, a clear dis tinction needs to be made be tween the powers of the Presi dency, on the one hand, and the particular policy of a particular President, on the other. About the first, Congress can do noth ing by statute; about the sec ond, it can do much, if it will.",Archives,By Tom Wicker,Archives,,"['Vietnam', 'Vietnam']"
Vietnamese Wait to Leave Cambodia,1970-05-14,https://www.nytimes.com/1970/05/14/archives/vietnamese-wait-to-leave-cambodia.html,article,"CHRUI CHANGWAR, Cam bodia, May 13—The South Vietnamese rescue fleet steamed out of Pnompenh across the river from this peninsula today carrying 9.000 Vietnamese to the rela tive safety of South Viet nam. Although the departure brought sadness to many whose home has always been Cambodia there was no grieving.",Archives,By Henry Kamm Special to The New York Times,Archives,,['Vietnam']
Veterans Organizations Attract Thousands Returning From War,1970-05-14,https://www.nytimes.com/1970/05/14/archives/veterans-organizations-attract-thousands-returning-from-war.html,article,"KANSAS CITY, Mo.—Vietnam war veterans are joining the American Legion and other vet erans organizations in large numbers at a time of wide spread feeling against the war.",Archives,By Martin Waldron Special to The New York Times,Archives,,[]
Antiwar Protests Go On,1970-05-14,https://www.nytimes.com/1970/05/14/archives/antiwar-protests-go-on-nixon-backers-march-here.html,article,"Strikes and distrubances over the war in Southeast Asia con tinued across the nation yes terday with mounting involve ment, particularly here in New York City, by groups support ing President Nixon and his Indochina policies.",Archives,By Frank J. Prial,Archives,,['Vietnam']
GOLDBERG RECALLS '66 CAMBODIA PLAN,1970-05-14,https://www.nytimes.com/1970/05/14/archives/goldberg-recalls-66-cambodia-plan-says-he-opposed-us-step-fearing.html,article,Arthur J. Goldberg told Columbia University students yesterday that he had opposed a move within the Administra tion of President Lyndon B. Johnson to invade Cambodia in 1966.,Archives,By Homer Bigart,Archives,,"['Vietnam', 'Vietnam']"
ATTACKS REPORTED IN RICE AREA OF LAOS,1970-05-14,https://www.nytimes.com/1970/05/14/archives/attacks-reported-in-rice-area-of-laos.html,article,"VIENTIANE. Laos, May 13 (AP)—North Vietnamese forces, which informants said appar ently had moved in from Cam bodia, are reported to be at tacking Laotian military posi tions on the Bolovens Plateau, a rice‐growing area in southern Laos.",Archives,,Archives,,[]
"1,000 Leaders of High School Strike Plan as They Camp in 5th Ave. Center",1970-05-14,https://www.nytimes.com/1970/05/14/archives/1000-leaders-of-high-school-strike-plan-as-they-camp-in-5th-ave.html,article,"Moe than a thousand high school students have moved their guitars, their posters and their anger into the graduate center of the New School for Social Research. There, for the last week, they have been talk ing, singing, sleeping and eat ing as they coordinate their citywide strike activities pro testing conditions in the high schools, in America generally and in Indochina.",Archives,By Lacey Fosborgh,Archives,,['Vietnam']
MORE AMERICANS OUT OF CAMBODIA,1970-05-14,https://www.nytimes.com/1970/05/14/archives/more-americans-out-of-cambodia-several-companies-leave-raising-the.html,article,"SAIGON, South Vietnam, May 13—Several companies of American troops withdrew from Cambodia today after only a partial search of a sus pected North Vietnamese base area in the Sesan region of the Central Highlands west of Pleiku.",Archives,By James P. Sterba Special to The New York Times,Archives,,"['Vietnam', 'Vietnam']"
Attack Repulsed by G.I.'s,1970-05-14,https://www.nytimes.com/1970/05/14/archives/attack-repulsed-by-gis.html,article,"FIRE BASE BROWN, Cambo dia, May 13—North Vietnamese saboteurs snipped the wires of warning flares and mines this morning and slipped through the barbed wire protecting this exposed American artillery base three miles inside Cam bodia and 95 miles north of Saigon.",Archives,By Ralph Blumenthal Special to The New York Times,Archives,,['Vietnam']
TALK BY GARDNER BARRED IN ILLINOIS,1970-05-14,https://www.nytimes.com/1970/05/14/archives/talk-by-gardner-barred-in-illinois-parley-refuses-to-hear-him.html,article,"WASHINGTON, May 13 — The Illinois Constitutional Con vention refused today to let John W. Gardner deliver a scheduled speech in which he had planned to say that no ad vantage gained by force in Southeast Asia could compare with the damage that the war was inflicting at home.",Archives,By John Herbers Special to The New York Times,Archives,,['Vietnam']
Goldberg's Stand on Reform And War Scored by Samuels,1970-05-14,https://www.nytimes.com/1970/05/14/archives/goldbergs-stand-on-reform-and-war-scored-by-samuels.html,article,"Howard J. Samuels, one of the two Democrats remaining in the race for Governor, said yesterday that he did not know whether he could support the organization designee, Arthur J. Goldberg, if Mr. Goldberg won the June primary.",Archives,By Clayton Knowles,Archives,,['Vietnam']
6th U. S. General Killed in War; Copter Shot Down Near Pleiku,1970-05-14,https://www.nytimes.com/1970/05/14/archives/6th-us-general-killed-in-war-copter-shot-down-near-pleiku.html,article,"SAIGON, South Vietnam, May 13 (AP)—Maj. Gen. John A. B. Dillard, head of the United States Army Engineer Com mand in South Vietnam, was killed yesterday when the heli copter in which he was flying was shot down, the United States Command announced to day.",Archives,,Archives,,['Vietnam']
Problems of a Cambodia Pullout,1970-05-14,https://www.nytimes.com/1970/05/14/archives/problems-of-a-cambodia-pullout.html,article,"SAIGON, South Vietnam, May 13—The Saigon Government's determination to continue and expand its military operations inside Cambodia may well complicate the Nixon Adminis tration's announced goal of withdrawing all American forces from Cambodia by the end of June. In separate remarks during the last few days. President Nguyen Van Thieu and Vice President Nguyen Cao Ky have made unmis takably clear their intention to carry on militarily inside Cam bodia after the deadline for the American withdrawal. For the Nixon Administration, this rais es a basic question: Will it be militarily feasible for the Amer icans to quit Cambodia by July 1 as Mr. Nixon has pledged, if the South Vietnamese insist on operating across the border after that?",Archives,By Terence Smith Special to The New York Times,Archives,,"['Vietnam', 'Vietnam']"
Antiwar Protests Disrupt Many High Schools Here,1970-05-14,https://www.nytimes.com/1970/05/14/archives/antiwar-protests-disrupt-many-high-schools-here.html,article,Tens of thousands of city high school students continued to stay out of classes yesterday as antiwar demonstrations and other protests took place in and around many schools here.,Archives,By Leonard Buder,Archives,,['Vietnam']
Young Lobbyists Push War Funds Ban,1970-05-14,https://www.nytimes.com/1970/05/14/archives/young-lobbyists-push-war-funds-ban.html,article,"WASHINGTON, May 13—A bipartisan group of young, liberal political activists an flounced today the formation of an organization to coordinate the lobbying effort for a Con gressional amendment that would withhold funds for mili tary operations in Southeast Asia.",Archives,By David E. Rosenbaum Special to The New York Times,Archives,,"['Vietnam', 'Vietnam', 'Vietnam']"
Cambodian Withdrawal,1970-05-14,https://www.nytimes.com/1970/05/14/archives/cambodian-withdrawal.html,article,The debate that has opened on the Cooper‐Church amendment now gives the Senate a chance to vote a proposal that would bind President Nixon to his promise of withdrawing American troops from Cam bodia. It would also make sure that he did not send them back without Congressional consent.,Archives,,Archives,,['Vietnam']
Access to the President,1970-05-14,https://www.nytimes.com/1970/05/14/archives/access-to-the-president-white-house-takes-steps-to-counter-charges.html,article,"WASHINGTON, May 13— Some months ago, after a formal dinner at the White House in honor of Prince Philip, Kingman Brewster, Jr., President of Yale University, encountered a reporter he knew outside the mansion. “I talked to the President and Henry Kissinger [the President's na tional securtiy adviser]” he said. “I tried to get through to them about what's happening on the campuses. I don't think I did. Kissinger was mainly worried about what the right wing would do if we failed to get an honorable settlement in Vietnam.”",Archives,By Robert B. Semple Jr. Special to The New York Times,Archives,,[]
Outrage Gives Way to Confusion Among U.C.L.A. War Critics,1970-05-15,https://www.nytimes.com/1970/05/15/archives/outrage-gives-way-to-confusion-among-ucla-war-critics.html,article,"LOS ANGELES, May 14— Lyra Halprin was wearing a blue‐and‐white button on her pink, sleeveless dress. It said, simply, “Enough.”",Archives,By Steven V. Roberts Special to The New York Times,Archives,,['Vietnam']
Capital's Constitutional Problem: Does Power to Make War Belong to President or Congress?,1970-05-15,https://www.nytimes.com/1970/05/15/archives/capitals-constitutional-problem-does-power-to-make-war-belong-to.html,article,"WASHINGTON, May 14—The students who have left the campus to lobby in the Con gress this week obviously thought they were leaving aca demics for politics, but they are caught up now in one of the most difficult intellectual prob lems of American constitutional law: the power to make war.",Archives,By Max Frankel Special to The New York Times,Archives,,['Vietnam']
JACKSON POLICE FIRE ON STUDENTS,1970-05-15,https://www.nytimes.com/1970/05/15/archives/jackson-police-fire-on-students-2-killed-and-12-injured-at-womens.html,article,"JACKSON, Miss., Friday, May 15—Two persons were killed and 12 wounded early today after the police opened fire on a women's dormitory at Jackson State College here.",Archives,,Archives,,['Vietnam']
Letters to the Editor of The Times,1970-05-15,https://www.nytimes.com/1970/05/15/archives/letters-to-the-editor-of-the-times.html,article,‘Purged’ Scholar,Archives,,Archives,,"['Vietnam', 'Vietnam']"
Harvest of Unreason,1970-05-15,https://www.nytimes.com/1970/05/15/archives/harvest-of-unreason.html,article,"Violence and physical coercion are never acceptable ingredients of political action. Whether lawless forays against free speech and legitimate dissent are carried out by radical students or by angry construction work ers, the appropriate answer is the enforcement of the laws to maintain civic peace, protect civil liberties and prevent physical iniuries.",Archives,,Archives,,['Vietnam']
Military Will Curb Ceremonies Noting Armed Forces Day,1970-05-15,https://www.nytimes.com/1970/05/15/archives/military-will-curb-ceremonies-noting-armed-forces-day.html,article,"WASHINGTON, May 14— Fear of campus‐style antiwar demonstrations by off‐duty troops and civilians at major military posts this weekend has forced the cancellation or revi sion of traditional Armed Forces Day ceremonies at bases across the country.",Archives,,Archives,,['Vietnam']
President of Finland Names New Coalition Government,1970-05-15,https://www.nytimes.com/1970/05/15/archives/president-of-finland-names-new-coalition-government.html,article,"HELSINKI, Finland, May 14 (Reuters)—President Urho Kek konen tonight appointed a new coalition Government, with Teuvo Aura, a Liberal who is Lord Mayor of Helsinki, as Premier.",Archives,,Archives,,"['Vietnam', 'Vietnam']"
863 Saigon Soldiers Die In 2d Highest Weekly Toll,1970-05-15,https://www.nytimes.com/1970/05/15/archives/863-saigon-soldiers-die-in-2d-highest-weekly-toll-863-saigon.html,article,"SAIGON, South Vietnam, May 14—Military officials an nounced today that 863 South Vietnamese soldiers were killed in battles in South Vietnam and Cambodia last week, the second highest weekly death toll of the war for the South Vietnamese. American losses—168 killed and 1,001 wounded—were the highest in eight months.",Archives,By James P. Sterba Special to The New York Times,Archives,,"['Vietnam', 'Vietnam']"
Policeman Says He Killed Youth With Accidental Shot,1970-05-15,https://www.nytimes.com/1970/05/15/archives/policeman-says-he-killed-youth-with-accidental-shot.html,article,"SANTA BARBARA, Calif., May 14 (AP)—A 31‐year‐old policeman says an uninten tional shot from his riot gun killed a student peacemaker in antiwar disorders last April at nearby Isla Vista.",Archives,,Archives,,['Vietnam']
Governor Says the State Guard Won't Have Guns on Campuses,1970-05-15,https://www.nytimes.com/1970/05/15/archives/governor-says-the-state-guard-wont-have-guns-on-campuses-no-guns.html,article,"BUFFALO, May 14—Gover nor Rockefeller assured stu dents picketing his appearance here today that there could he no repetition of the Kent State University shooting on a New York campus.",Archives,By Bill Kovach Special to The New York Times,Archives,,['Vietnam']
Washington: President and Congress A Limited Battle,1970-05-15,https://www.nytimes.com/1970/05/15/archives/washington-president-and-congress-a-limited-battle.html,article,"WASHINGTON, May 14 — It is clear now that there is a de termined move in the Congress, and particularly in the Senate, to limit the President's war making powers by denying him funds to carry on the Indo china war as he pleases.",Archives,By James Reston,Archives,,"['Vietnam', 'Vietnam']"
Regents Tests Set for June Despite Strife,1970-05-15,https://www.nytimes.com/1970/05/15/archives/regents-tests-set-for-june-despite-strife.html,article,The State Education Depart ment said yesterday that Re gents examinations would be given next month as scheduled despite the current antiwar strike by high school students here and their threatened boy cott of the state examinations.,Archives,By Leonard Buder,Archives,,['Vietnam']
U.S. WARNS REDS AT PARIS SESSION,1970-05-15,https://www.nytimes.com/1970/05/15/archives/us-warns-reds-at-paris-session-envoy-calls-intransigence-of-hanoi.html,article,"PARIS, May 14—The United States told the Vietnamese Communists today that their “intransigence” at the bargain ing table and heightened activ ity on the battlefield had be come “intolerable.”",Archives,By John L. Hess Special to The New York Times,Archives,,"['Vietnam', 'Vietnam']"
SOVIET TRUCK BID REJECTED BY FORD,1970-05-15,https://www.nytimes.com/1970/05/15/archives/soviet-truck-bid-rejected-by-ford-lairds-criticism-is-cited-years.html,article,"DETROIT, May 14—A Soviet proposal that Ford trucks be built in Russia has been re jected, Henry Ford 2d disclosed today. Public criticism, partic ularly by Defense Secretary Melvin R. Laird, was a major influence in the Ford Motor Company's decision, its officials said.",Archives,By Jerry M. Flint Special to The New York Times,Archives,,['Vietnam']
A Town Is Occupied,1970-05-15,https://www.nytimes.com/1970/05/15/archives/a-town-is-occupied-by-takashi-oka.html,article,"BANAM, Cambodia, May 14 —South Vietnamese marines peacefully occupied this pros perous market town on the (Mekong River yesterday after noon in an operation mainly designed to restore the Cambo dian Government's presence here.",Archives,By Takashi Oka Special to The New York Times,Archives,,[]
Goldberg Terms Governor Inactive,1970-05-15,https://www.nytimes.com/1970/05/15/archives/goldberg-terms-governor-inactive.html,article,"ROCHESTER, May 14—Ar thur J. Goldberg criticized Governor Rockefeller today for alleged inaction and si lence on civil disorders in New York State.",Archives,By Homer Bigart Special to The New York Times,Archives,,"['Vietnam', 'Vietnam']"
A Crisis of Confidence,1970-05-15,https://www.nytimes.com/1970/05/15/archives/a-crisis-of-confidence-doubt-over-how-nixon-will-handle-foreign.html,article,"The gloom that enshrouds Wall Street today is perhaps the heaviest since the early days of the Great Depression. The stock market keeps skidding day after day, with only feeble at attempts at recovery, and the bond market is equally de pressed.",Archives,By Terry Robards,Archives,,['Vietnam']
NIXON AIDES URGE G.O.P. SENATORS OPPOSE WAR CURB,1970-05-15,https://www.nytimes.com/1970/05/15/archives/nixon-aides-urge-gop-senators-oppose-war-curb-argue-against.html,article,"WASHINGTON, May 14 — The Administration sent three top officials to the Capitol today to warn Republican Senators that proposed legislation cut ting off funds for future mili tary involvement in Cambodia could impair the credibility abroad of President Nixon.",Archives,By John W. Finney Special to The New York Times,Archives,,"['Vietnam', 'Vietnam', 'Vietnam', 'Vietnam']"
Democrats Will Help Volunteers Find the Right Man to Work For,1970-05-15,https://www.nytimes.com/1970/05/15/archives/democrats-will-help-volunteers-find-the-right-man-to-work-for.html,article,"WASHINGTON, May 14 — The Democratic party moved today to try to mobilize the rising tide of youthful protest behind its candidates for state and Congressional offices.",Archives,By Warren Weaver Jr. Special to The New York Times,Archives,,['Vietnam']
Suppressing Rationality,1970-05-15,https://www.nytimes.com/1970/05/15/archives/suppressing-rationality.html,article,The nation slides toward isolation in irrationality when politicians at a convention called to draft state's basic law can suppress as irrelevant a carefully reasoned appeal to halt the disintegration of American society. This is precisely what happened when John W. Gardner was barred from telling the Illinois Constitu tional Convention that America is being torn apart by the arowine tendency to tolerate violence.,Archives,,Archives,,"['Vietnam', 'Vietnam']"
"1,000 ‘Establishment’ Lawyers Join War Protest",1970-05-15,https://www.nytimes.com/1970/05/15/archives/1000-establishment-lawyers-join-war-protest.html,article,"More than 1,000 New York City lawyers announced yes terday they would stop work next Wednesday to meet legis lative and administration offi cials in Washington to urge “immediate withdrawal from Indochina.”",Archives,By Thomas F. Brady,Archives,,['Vietnam']
U.S. Says Foe in Cambodia Did Not Heed Combat Order,1970-05-15,https://www.nytimes.com/1970/05/15/archives/us-says-foe-in-cambodia-did-not-heed-combat-order.html,article,"WASHINGTON, May 13 (AP) — Enemy troops in the Cam bodian sanctuary areas failed to follow a stand‐and‐fight ceder a Pentagon spokesman said to day.",Archives,,Archives,,['Vietnam']
NIXON CONFIDENT ON WAR SKEPTICS,1970-05-15,https://www.nytimes.com/1970/05/15/archives/nixon-confident-on-war-skeptics-tells-medal-winners-their-valor.html,article,"WASHINGTON, May 14— President Nixon told a group of Medal of Honor winners to day that the war in Southeast Asia was often “not under stood and not supported in this country” but that eventu ally the American people would join him in honoring their valor.",Archives,By James M. Naughton Special to The New York Times,Archives,,"['Vietnam', 'Vietnam', 'Vietnam']"
Saigon and Pnompenh Set De Facto Military Alliance,1970-05-15,https://www.nytimes.com/1970/05/15/archives/saigon-and-pnompenh-set-de-facto-military-alliance.html,article,"PNOMPENH, Cambodia, May 14 — Responsible Cambodian and South Vietnamese sources say privately here that South Vietnamese troops will fight in Cambodia until the defeat of their common enemy — the Vietcong and North Vietna mese.",Archives,By Henry Kamm Special to The New York Times,Archives,,"['Vietnam', 'Vietnam', 'Vietnam']"
Saigon Units' Role In Cambodia Viewed As Bar to Sihanouk,1970-05-15,https://www.nytimes.com/1970/05/15/archives/saigon-units-role-in-cambodia-viewed-as-bar-to-sihanouk.html,article,"WASHINGTON, May 14— Concern over a possible Com munist attempt to install the headquarters of the exile re gime of Prince Norodom Siha nouk in Cambodia after the departure of American troops was reported today to be one reason for a growing expecta tion here that South Viet namese forces will stay in Cambodia.",Archives,By Tad Szulc Special to The New York Times,Archives,,"['Vietnam', 'Vietnam']"
Laotian Aide Sees Need For Saigon Army's Help,1970-05-16,https://www.nytimes.com/1970/05/16/archives/laotian-aide-sees-need-for-saigon-armys-help.html,article,"VIFNTIANE, Laos, May 15 (Agence France‐Presse)—A Lao tian Defense Ministry spokes man expressed today the grow ing concern of the military command over the situation in southern Laos and suggested that, from a military point of view, it was necessary that South Vietnamese forces inter vene to help “clean up” Laos.",Archives,,Archives,,[]
WAR‐CURB MOVES IN SENATE SCORED BY WHITE HOUSE,1970-05-16,https://www.nytimes.com/1970/05/16/archives/warcurb-movies-in-senate-scored-by-white-house-constitutional.html,article,"KEY BISCAYNE, Fla., May 15—The White House strongly asserted today its view that a move in the Senate to cut off funds for future military in volvement in Cambodia would be an infringement of the Pres ident's constitutional powers as Commander in Chief.",Archives,By James N. Naughton Special to The New York Times,Archives,,"['Vietnam', 'Vietnam']"
DAKOTA MINISTER TO HEAD BAPTISTS,1970-05-16,https://www.nytimes.com/1970/05/16/archives/dakota-minister-to-head-baptists-delegates-suggest-a-woman-will-win.html,article,"CINCINNATI, May 15 — The Rev. Dr. Roger L. Fredrikson of Sioux Falls, S. D., was un animously elected president of the 1.5‐million‐member Ameri can Baptist Convention here today.",Archives,By George Dugan Special to The New York Times,Archives,,['Vietnam']
Radical Jews Disrupt Service At Emanu‐El; 2 Are Arrested,1970-05-16,https://www.nytimes.com/1970/05/16/archives/radical-jews-disrupt-service-at-emanuel-2-are-arrested.html,article,Two members of the Radical Jewish Union of Columbia Uni versity were arrested yesterday after they disrupted services at Temple Emanu‐El to protest the war in Southeast Asia.,Archives,By Edward B. Fiske,Archives,,['Vietnam']
Missing Reporters' Papers Found in Cambodian House,1970-05-16,https://www.nytimes.com/1970/05/16/archives/missing-reporters-papers-found-in-cambodian-house.html,article,"WITH TASK FORCE 318 IN CAMBODIA, May 15 (AP)— South Vietnamese forces, bat tling through a tiny hamlet, have discovered the press cre dentials of three American correspondents missing and be lieved captured by the enemy.",Archives,,Archives,,['Vietnam']
"Pride, Prejudice and Persuasion",1970-05-16,https://www.nytimes.com/1970/05/16/archives/pride-prejudice-and-persuasion.html,article,"LONDON, May 15—In one of the great Supreme Court opin ions on freedom of speech, Mr. Justice Brandeis wrote that those who won America's inde pendence thought “the delib erative forces should prevail over the arbitrary” in society. They wrote into tne tion what they thought would be “the path of safety” for the Republic: “The opportunity to discuss freely supposed griev ances and proposed remedies.” They believed in “the power of reason as applied through pub lic discussion.”",Archives,By Anthony Lewis,Archives,,"['Vietnam', 'Vietnam']"
North Vietnamese Storm A U.S. Base in Cambodia,1970-05-16,https://www.nytimes.com/1970/05/16/archives/north-vietnamese-storm-a-us-base-in-cambodia.html,article,"SAIGON, South Vietnam, Saturday, May 16 (UPI)—A force of about 200 North Viet namese infantrymen attacked a United States base inside Cam bodia early today, and field re ports said that five Americans had been killed and 14 wound ed. Eight North Vietnamese were reported killed.",Archives,,Archives,,['Vietnam']
Rockefeller U. Campus Dispute Gentle,1970-05-16,https://www.nytimes.com/1970/05/16/archives/rockefeller-u-campus-dispute-gentle.html,article,Political activism has flared at Rockefeller University here without igniting the turmoil that has been troubling many other campuses throughout the city and nation.,Archives,By Arnold H. Lubasch,Archives,,['Vietnam']
