headline,date,web_url,doc_type,lead_paragraph,material_type,author,section,subsection,keywords
News Summary and Index,1970-05-21,https://www.nytimes.com/1970/05/21/archives/news-summary-and-index-the-major-events-of-the-day.html,article,"Five battalions of South Vietnamese troops with American advisers thrust across the Cambodian border yesterday in an area northeast of Saigon, between the northern most allied operation near the river Se San and the operation in the Fishhook region. No significant contact with North Vietnam ese troops was reported. The new operation plugs a large gap in the pattern of thrusts into Cambodia. [Page 1, Column 1.]",Archives,,Archives,,[]
HUMPHREY SCORES NIXON'S WAR MOVE,1970-05-21,https://www.nytimes.com/1970/05/21/archives/humphrey-scores-nixons-war-move-says-he-warned-president-in-69.html,article,ST. PAUL. May 20—Former Vice President Hubert H. Humphrey laid today that he privately warned President Nixon last fall that any step enlarging the war in Indochina would be a disaster for this country.,Archives,By Seth S. King Special to The New York Times,Archives,,"['Vietnam', 'Vietnam', 'Vietnam', 'Vietnam']"
SAIGON'S FORCES OPEN NEW FRONT ON CAMBODIA LINE,1970-05-21,https://www.nytimes.com/1970/05/21/archives/saigons-forces-open-new-front-on-cambodia-line-2500-troops-cross.html,article,"DUCLAP, South Vietnam, May 20 — Some 2,500 South Vietnamese soldiers supported by American air power and advisers opened a new front in Cambodia today, thrusting across the border near this Special Forces camp 125 miles northeast of Saigon.",Archives,By Ralph Blumenthal Special to The New York Times,Archives,,"['Vietnam', 'Vietnam']"
Huge City Hall Rally Backs Nixon's Indochina Policies,1970-05-21,https://www.nytimes.com/1970/05/21/archives/huge-city-hall-rally-backs-nixons-indochina-policies-thousands-at.html,article,"Marching under a sea of American flags, helmeted con struction workers led tens of thousands of noisy but peaceful demonstrators yesterday in a rally and parade supporting the Vietnam policies of Presi dent Nixon and assailing Mayor Lindsay and other op ponents of the war in Indo china.",Archives,By Homer Bigart,Archives,,['Vietnam']
Buffalo Workers Protest,1970-05-21,https://www.nytimes.com/1970/05/21/archives/buffalo-workers-protest.html,article,"BUFFALO, May 20—About 1.500 construction workers demonstrated in support of the Nixon Administration's policies in southeast Asia at a rally this noon in front of City Hall.",Archives,,Archives,,['Vietnam']
Text of Mao's Statement Urging World Revolution Against U.S.,1970-05-21,https://www.nytimes.com/1970/05/21/archives/text-of-maos-statement-urging-world-revolution-against-us.html,article,"TOKYO, May 20 (UPI)— Following is the text of a statement on the United States issued today by Mao Tse‐tung, the Chinese Com munist party chairman, as broadcast in English from Peking:",Archives,,Archives,,"['Vietnam', 'Vietnam']"
Nixon's Campus Adviser Assays Student Unrest,1970-05-21,https://www.nytimes.com/1970/05/21/archives/nixons-campus-adviser-assays-student-unrest.html,article,"WASHINGTON, May 20 — G. Alexander Heard recognizes the fact that some students to day feel themselves at war with the rest of society, and he has given himself until June 30 to negotiate an armistice.",Archives,By Warren Weaver Jr. Special to The New York Times,Archives,,['Vietnam']
LAWYERS LOBBY AGAINST THE WAR,1970-05-21,https://www.nytimes.com/1970/05/21/archives/lawyers-lobby-against-the-war-1000-from-city-seek-talks-with.html,article,"WASHINGTON, May 20 — The nation's capital, inundat ed in recent weeks with stu dents lobbying against the war in Indochina, had a new lobby on its hands today — more than 1,000 New York City law yers, mostly well barbered, well‐tailored and well‐pre pared with legal arguments against the war.",Archives,By Richard L. Madden,Archives,,['Vietnam']
Indefinite Stay by Saigon Troops In Cambodia Hinted by General,1970-05-21,https://www.nytimes.com/1970/05/21/archives/indefinite-stay-by-saigon-troops-in-cambodia-hinted-by-general.html,article,"BIENHOA, South Vietnam, May 20—A South Vietnamese general hinted today that South Vietnamese troops would stay in Cambodia until the Vietcong and North Vietnamese were driven back to North Vietnam.",Archives,,Archives,,"['Vietnam', 'Vietnam']"
U.S. Acknowledges South Vietnamese May Remain in Cambodia After June 30,1970-05-21,https://www.nytimes.com/1970/05/21/archives/us-acknowledges-south-vietnamese-may-remain-in-cambodia-after-june.html,article,"WASHINGTON, May 20 — The United States today pub licly acknowledged for the first time the possibility that South Vietnamese troops might re main in Cambodia after the withdrawal of United States forces, scheduled to be com pleted by June 30.",Archives,By Tad Szulc Special to The New York Times,Archives,,"['Vietnam', 'Vietnam']"
Key Cambodian Road Cleared,1970-05-21,https://www.nytimes.com/1970/05/21/archives/key-cambodian-road-cleared.html,article,"TAKEO, Cambodia, May 20 (Agence France‐Presse)—South Vietnamese troops linked up with Cambodian soldiers today in a small town 25 miles north of here after a cross‐country drive from the South Vietna mese border in which they re ported killing more than 400 Vietcong.",Archives,,Archives,,[]
Letters to the Editor of The Times,1970-05-21,https://www.nytimes.com/1970/05/21/archives/letters-to-the-editor-of-the-times.html,article,"To the Editor: I am concerned about the suggestion of a simple causal relation between environmental contamination and population growth. This juxtaposition has been placed in the minds of the public by advertising by special interest groups, news paper editorials and magazine articles.",Archives,,Archives,,"['Vietnam', 'Vietnam']"
"Government Pacifies War Critic, 9",1970-05-21,https://www.nytimes.com/1970/05/21/archives/government-pacifies-war-critic-9.html,article,"WASHINGTON, May 20— Commissioner of Education James E. Allen Jr. has sent a letter of conciliation to a 9‐year‐old California girl who had received a harsh reply to her criticism of the war.",Archives,,Archives,,['Vietnam']
Nixon Facing G.O.P. Revolt on Curb on War Funds,1970-05-21,https://www.nytimes.com/1970/05/21/archives/nixon-facing-gop-revolt-on-curb-on-war-funds.html,article,"WASHINGTON, May 20—The White House was reportedly faced today with the possibility of a revolt by some moderate and liberal Republican Senators if it failed to go along with an amendment cutting off funds for future military involvement in Cambodia.",Archives,By John W. Finney Special to The New York Times,Archives,,"['Vietnam', 'Vietnam', 'Vietnam']"
Court Pardons Drinker Who Lost Son in Vietnam,1970-05-22,https://www.nytimes.com/1970/05/22/archives/court-pardons-drinker-who-lost-son-in-vietnam.html,article,"BUFFALO, May 21 (AP)— Natheniel James stood before a City Court judge today, accused of public intoxica tion. “Were you drunk?” Judge Michael E. Zimmer asked Mr. James, 43 years old.",Archives,,Archives,,[]
SAIGON IS QUERIED ON PULLOUT ISSUE,1970-05-22,https://www.nytimes.com/1970/05/22/archives/saigon-is-queried-on-pullout-issue-us-is-said-to-order-aides-to.html,article,"WASHINGTON, May 21—The Nixon Administration, clearly embarrassed by the controver sy over the future status of South Vietnamese forces in Cambodia, was reported today to have instructed its two senior representatives in Sai gon to discuss the problem urgently with the Government of President Nguyen Van Thieu.I",Archives,By Tad Szulc Special to The New York Times,Archives,,"['Vietnam', 'Vietnam']"
SCHOLARS SEE CRISIS ON FOREIGN POLICY,1970-05-22,https://www.nytimes.com/1970/05/22/archives/scholars-see-crisis-on-foreign-policy.html,article,"A poll of 394 political scien tists who teach at United States colleges shows that, if Ameri can involvement in Indochina continues at its present level, two‐thirds fear a struggle be tween the President and Con gress over whose decision on foreign policy shall prevail.",Archives,,Archives,,['Vietnam']
Letters to the Editor of The Times,1970-05-22,https://www.nytimes.com/1970/05/22/archives/letters-to-the-editor-of-the-times.html,article,"To the Editor: As a clergyman who for fifty years in the parish ministry has been a member of most of the peace, interfaith and ecumeni cal agencies. I plead for under standing and support of Presi dent Nixon in his efforts to achieve peace.",Archives,,Archives,,['Vietnam']
Ky Says Troops Will Stay,1970-05-22,https://www.nytimes.com/1970/05/22/archives/ky-says-troops-will-stay.html,article,"SAIGON, South Vietnam. May 21—Vice President Nguyen Cao Ky declared today that South Vietnamese troops were deter mined to remain in Cambodia after the planned withdrawal of American troops from that country by the end of June.",Archives,,Archives,,"['Vietnam', 'Vietnam']"
9 Hurt as Police Disperse Group in Midtown After City Hall Peace Rally,1970-05-22,https://www.nytimes.com/1970/05/22/archives/9-hurt-as-police-disperse-group-in-midtown-after-city-hall-peace.html,article,"Nine antiwar demonstrators were injured yesterday when the police forcibly dispersed at Avenue of the Americas and 39th Street a militant group that had marched uptown from a peace rally of 20,000 at City Hall.",Archives,By Homer Bigart,Archives,,['Vietnam']
GUARD IS CALLED TO OHIO STATE U,1970-05-22,https://www.nytimes.com/1970/05/22/archives/guard-is-called-to-ohio-state-u-5000-activated-as-students-loot.html,article,"About 5,000 Ohio National Guardsmen were alerted to active duty in the area of Ohio State University in Colum bus last night after demonstrat ing students, led by militant blacks, smashed dozens of store windows and looted shops in the campus area.",Archives,By Frank J. Prial,Archives,,['Vietnam']
No More Cambodias,1970-05-22,https://www.nytimes.com/1970/05/22/archives/no-more-cambodias.html,article,The firmness with which Senators of both parties are resisting efforts to kill or cripple the Cooper Church amendment on Cambodia is encouraging evi dence of a new determination in Congress to restore the constitutional balance in reaching vital decisions on war and peace.,Archives,,Archives,,"['Vietnam', 'Vietnam']"
O'BRIEIN SEES LACK OF TRUST IN NIXON,1970-05-22,https://www.nytimes.com/1970/05/22/archives/obrien-sees-lack-of-trust-in-nixon-democratic-chairman-says-people.html,article,"WASHINGTON, May 21— The Democratic National Chair man, Lawrence F. O'Brien, ac cused President Nixon today of failing to generate an essen tial “atmosphere of confidence”, in the foreign and domestic policies of his Admistration.",Archives,,Archives,,['Vietnam']
FILM OF ATROCITY IN DISPUTE RE‐RUN,1970-05-22,https://www.nytimes.com/1970/05/22/archives/film-of-atrocity-in-dispute-rerun.html,article,The Columbia Broadcast Sys tem re‐ran with supporting evi dence last night a film that the network said was the target of a White House “undercover campaign to discredit C.B.S. News.”,Archives,,Archives,,"['Vietnam', 'Vietnam']"
67th Paris Session On Vietnam Fails To Break Impasse,1970-05-22,https://www.nytimes.com/1970/05/22/archives/67th-paris-session-on-vietnam-fails-to-break-impasse.html,article,"PARIS, May 21—The 67th session of the Paris conference on Vietnam today produced agreement only to meet again next Thursday.",Archives,,Archives,,"['Vietnam', 'Vietnam', 'Vietnam']"
Anti‐Vietnam Feeling Voiced,1970-05-22,https://www.nytimes.com/1970/05/22/archives/antivietnam-feeling-voiced.html,article,"PNOMPENH, Cambodia, May 21—The spokesman for Cam bodia's military command to day stepped beyond his normal military briefing to address correspondents emotionally on his feelings toward the Viet namese. Venturing outside the present policy line, Major Am rone, declared that any Cam bodian would rather die than live under Vietnamese domina tion.",Archives,,Archives,,[]
Episcopal Council Urges Total Troop Withdrawal,1970-05-22,https://www.nytimes.com/1970/05/22/archives/episcopal-council-urges-total-troop-withdrawal.html,article,"GREENWICH, Conn., May 21 —The executive council of the 3.5‐million‐member Episcopal Church passed a resolution yes terday calling for “total with drawal of all American forces from Southeast Asia now and and end to the war.”",Archives,,Archives,,"['Vietnam', 'Vietnam']"
Rhodesians Greet Vorster,1970-05-22,https://www.nytimes.com/1970/05/22/archives/rhodesians-greet-vorster.html,article,"SALISBURY, Dhodesia, May 21 (Agence France‐Presse) — Rhodesians gave Prime Minister John Vorster of South Africa an enthusiastic welcome upon his arrival at Salisbury airport today for a two‐day official visit. As Mr. Vorster left the aircraft a crowd of about 100 Europeans cheered and shouted “Well done.”",Archives,,Archives,,['Vietnam']
NEW YORK GROUP LOBBIES FOR PEACE,1970-05-22,https://www.nytimes.com/1970/05/22/archives/new-york-group-lobbies-for-peace-senators-are-urged-to-back-2.html,article,"WASHINGTON, May 21—The president of Bloomingdale's, the head of Random House, the au thor of “The Rothchilds,” an in vestment banker, the former Gloria Vanderbilt and her hus band, Wyatt Cooper, and as sorted envoys from New York's worlds of culture, business and fasihon became lobbyists today.",Archives,By Nan Robertson Special to The New York Times,Archives,,"['Vietnam', 'Vietnam', 'Vietnam']"
Senate Sponsors Soften Language of the Cambodian Amendment,1970-05-22,https://www.nytimes.com/1970/05/22/archives/senate-sponsors-soften-language-of-the-cambodian-amendment.html,article,"WASHINGTON, May 21—The White House and its Senate critics were at an impasse to day in their attempt to reach an accommodation on a move to prohibit future military ac tivities in Cambodia without the consent of Congress.",Archives,,Archives,,"['Vietnam', 'Vietnam']"
DR. ALLEN OPPOSES NIXON WAR POLICY,1970-05-22,https://www.nytimes.com/1970/05/22/archives/dr-allen-opposes-nixon-war-policy-presidents-education-aide-cites.html,article,"WASHINGTON, May 21—Dr. James E. Allen Jr., the United States Commissioner of Educa tion who was appointed by President Nixon, disagreed today with the Administration over the Indochina war.",Archives,By Richard D. Lyons Special to The New York Times,Archives,,"['Vietnam', 'Vietnam']"
"U. S. WAR DEATHS FOR WEEK AT 217, A 9‐MONTH PEAK",1970-05-22,https://www.nytimes.com/1970/05/22/archives/us-war-deaths-for-week-at-217-a-9month-peak-140-killed-in-south.html,article,"SAIGON, South Vietnam, May 21—The United States com mand said today that 217 American soldiers were killed in Southeast Asia last week. This was the highest weekly toll since last August.",Archives,By Ralph Blumenthal Special to The New York Times,Archives,,"['Vietnam', 'Vietnam', 'Vietnam']"
"Saigon to Reopen Schools, But Universities Stay Shut",1970-05-22,https://www.nytimes.com/1970/05/22/archives/saigon-to-reopen-schools-but-universities-stay-shut.html,article,"SAIGON, South Vietnam, May 21—A Government spokes‐, man announced today the re opening of high schools and primary schools, which have been closed since May 6 be cause of student unrest. The universities, however, will ap parently remain shut.",Archives,,Archives,,['Vietnam']
Pentagon Says Drives Disrupted Foe,1970-05-22,https://www.nytimes.com/1970/05/22/archives/pentagon-says-drives-disrupted-foe.html,article,"WASHINGTON, May 21— In a preliminary assessment of the United States and South South Vietnamese troop thrusts into Cambodia, the Pentagon said today that enemy head quarters units had suffered “se rious disruption” and had been forced to flee deeper into the interior.The estimate of damage in flicted on the enemy forces avoided any assertion that the Communist headquarters, known as the Central Office for South Vietnam, or COSVN — had been captured, but it pre sented a picture of confusion and retreat in the enemy camp.",Archives,,Archives,,"['Vietnam', 'Vietnam']"
Thieu Asks Power To Combat Inflation By Decreeing Tax,1970-05-23,https://www.nytimes.com/1970/05/23/archives/thieu-asks-power-to-combat-inflation-by-decreeing-tax.html,article,"SAIGON, South Vietnam, May 22 (AP)—President Nguyen Van Thieu asked the National As sembly yesterday for broad new powers for five months to deal with the nation's economic problems.",Archives,,Archives,,['Vietnam']
SAIGON IS HALTING REFUGEE PULLOUT,1970-05-23,https://www.nytimes.com/1970/05/23/archives/saigon-is-halting-refugee-pullout-about-70000-vietnamese-still-in.html,article,"PNOMPENH, Cambodia, May 22 The Government of South Vietnam has decided to halt the mass evacuation of refugees by boat down the Mekong River, leaving about 70,000 Vi etnamese stranded in assembly camps here.",Archives,By Henry Kamm Special to The New York Times,Archives,,[]
ARMY TV WAR FILM IS REPORTED STAGED,1970-05-23,https://www.nytimes.com/1970/05/23/archives/army-tv-war-film-is-reported-staged.html,article,"WASHINGTON, May 22 — Senator J. W. Fullbright said today that Lhe Senate Foreign Relations Committee had re ceived sworn testimony from an Army sergeant that military television team in Vietnam had staged several combat incidents by South Vietnamese troops.",Archives,,Archives,,"['Vietnam', 'Vietnam']"
U.S. SAID TO SHIFT VIEW ON AIR COVER IN CAMBODIAN WAR,1970-05-23,https://www.nytimes.com/1970/05/23/archives/us-said-to-shift-view-on-air-cover-in-cambodian-war-it-is-reported.html,article,"WASHINGTON, May 22 — The United States was reported today to be prepared to con tinue air cover, if needed, for South Vietnamese forces that are considered almost certain to remain in Cambodia after the American withdrawal deadline, July 1.",Archives,By Tad Szulc Special to The New York Times,Archives,,"['Vietnam', 'Vietnam']"
"Mao Attack on U.S. Viewed As a Reply to Moscow, Too",1970-05-23,https://www.nytimes.com/1970/05/23/archives/mao-attack-on-us-viewed-as-a-reply-to-moscow-too.html,article,"HONG KONG, May 22—Mao Tse‐tung's call this week for world revolution against “Unit ed States imperialism” and yesterday's mass rally that he attended in Peking's Tienanmen Square supporting the call are regarded here as moves to emphasize further Communist China's revolutionary leader ship role.",Archives,By Tillman Durdin Special to The New York Times,Archives,,['Vietnam']
The News Refuses an Ad By Its Staff Against War,1970-05-23,https://www.nytimes.com/1970/05/23/archives/the-news-refuses-an-ad-by-its-staff-against-war.html,article,The Daily News refused to accept an advertisement yester day from more than 100 of its editorial employes condemning the war in Southeast Asia.,Archives,,Archives,,['Vietnam']
AGNEW ATTACKS HIS PRESS CRITICS,1970-05-23,https://www.nytimes.com/1970/05/23/archives/agnew-attacks-his-press-critics-says-he-wont-quiet-down-urges.html,article,"HOUSTON, May 22 — Vice President Agnew renewed his attack on his critics in the “liberal news media” to night, dismissing statements by editorial writers and column ists that he and President Nixon had contributed to re cent campus disorders with their public comments.",Archives,By Martin Waldron Special to The New York Times,Archives,,"['Vietnam', 'Vietnam', 'Vietnam']"
Washington‐Moscow‐Peking,1970-05-23,https://www.nytimes.com/1970/05/23/archives/washingtonmoscowpeking.html,article,"Since Moscow and Peking coordinate virtually noth ing important these days, it was sheer coincidence that on the same morning this week the Chinese called off the scheduled meeting with American repre sentatives in Warsaw while Pravda loosed one of its most severe attacks against Mao and his policies. Nevertheless the juxtaposition of these two events helps provide a useful perspective on present relation ships in the vital Washington‐Moscow‐Peking triangle.",Archives,,Archives,,"['Vietnam', 'Vietnam']"
Student Protests Continue,1970-05-23,https://www.nytimes.com/1970/05/23/archives/student-protests-continue-citys-schools-closed-tribute-here-to.html,article,"Student protests continued across the nation yesterday. In the New York area, demon strations were few and peace ful.",Archives,By Frank J. Prial,Archives,,['Vietnam']
Nixon Aides to See Business Leaders On Stock Markel,1970-05-23,https://www.nytimes.com/1970/05/23/archives/nixon-aides-to-see-business-leaders-on-stock-market-conferences-set.html,article,"Henry A. Kissinger, President Nixon's national security ad viser, and Budget Director Rob ert P. Mayo are scheduled to meet with Wall Street and busi ness leaders within the next 10 days to discuss the effect of the Government's policies on the stock market.",Archives,By Terry Robards,Archives,,['Vietnam']
500 in Art Strike Sit on Steps of Metropolitan,1970-05-23,https://www.nytimes.com/1970/05/23/archives/500-in-art-strike-sit-on-steps-of-metropolitan.html,article,"Nearly 500 participants in the New York Art Strike— artists, art students, art teach ers and gallery employes—sat in yesterday on the steps of the Metropolitan Museum and suc ceeded in drastically reducing its normal daily attendance of 4,000.",Archives,By Grace Glueck,Archives,,['Vietnam']
"Saigon Force in Cambodia Doubles in Week to 40,000",1970-05-23,https://www.nytimes.com/1970/05/23/archives/saigon-force-in-cambodia-doubles-in-week-to-40000-south-vietnamese.html,article,"SAIGON, South Vietnam, May 22—South Vietnam has dou bled the size of its forces oper ating within Cambodia during the last week.",Archives,By James P. Sterba Special to The New York Times,Archives,,"['Vietnam', 'Vietnam']"
"O'Dwyer, 62, Finds His Age an Aid",1970-05-23,https://www.nytimes.com/1970/05/23/archives/odwyer-62-finds-his-age-an-aid.html,article,"Paul O'Dwyer, who is 20 years older than any of his three opponents for the Dem ocratic nomination for United States Senator, says that re election would never be on his mind if he became a Sen ator, and that he would play an independent Washington role, “like the LaFollettes.”",Archives,By Richard Reeves,Archives,,['Vietnam']
CRITICS DOMINATE MEETING OF G.M,1970-05-23,https://www.nytimes.com/1970/05/23/archives/critics-dominate-meeting-of-gm-they-lose-on-2-proposals-but-assail.html,article,"DETROIT, May 22 — Crit ics of the giant General Motors Corporation received only min iscule support from sharehold ers for their proposals today, but they used the annual meet ing here to stir debate on pol lution control, car safety and minority hiring.",Archives,By Agis Salpukas Special to The New York Times,Archives,,['Vietnam']
Sentiment Against War Deluges A Nixon Emissary at Columbia,1970-05-23,https://www.nytimes.com/1970/05/23/archives/sentiment-against-war-deluges-a-nixon-emissary-at-columbia.html,article,President Nixon sent a young aide to Columbia University to find out why he had a “problem” with the academic community.,Archives,By Homer Bigart,Archives,,['Vietnam']
President Thieu or President Nixon?,1970-05-23,https://www.nytimes.com/1970/05/23/archives/president-thieu-or-president-nixon.html,article,"LONDON, May 22—Through all the years of war and frus trated negotiation and plans for American withdrawal, there has been one central question for the United States in Vietnam: to what extent would we he committed to the objectives of the Saigon Government?",Archives,By Anthony Lewis,Archives,,[]
Cruise for Vietnam Veterans,1970-05-23,https://www.nytimes.com/1970/05/23/archives/cruise-for-vietnam-veterans.html,article,"WASHINGTON May 22 (AP) — President Nixon's daughter and son‐in‐law, Julie and David Eisenhower, accompanied Viet nam war veterans on the first of a planned series of Potomac River cruises on the Presiden tial yacht Sequoia. On the trip yesterday were 37 soldiers from service hospitals in the capital area.",Archives,,Archives,,[]
Red Forces in Cambodia Nearing the Laos Border,1970-05-23,https://www.nytimes.com/1970/05/23/archives/red-forces-in-cambodia-nearing-the-laos-border.html,article,"VOEUN KHAM, Laos, May 20 — The thumping sounds of mor tar and artillery fire can be heard clearly in this tiny village on the Cambodian border as military officials report that Communist troops on the other side have swept north within two and a half miles Of the frontier.",Archives,By Sydney H. Schanberg Special to The New York Times,Archives,,"['Vietnam', 'Vietnam']"
SENATE PETITIONS FOR M'CARTHY CUT,1970-05-23,https://www.nytimes.com/1970/05/23/archives/senate-petitions-for-mcarthy-cut-state-action-jeopardizes-his-bid.html,article,The petitions to put Repre sentative R. D. Max McCarthy on the ballot for the Demo cratic nomination for Senator were cut down to the bare minimum of 47 counties yes terday—with the validity of the signatures from two of those counties still in doubt.,Archives,By Maurice Carroll,Archives,,"['Vietnam', 'Vietnam']"
600 JOIN RALLY HERE OF ‘SILENT MAJORITY’,1970-05-23,https://www.nytimes.com/1970/05/23/archives/600-join-rally-here-of-silent-majority.html,article,"An enthusiastic crowd of 600 attended a rally advertised as being for the “silent majority” last night at Manhattan Center, cheering speeches by former mayoral candidates Mario A. Procaccino and John J. Marchi and applauding a self‐pro claimed police undercover in formant.",Archives,,Archives,,['Vietnam']
Article 1 ‐‐ No Title,1970-05-23,https://www.nytimes.com/1970/05/23/archives/article-1-no-title.html,article,,Archives,SPECIAL TO THE NEW YORK TIMES,Archives,,"['Vietnam', 'Vietnam']"
Ruined Cambodian Town Can't Understand Why,1970-05-23,https://www.nytimes.com/1970/05/23/archives/ruined-cambodian-town-cant-understand-why.html,article,"SNOUL, Cambodia, May 19 —None of the people here understand why it has hap nened to them.",Archives,By Gloria Emerson Special to The New York Times,Archives,,['Vietnam']
