headline,date,web_url,doc_type,lead_paragraph,material_type,author,section,subsection,keywords
Former Secretary of Commerce Scores Move Into Cambodia,1970-05-09,https://www.nytimes.com/1970/05/09/archives/former-secretary-of-commerce-scores-move-into-cambodia-connor-of.html,article,"HOT SPRINGS, Va., May 8— John T. Connor, chairman of the board of the Allied Chemi cal Corporation, said today that President Nixon's decision to send United States troops into Cambodia “shakes the confi dence of many Americans in lus judgment and intentions.” ",Archives,By Eileen Shanahan Special to The New York Times,Archives,,"['Vietnam', 'Vietnam', 'Vietnam']"
"In the Ozarks, Some Nixon Backers Give Him ‘the Benefit of the Doubt’",1970-05-09,https://www.nytimes.com/1970/05/09/archives/in-the-ozarks-some-nixon-backers-give-him-the-benefit-of-the-doubt.html,article,"ROGERS, Ark., May 8—As recently as last fall, the people of this relaxed, conservative, all‐white town were less con cerned about the Vietnam war than about the fortunes of the razorbacks football team at the nearby University of Arkansas. ",Archives,By Roy Reed Special to The New York Times,Archives,,['Vietnam']
White House Once a Place That ‘Belonged’ to Public,1970-05-09,https://www.nytimes.com/1970/05/09/archives/white-house-once-a-place-that-belonged-to-public.html,article,"WASHINGTON, May 8 — The White House, the focus of tomorrow's antiwar protests, is surrounded by an aura of power plus gates, fences, guards, flood lights and a chain of legal documents designed to keep out intruders and discourage dem onstrations. ",Archives,By Richard D. Lyons Special to The New York Times,Archives,,['Vietnam']
Saigon Reports Battle,1970-05-09,https://www.nytimes.com/1970/05/09/archives/saigon-reports-battle.html,article,"SAIGON, May 8 (AP)—North Vietnamese forces, which launched a series of attacks in the northern reaches of South Vietnam today, were reported to have suffered a defeat in the biggest battle there. ",Archives,,Archives,,[]
Bipartisan Senate Group Maps A 3‐Pronged Antiwar Strategy,1970-05-09,https://www.nytimes.com/1970/05/09/archives/bipartisan-senate-group-maps-a-3pronged-antiwar-strategy.html,article,"WASHINGTON, May 8 — A group of Democratic and Re publican Senators have devised a three‐pronged strategy for challenging President Nixon's policies in Southeast Asia and for placing legislative restric tions on his powers as Com mander in Chief. ",Archives,By John W. Finney Special to The New York Times,Archives,,"['Vietnam', 'Vietnam', 'Vietnam']"
Nixon Critics Complain Of Rejected Telegrams,1970-05-09,https://www.nytimes.com/1970/05/09/archives/nixon-critics-complain-of-rejected-telegrams.html,article,Several people complained to The New York Times this week that Western Union operators refused to accept telegrams ad dressed to President Nixon that were sharply critical of his Cambodian policy. ,Archives,By Sandra Blakeslee,Archives,,"['Vietnam', 'Vietnam']"
Anti‐U.S. Protests Held From Britain to Taiwan,1970-05-09,https://www.nytimes.com/1970/05/09/archives/antius-protests-held-from-britain-to-taiwan.html,article,"Demonstrations continued around the world yesterday in protest against the United States' intervention in Cam bodia and the killing of four, students at Kent State Univer sity by Ohio National Guards men. ",Archives,By Murray Illson,Archives,,['Vietnam']
News Summary and Index,1970-05-09,https://www.nytimes.com/1970/05/09/archives/news-summary-and-index.html,article,"At his first news conference in three months, President Nixon said that the first American troops would start pulling out of Cambodia by the middle of next week and all American troops would be out by the middle of June. He said that the Cambodian operation gained time to train the South Vietnamese and thus shortened the United States role. [Page 1, Columns 4–8.] ",Archives,,Archives,,[]
WISCONSIN U. HEAD RESIGNS HIS POST,1970-05-09,https://www.nytimes.com/1970/05/09/archives/wisconsin-u-head-resigns-his-post-denies-being-fired-in-wake-of.html,article,"MADISON, Wis., May 8— The University of Wisconsin president, Fred Harvey Harring ton, his campus scarred by four days of antiwar strife, today resigned his post, effective Oct. 1. ",Archives,,Archives,,['Vietnam']
"For Souvenir Hunters in Fishhook, A Case of Beer Buys a Soviet Rifle",1970-05-09,https://www.nytimes.com/1970/05/09/archives/for-souvenir-hunters-in-fishhook-a-case-of-beer-buys-a-soviet-rifle.html,article,"NEAR THE TABOL RIVER, Cambodia, May 8—You could trade a case of beer for a Soviet designed rifle around here today, and lots of sol diers were doing it. ",Archives,By James P. Sterba Special to The New York Times,Archives,,['Vietnam']
War Foes Here Attacked By Construction Workers,1970-05-09,https://www.nytimes.com/1970/05/09/archives/war-foes-here-attacked-by-construction-workers-city-hall-is-stormed.html,article,"Helmeted construction work ers broke up a student anti war demonstration in Wall Street yesterday, chasing youths through the canyons of the financial district in a wild noontime melee that left about 70 persons injured. ",Archives,By Homer Bigart,Archives,,['Vietnam']
STUDENTS GIVEN OPTIONS ON MARKS,1970-05-09,https://www.nytimes.com/1970/05/09/archives/students-given-options-on-marks-improvised-plans-spring-up-at.html,article,"Many colleges and univer sities, facing long closures dur ing the current wave of cam pus disruptions and strikes have begun offering their stu dents a wide range of improm ise choices to receive academic credit. ",Archives,By Andrew H. Malcolm,Archives,,['Vietnam']
Upstate Village Backs Nixon Policies,1970-05-09,https://www.nytimes.com/1970/05/09/archives/upstate-village-backs-nixon-policies.html,article,"GLEN AUBREY, N.Y., May 7—Mrs. Betty Welch, whose son. Leon, is serving in the Army along the Vietnam‐Cam bodian border, was talking to iday in the local post office about fears for her son's life land the violence on college campuses in behalf of the with drawal of United States troops from Vietnam. ",Archives,By Murray Schumach Special to The New York Times,Archives,,['Vietnam']
Why Are We in Vietnam?,1970-05-09,https://www.nytimes.com/1970/05/09/archives/why-are-we-in-vietnam.html,article,"LONDON, May 8—President Nixon's action in Cambodia has had at least one constructive effect: it has dramatized the flawed character, not to say illogic, of his declared plan to get the United States out of Vietnam. ",Archives,By Anthony Lewis,Archives,,"['Vietnam', 'Vietnam', 'Vietnam', 'Vietnam', 'Vietnam']"
NIXON DEFENDS CAMBODIA DRIVE AS AIDING STUDENTS' PEACE AIM; SAYS PULLOUT WILL BEGIN SOON,1970-05-09,https://www.nytimes.com/1970/05/09/archives/nixon-defends-cambodia-drive-as-aiding-students-peace-aim-says.html,article,"WASHINGTON, May 8 — Strongly defending the United States troop movement into Cambodia, which has evoked a storm of protest by students and others throughout the coun try, President Nixon said to night that the operation would win six to eight months of time for the further training of South Vietnamese forces and thus shorten the war for the Ameri cans. ",Archives,By Max Frankel Special to The New York Times,Archives,,"['Vietnam', 'Vietnam', 'Vietnam']"
Seoul Aide to Visit Saigon For Talks on Cambodia,1970-05-09,https://www.nytimes.com/1970/05/09/archives/seoul-aide-to-visit-saigon-for-talks-on-cambodia.html,article,"SEOUL, South Korea, May 8 —The South Korean Defense Minister, Nae Hyuk Chung, will visit Saigon later this month to discuss with American and South Vietnamese officials what role South Korea can play in Cambodia, it was reported here today. ",Archives,,Archives,,"['Vietnam', 'Vietnam']"
Outspoken Businessman,1970-05-09,https://www.nytimes.com/1970/05/09/archives/outspoken-businessman.html,article,"THEN the prestigious Busi ness Council, a group of the nation's top industrialists, invited John Thomas Connor to address its spring meeting yesterday about the situation in Southeast Asia, its mem bers probably could not have anticipated the intensity of his remarks. But by the time that the chairman of Allied Chemical Corporation a n d former Secretary of Commerce end ed his talk in Hot Springs, Va., there was no doubt about his opposition to the movement of American troops into Cambodia and his belief that the Vietnam dis engagement should be quick ened.",Archives,,Archives,,[]
Patients Challenge V. A. Hospital's Ban On Peace Petitions,1970-05-09,https://www.nytimes.com/1970/05/09/archives/patients-challenge-va-hospitals-ban-on-peace-petitions.html,article,"A group called the Vietnam War Veterans Against the War, said Yesterday that it woud file a suit against administrators of a Veterans Administration Hos pital here for allegedly for bidding patients from signing Ian antiwar petition.",Archives,,Archives,,['Vietnam']
"In San Diego, Trust Has Weakened While Public Division Has Increased",1970-05-09,https://www.nytimes.com/1970/05/09/archives/in-san-diego-trust-has-weakened-while-public-division-has-increased.html,article,"SAN DIEGO, May 8—“Nixon) says he will be a one‐term Pres ident, and I agree,” said a bar ber in the shabby North Park section of town. “He hasn't lived up to his promises. He said he would get out and bring the troops home, but he hasn't done it.” ",Archives,By Steven V. Roberts Special to The New York Times,Archives,,['Vietnam']
College Radio Hookup Will Give Only All‐Day Report of Protests,1970-05-09,https://www.nytimes.com/1970/05/09/archives/college-radio-hookup-will-give-only-allday-report-of-protests.html,article,"A network of college radio stations, with New York Uni versity's WNYU as the coordi nating flagship, will provide broadcasting's only sustained coverage of today's antiwar activities in Washington and of weekend protests across the country. ",Archives,By Fred Ferretti,Archives,,['Vietnam']
Evacuation of Saravane Is Planned by Laotians,1970-05-09,https://www.nytimes.com/1970/05/09/archives/evacuation-of-saravane-is-planned-by-laotians.html,article,"VIENTIANE, Laos, May 8— The Government has begun to take measures to evacuate the civilian population of Saravane following the fall of Attopeu last week. Savarane, with a pop ulation of 5,500, is about 60 miles northeast of the Mekong River town of Pakse and is on the eastern rim of the Boloven Highlands. Attopeu fell to Pa thet Lao guerrillas and North Vietnamese troops on April 30. ",Archives,,Archives,,[]
Truck Driver Cheered By Antiwar Protesters,1970-05-09,https://www.nytimes.com/1970/05/09/archives/truck-driver-cheered-by-antiwar-protesters.html,article,A truck driver who was given a ticket when he re fused to move his delivery van through a street clogged with antiwar demonstrators was rewarded yesterday with the cheers of the demonstra tors—and about $100 in dol lar bills collected from the crowd to Day his fine. ,Archives,,Archives,,['Vietnam']
NEWSPAPER TALKS PUSHED BY KHEEL,1970-05-09,https://www.nytimes.com/1970/05/09/archives/newspaper-talks-pushed-by-kheel-2-sides-hold-long-session-but-are.html,article,"Theodore W. Kheel, the labor mediator, increased his efforts yesterday to break the dead lock in the contract negotia tions between the printer's union and the city's major newspapers. ",Archives,By Damon Stetson,Archives,,['Vietnam']
STUDENTS STEP UP PROTESTS ON WAR,1970-05-09,https://www.nytimes.com/1970/05/09/archives/students-step-up-protests-on-war-marches-and-strikes-held-amid-some.html,article,"College students across the nation intensified the renewed antiwar movement yesterday with mass marches and rallies, widened school strikes and scattered incidents of violence. ",Archives,By Robert D. McFadden,Archives,,['Vietnam']
...Violence on the Right,1970-05-09,https://www.nytimes.com/1970/05/09/archives/-violence-on-the-right.html,article,"The assaults by construction workers on students in downtown Manhattan yesterday were a tragic reflection of the polarization brought by the Vietnam war, campus turbulence, racial tensions and an Administration‐fostered mood of political repression. Even more, the clashes in the financial district and at City Hall were a frightening lesson in the ease with which right‐wing vigilantism finds in left‐wing extremism an excuse for pushing aside constituted authority and enforcing its own brutal form of injustice. ",Archives,,Archives,,['Vietnam']
Someb Protests Heckled; Fires Reported at Colleges,1970-05-09,https://www.nytimes.com/1970/05/09/archives/some-protests-heekled.html,article,"The surge of protest result ing from the United Staes mili tary action in Cambodia and the student deaths at Kent State swept up a growing num ber of New York metropolitan, area residents yesterday, both on and off the campuses. ",Archives,By Linda Charlton,Archives,,['Vietnam']
Transcript of President's News Conference on Foreign and Domestic Matters,1970-05-09,https://www.nytimes.com/1970/05/09/archives/transcript-of-presidents-news-conference-on-foreign-and-domestic.html,article,"Following is a transcript of President Nixon's televised news conference last night, as record ed by The New York Times:",Archives,,Archives,,"['Vietnam', 'Vietnam', 'Vietnam', 'Vietnam', 'Vietnam']"
GRECHKO ASSAILS U.S. IN VE‐DAY TALK,1970-05-09,https://www.nytimes.com/1970/05/09/archives/grechko-assails-us-in-veday-talk-soviet-defense-chief-harsh-on.html,article,"MOSCOW, May 8 — Defense Minister Andrei A. Grechko to day marked the 25th annivers ary of VE day with a denunci ation of the United States and an assertion that if there were a third world war, “imperial ism would be crushed as a world system.” ",Archives,By Bernard Gwertzman Special to The New York Times,Archives,,"['Vietnam', 'Vietnam', 'Vietnam']"
PRESIDENT BACKS RIGHT TO DISSENT,1970-05-09,https://www.nytimes.com/1970/05/09/archives/president-backs-right-to-dissent-asserts-he-shares-goals-of.html,article,"WASHINGTON, May 8—Pres ident Nixon told the nation to night that he shared the goals and concerns of student pro testers. ",Archives,By Robert B. Semple Jr. Special to The New York Times,Archives,,['Vietnam']
Saigon Navy's Gunboats Reported Inside Cambodia on the Mekong,1970-05-09,https://www.nytimes.com/1970/05/09/archives/saigon-navys-gunboats-reported-inside-cambodia-on-the-mekong.html,article,"SAIGON, South Vietnam, May 8—Gunboats of a South Vietnamese Navy flotilla bound for Pnompenh were reported today to have crossed the bor der into Cambodia on the Me kong River while the bulk of the fleet of about 60 river craft appeared to be massing just in side South Vietnam. ",Archives,By Ralph Blumenthal Special to The New York Times,Archives,,"['Vietnam', 'Vietnam']"
ARMY MAY TRY FIVE ON MUTINY CHARGES,1970-05-09,https://www.nytimes.com/1970/05/09/archives/army-may-try-five-on-mutiny-charges.html,article,"PLEI DJERENG, South Viet nam, May 8 (AP)—The Army said today that it was consid ering court‐martial proceedings against five American soldiers who allegedly refused to partic ipate in a combat assault into Cambodia. [In Saigon, military authorities professed no knowl edge of the incident.] ",Archives,,Archives,,['Vietnam']
Cambodia Seeking Help on Refugees,1970-05-09,https://www.nytimes.com/1970/05/09/archives/cambodia-seeking-help-on-refugees.html,article,"PNOMPENH, Cambodia, May 8—Security officials said today that they would welcome a large‐scale effort by the South Vietnamese Navy up the Mekong River to evacuate Vietnamese residents from Pnompenh. ",Archives,By Henry Kamm Special to The New York Times,Archives,,['Vietnam']
Gallup Poll Finds 57% Support President on Cambodian Policy,1970-05-10,https://www.nytimes.com/1970/05/10/archives/gallup-poll-finds-57-support-president-on-cambodian-policy.html,article,"PRINCETON, N. J., May 9— A majority of Americans, 57 per cent, gave President Nixon a vote of confidence for his handling of the Presidency in a Gallup Poll survey conducted immediately after his April 30 speech in which he announced his decision to send United States troops into Cambodia. ",Archives,,Archives,,"['Vietnam', 'Vietnam']"
71 CIVILIANS KILLED IN VIETNAM ATTACKS,1970-05-10,https://www.nytimes.com/1970/05/10/archives/71-civilians-killed-in-vietnam-attacks.html,article,"SAIGON, South Vietnam, May 9 (Reuters)—A Govern ment spokesman announced today that 71 civilians have been killed and 78 wounded in Vietcong attacks in Northern areas of the country since Thursday. ",Archives,,Archives,,['Vietnam']
MOOD IS CHANGING AT BRONX SCIENCE,1970-05-10,https://www.nytimes.com/1970/05/10/archives/mood-is-changing-at-bronx-science-war-arousing-students-at-usually.html,article,"A few years ago, when the Bronx High School of Science was a sanctuary of placidity amid the city's “blackboard jungle,” teachers there some times boasted of the “worst problems” they had with stu dents: ",Archives,By McCandish Phillips,Archives,,['Vietnam']
Moves in Congress To Curb Power of President,1970-05-10,https://www.nytimes.com/1970/05/10/archives/moves-in-congress-to-curb-power-of-president.html,article,"WASHINGTON — For all the talk in recent years about re storing the war‐making powers of Congress, nobody, not even the ardent champions of Con gressional authority on the Sen ate Foreign Relations Commit tee, ever really expected that Congress would take any spe cific steps to curb the powers of the President at Commander in‐Chief. ",Archives,&#8212;John W. Finney,Archives,,"['Vietnam', 'Vietnam', 'Vietnam', 'Vietnam', 'Vietnam', 'Vietnam']"
"Army, Admitting an Error, Reverses a Court‐Martial",1970-05-10,https://www.nytimes.com/1970/05/10/archives/army-admitting-an-error-reverses-a-courtmartial.html,article,"SAN FRANCISCO, May 9 (AP)—The Army, admitting a technical error, has given an honorable discarge to a lieu tenant who had been court marshialed for refusing to go to Vietnam.",Archives,,Archives,,['Vietnam']
General Visits G.L's in Fishhook,1970-05-10,https://www.nytimes.com/1970/05/10/archives/general-visits-gis-in-fishhook-just-like-children-they-need-praise.html,article,"PHUOCVINH, South Viet nam, May 8 —“Troops are just like children, they need praise, to be told when they are doing a good job,” Brig. Gen. Robert M. Shoemaker said here today at the base of the First Cavalry Division (Ai rmobile). ",Archives,By Gloria Emerson Special to The New York Times,Archives,,['Vietnam']
Letters to the Editor of The Times,1970-05-10,https://www.nytimes.com/1970/05/10/archives/letters-to-the-editor-of-the-times.html,article,"We believe that President Nixon's recent actions in Indo china constitute a disastrous and indefensible re‐escalation of the war. We do not think that any tactical, short‐term advan tages could possibly justify the catastrophic reversal of Ameri can policy since 1968, and we condemn his reckless disregard of the effects of his futile poli cies abroad on the fabric of our life at home. ",Archives,,Archives,,"['Vietnam', 'Vietnam', 'Vietnam', 'Vietnam', 'Vietnam', 'Vietnam', 'Vietnam']"
"NIXON TOO ALOOF, OFFICIALS CHARGE",1970-05-10,https://www.nytimes.com/1970/05/10/archives/nixon-too-aloof-officials-charge-complaints-of-inaccessibility.html,article,"WASHINGTON, May 9.— The White House has paid damned little attention to our report or to working with those who wrote it,” a member of the staff of the National Commis sion on the Causes and Pre vention of Violence asserted recently. ",Archives,,Archives,,"['Vietnam', 'Vietnam', 'Vietnam']"
ROLE OF NEGROES IN RALLY SMALL,1970-05-10,https://www.nytimes.com/1970/05/10/archives/role-of-negroes-in-rally-small-racism-given-priority-over-war-and.html,article,"WASHINGTON, May 9 — Stepping across several white youths sprawled on the grass near the Ellipse, Reginald Wil son, a 19‐year‐old Negro, ex plained the paucity of black participants in the antiwar rally. ",Archives,By Thomas A. Johnson Special to The New York Times,Archives,,['Vietnam']
Police Assailed by Mayor On Laxity at Peace Rally,1970-05-10,https://www.nytimes.com/1970/05/10/archives/police-assailed-by-mayor-on-laxity-at-peace-rally-leary-and-his-2.html,article,"While Police Commissioner Howard R. Leary sat grim faced at his left, Mayor Lind say charged yesterday that New Yorkers had “witnessed breakdown of the police as the barrier between them and wan ton violence” on Friday. ",Archives,By Maurice Carroll,Archives,,['Vietnam']
POLICE IN LONDON HALT PROTESTERS,1970-05-10,https://www.nytimes.com/1970/05/10/archives/police-in-london-halt-protesters-opponents-of-war-march-on-us.html,article,"LONDON, May 9—Five thou sand demonstrators protesting United States involvement in Vietnam marched on the United States Embassy today, struggled with the police, broke several car windows and then went home singing “We'll Meet Again.” ",Archives,By Alvin Shuster Special to The New York Times,Archives,,[]
FINCH CRITICIZES AGNEW REMARKS,1970-05-10,https://www.nytimes.com/1970/05/10/archives/finch-criticizes-agnew-remarks-but-hew-secretary-later-issues-a.html,article,"WASHINGTON, May 9—Rob ert H.Finch, Secretary of Health, Education and Welfare, told student demonstrators today that the public rhetoric of Vice President Agnew and Gov. Ron ald Reagan of California had “contributed to heating up the climate in which the Kent State students were killed.” ",Archives,By James T. Naughton Special to The New York Times,Archives,,"['Vietnam', 'Vietnam']"
U. of Maine Dissent Channeled Through Student Government,1970-05-10,https://www.nytimes.com/1970/05/10/archives/u-of-maine-dissent-channeled-through-student-government.html,article,"ORONO, Me., May 9 — The Flag is back at the top of its tall steel pole today, catching sunlight in a gentle May breeze above the old iron cannon aimed impotently at the Stillwater River from the shady front lawns of the University of Maine's campus here. ",Archives,By Douglas E. Kneeland Special to The New York Times,Archives,,['Vietnam']
Education,1970-05-10,https://www.nytimes.com/1970/05/10/archives/education-new-role-for-college-presidents-in-student-unrest.html,article,The campus dissension that erupted over the Cambodia is Sve and the Kent State Univer sity slayings led to a new role for university presidents last week as spokesmen for the stu dents in their strained dialogue with the Government. ,Archives,&#8212;Fred M. Hechinger,Archives,,['Vietnam']
76 Students Held in Saigon,1970-05-10,https://www.nytimes.com/1970/05/10/archives/76-students-held-in-saigon.html,article,"SAIGON, South Vietnam, May 9 (AP)—The South Vietnamese police today arrested 76 high school and college students who tried to occupy the Ministry of Education building in Saigon. The students were protesting the closing of their schools by the Government and continued detention of student leaders.",Archives,,Archives,,['Vietnam']
BOOK PUBLISHERS ACT AGAINST WAR,1970-05-10,https://www.nytimes.com/1970/05/10/archives/book-publishers-act-against-war-form-a-project-movement-to-lobby.html,article,A group of executives and editorial employes of many of the nation's leading publishing houses has started a protest movement against the war in Indochina through a sustained campaign and lobbying in Con gress. ,Archives,By Henry Raymont,Archives,,['Vietnam']
How Nixon Made the Fateful Cambodia Decision,1970-05-10,https://www.nytimes.com/1970/05/10/archives/how-nixon-made-the-fateful-cambodia-decision.html,article,"WASHINGTON — During his campaign for the Presidency, Richard Nixon stopped in Dallas one October night and, in a local television interview, offered a preview summary of how foreign policy was to be run under his dispensation.",Archives,,Archives,,"['Vietnam', 'Vietnam', 'Vietnam', 'Vietnam']"
Bishop Moore Installed as Episcopal Coadjutor,1970-05-10,https://www.nytimes.com/1970/05/10/archives/bishop-moore-installed-as-episcopal-coadjutor-exsuffragan-of.html,article,The Right Rev. Paul Moore Jr. was installed yesterday as coadjutor bishop of the Episco pal Diocese of New York in a two‐hour ceremony in the Ca thedral Church of St. John the Divine.,Archives,By George Dugan,Archives,,['Vietnam']
‘Naked Kids’ Unnerve Cedar Rapids Folk,1970-05-10,https://www.nytimes.com/1970/05/10/archives/naked-kids-unnerve-cedar-rapids-folk.html,article,"CEDAR RAPIDS, Iowa, May 8—A new sign in the Butterfly Cafe advises those without shoes or shirt to stay out. ",Archives,By James T. Wooten Special to The New York Times,Archives,,['Vietnam']
JOHN JAY COLLEGE GETS PROTESTS TOO,1970-05-10,https://www.nytimes.com/1970/05/10/archives/john-jay-college-gets-protests-too-activity-unusual-at-school.html,article,"A few days ago, Ivonne Hughes went to a gathering of militant students from the City University of New York and saw a banner reading “John Jay—College or Pig School?” ",Archives,By Paul L. Montgomery,Archives,,['Vietnam']
BIG CAPITAL RALLY ASKS U.S. PULLOUT IN SOUTHEAST ASIA,1970-05-10,https://www.nytimes.com/1970/05/10/archives/big-capital-rally-asks-us-pullout-in-southeast-asia-protesters-and.html,article,"WASHINGTON, Sunday, May 10—A great crowd of youths, most from the troubled college campuses across the country, demonstrated peaceably yester day at the rear of a barricaded White House, demanding the withdrawal of United States military forces from Cambodia, Laos and Vietnam. ",Archives,By John Herbers Special to The New York Times,Archives,,['Vietnam']
