headline,date,web_url,doc_type,lead_paragraph,material_type,author,section,subsection,keywords
NIXON SENDS COMBAT FORCES TO CAMBODIA TO DRIVE COMMUNISTS FROM STAGING ZONE,1970-05-01,https://www.nytimes.com/1970/05/01/archives/nixon-sends-combat-forces-to-cambodia-not-an-invasion-president.html,article,"WASHINGTON, April 30—In a sharp departure from the pre vious conduct of war in South east Asia, President Nixon an nounced tonight that he was sending United States combat troops into Cambodia for the first time. ",Archives,By Robert B. Semple Jr. Special to The New York Times,Archives,,"['Vietnam', 'Vietnam', 'Vietnam']"
"Saigon Official, in Paris, Terms Attack Defensive",1970-05-01,https://www.nytimes.com/1970/05/01/archives/saigon-official-in-paris-terms-attack-defensive.html,article,"PARIS, April 30—The Saigon delegation at the Vietnam peace conference here declared today that North Vietnamese and Vietcong forces were in troducing large quantities of arms and reinforcements into the Cambodian frontier area in preparation for a new offen sive.",Archives,By Henry Giniger Special to The New York Times,Archives,,"['Vietnam', 'Vietnam', 'Vietnam']"
G.I.'s and Bombers Begin Drive on Foe's Sanctuary,1970-05-01,https://www.nytimes.com/1970/05/01/archives/gis-and-bombers-begin-drive-on-foes-sanctuary-gis-and-bombers-open.html,article,"SAIGON, South Vietnam, Fri day, May 1—The United States sent troops and B‐52 bombers inside Cambodia early today in the first strike of an attempt to crush the sanctuary there of the North Vietnamese and Viet cong forces. ",Archives,,Archives,,"['Vietnam', 'Vietnam']"
Key Congressmen Briefed; Reaction Called Favorable,1970-05-01,https://www.nytimes.com/1970/05/01/archives/key-congressmen-briefed-reaction-called-favorable-key-congressmen.html,article,"WASHINGTON, April 30 — President Nixon was reported tonight to have received a gen erally favorable reaction from Congressional leaders to his de cision to send American ground combat troops into Cambodia to destroy Communist sanctu aries in that country. ",Archives,By John W. Finney Special to The New York Times,Archives,,"['Vietnam', 'Vietnam']"
Students at American U. Vote to Call Strike Today,1970-05-01,https://www.nytimes.com/1970/05/01/archives/students-at-american-u-vote-to-call-strike-today.html,article,"WASHINGTON, April 30 Students at American Univer sity here are planning to go on a one‐day strike tomorrow pro testing the Administration's ac tions on Cambodia, the trial of Black Panthers in New Haven, an a recent speech by Vice President Agnew. ",Archives,,Archives,,['Vietnam']
HOUSE BARS MOVE TO REDUCE FUNDS FOR ABM SYSTEM,1970-05-01,https://www.nytimes.com/1970/05/01/archives/house-bars-move-to-reduce-funds-for-abm-system-rejects13185.html,article,"WASHINGTON, April 30—In sometimes emotional debate, the House rejected today ef forts to cut funds for the Safe guard antimissile system. ",Archives,By Robert M. Smith Special to The New York Times,Archives,,"['Vietnam', 'Vietnam']"
NEW CLASH ERUPTS AT OHIO STATE U.,1970-05-01,https://www.nytimes.com/1970/05/01/archives/new-clash-erupts-at-ohio-state-u-100-seized-13-wounded-and-73-hurt.html,article,"COLUMBUS, Ohio, April 30 — National Guardsmen and po lice repeatedly scattered crowds of students on the cam pus of Ohio State University to day, firing hundreds of rounds of tear gas and pepper gas, and discharging shotguns at the youths.",Archives,By Jerry M. Flint Special to The New York Times,Archives,,['Vietnam']
Transcript of President's Address to the Nation on Military Action in Cambodia,1970-05-01,https://www.nytimes.com/1970/05/01/archives/transcript-of-presidents-address-to-the-nation-on-military-action.html,article,Following is a transcript of President Nixon's televised address last night as recorded by The New York Times:,Archives,,Archives,,"['Vietnam', 'Vietnam', 'Vietnam', 'Vietnam']"
White House Says 80% Of Callers Back Nixon,1970-05-01,https://www.nytimes.com/1970/05/01/archives/white-house-says-80-of-callers-back-nixon.html,article,"WASHINGTON, April 30— The White House Press Sec retary, Ronald L. Ziegler, said tonight that the telephone response to the President's address on Cambodia seemed to be running 6 to 1 in the President's favor. ",Archives,,Archives,,"['Vietnam', 'Vietnam']"
CHOU PLAYED ROLE IN LEFTIST PARLEY,1970-05-01,https://www.nytimes.com/1970/05/01/archives/chou-played-role-in-leftist-parley-chinese-provided-facilities-for.html,article,"HONG KONG, April 30 — A major role for Communist China in last weekend's conference of Cambodian, Laotian and Viet inamese Communist and pro Communist leaders was dis closed In official reports reach ing here today from Peking and Hanoi. ",Archives,By Tillman Durdin Special to The New York Times,Archives,,['Vietnam']
Moscow Condemns U.S. And Saigon on Cambodia,1970-05-01,https://www.nytimes.com/1970/05/01/archives/moscow-condemns-u-s-and-saigon-on-cambodia.html,article,"MOSCOW, April 30 —The Soviet Union today condemned the intrusion into Cambodian territory by American‐supported South Vietnamese forces. It called it “direct aggression against a member of the United Nations.”",Archives,By Bernard Gwertzman Special to The New York Times,Archives,,"['Vietnam', 'Vietnam']"
The Legal Basis for U.S. Role in Conflict in Cambodia,1970-05-01,https://www.nytimes.com/1970/05/01/archives/the-legal-basis-for-us-role-in-conflict-in-cambodia.html,article,"WASHINGTON, April 30 —President Nixon made no attempt in his speech tonight to expound a legal justifica tion for his move into Cam bodia, other than to refer to his duties as Commander in Chief under the Constitution and the need to protect the lives of American soldiers. ",Archives,,Archives,,"['Vietnam', 'Vietnam']"
Washington: The Latest Fad Wrong‐Way Politics,1970-05-01,https://www.nytimes.com/1970/05/01/archives/washington-the-latest-fad-wrongway-politics.html,article,"WASHINGTON, April 30—If you're a little confused about what's going on around here these days, it may be because you haven't caught on to the new rule of politics. The new rule is that logic is out and reverse logic is in, and under this rule everybody talks and acts against his own self‐inter est and in the interest of his opponent. ",Archives,By James Reston,Archives,,"['Vietnam', 'Vietnam']"
SUTTON'S SUPPORT GOES TO GOLDBERG,1970-05-01,https://www.nytimes.com/1970/05/01/archives/suttons-support-goes-to-goldberg-borough-president-tells-of-role-of.html,article,"Borough President Percy E. Sutton of Manhattan, a delegate of the New Democratic Coali tion, yesterday endorsed Arthur J. Goldberg, the Democratic or ganization designee for Gov ernor. ",Archives,By Clayton Knowles,Archives,,"['Vietnam', 'Vietnam']"
Military Hallucination—Again,1970-05-01,https://www.nytimes.com/1970/05/01/archives/military-hallucination-again.html,article,"President Nixon's assurance in his address last night that his decision to send American troops against Communist sanctuaries in Cambodia will save lives, hasten the withdrawal of American forces and shorten the war has a familiar and wholly unconvincing ring. ",Archives,,Archives,,"['Vietnam', 'Vietnam']"
"Reds Seize Laos Town, Killing 93",1970-05-01,https://www.nytimes.com/1970/05/01/archives/reds-seize-laos-town-killing-93.html,article,"VIENTIANE, Laos, April 30 — North Vietnamese forces took control of the embattled town of Attopeu in southern Laos early this morning. ",Archives,,Archives,,[]
A Saigon General Rides Into Cambodian Town,1970-05-02,https://www.nytimes.com/1970/05/02/archives/a-saigon-general-rides-into-cambodian-town.html,article,"SVAYRIENG, Cambodia, May 1—With a swagger stick under his arm, the beaming South Vietnamese commander of the allied thrust into Cambodia drove into this provincial capi tal at 12:10 P.M. today, em braced the commander of the Cambodian soldiers defending the town and pronounced its residents safe from the Viet cong.",Archives,By James P. Sterba Special to The New York Times,Archives,,['Vietnam']
Kennedy Describes Action In Cambodia as ‘Madness’,1970-05-02,https://www.nytimes.com/1970/05/02/archives/kennedy-describes-action-in-cambodia-as-madness.html,article,"BOSTON, May 1 (AP)—Sen ator Edward M. Kennedy criti ing American cized President Nixon today for sending American troops into Cambodia.",Archives,,Archives,,"['Vietnam', 'Vietnam']"
GOLDBERG SCORES COURT BACKLOGS,1970-05-02,https://www.nytimes.com/1970/05/02/archives/goldberg-scores-court-backlogs-calls-conditions-shocking-proposes.html,article,Arthur J. Goldberg charged yesterday that there had been a “virtual breakdown in the process of criminal justice at the trial level” in this country.,Archives,By Thomas P. Ronan,Archives,,"['Vietnam', 'Vietnam']"
END TO RECESSION SEEN BY FRIEDMAN,1970-05-02,https://www.nytimes.com/1970/05/02/archives/end-to-recession-seen-by-friedman-lag-held-mildcambodia-effect.html,article,"CHICAGO, May 1—The econ omy is about halfway through a relatively mild recession that is expected to end in the third or fourth quarter of this year, economist Milton Friedman said today.",Archives,,Archives,,"['Vietnam', 'Vietnam', 'Vietnam']"
Saigon Translates Drive Into ‘Ultimate Victory’,1970-05-02,https://www.nytimes.com/1970/05/02/archives/saigon-translates-drive-into-ultimate-victory.html,article,"WASHINGTON, May 1—A Pentagon spokesman said to day that the allied offensive into the Fishhook area of Cambodia hes been named. “Operation Ultimate Victory” by Saigon's field command ers. He said that other opera tions under the name “Ulti mate Victory”—also trans lated as “Total Victory” or “Complete Victory—had been conducted by the South Vietnamese in recen weeks.",Archives,,Archives,,['Vietnam']
Behind the President's Decision,1970-05-02,https://www.nytimes.com/1970/05/02/archives/behind-the-presidents-decision-a-jolt-in-april-seems-to-have-erased.html,article,News Analysis,Archives,By Max Frankel Special to The New York Times,Archives,,"['Vietnam', 'Vietnam']"
Big Rallies Are Planned,1970-05-02,https://www.nytimes.com/1970/05/02/archives/big-rallies-are-planned-students-protest-nixon-troop-move-meeting.html,article,"The national antiwar move ment, drained of vigor in recent months, seemed yesterday to have found a new rallying point and an Impetus to renewed pro test in President Nixon's an nouncement of direct interven tion in Cambodia by United States troops.",Archives,By Linda Charlton,Archives,,"['Vietnam', 'Vietnam', 'Vietnam', 'Vietnam']"
Ex‐President in Chicago,1970-05-02,https://www.nytimes.com/1970/05/02/archives/expresident-in-chicago-johnson-calls-for-support-of-nixon.html,article,"CHICAGO, May 1—Former President Lyndon B. Johnson appealed to all Americans to night to support President Nix on in the Southeast Asian crisis.",Archives,By J. Anthony Lukas Special to The New York Times,Archives,,['Vietnam']
"Cry, the Beloved Country",1970-05-02,https://www.nytimes.com/1970/05/02/archives/cry-the-beloved-country-without-consultation-resort-to-violence.html,article,"LONDON, May 1—American students are told that they must respect institutions. Their Pres ident deplores “mindless at tacks on all the great institu tions which have been created by free civilizations.”",Archives,By Anthony Lewis,Archives,,['Vietnam']
Topics: How to Get Out of Vietnam — By 1789,1970-05-02,https://www.nytimes.com/1970/05/02/archives/topics-how-to-get-out-of-vietnamby-1789-chinese-advisers-lessons-of.html,article,"There is not much point in suggesting now how we might have avoided getting bogged down in Vietnam. But in view of the embarrassment about getting out, perhaps the awareness that another country —apart from the emasculated French empire—has solved the problem can lessen the un thinkability of prompt with drawal.",Archives,By Eric Widmer,Archives,,['Vietnam']
Europe Surprised and Worried by Move,1970-05-02,https://www.nytimes.com/1970/05/02/archives/europe-surprised-and-worried-by-move.html,article,"LONDON, May 1—Surprise and concern were the dominant reactions in Europe today to the American military move into Cambodia.",Archives,,Archives,,['Vietnam']
ALLIES DRIVE AHEAD IN CAMBODIA; NIXON AGREES TO DISCUSS DECISION WITH 4 COMMITTEES OF CONGRESS,1970-05-02,https://www.nytimes.com/1970/05/02/archives/allies-drive-ahead-in-cambodia-nixon-agrees-to-discuss-decision.html,article,"LANDING ZONE X‐RAY, Cambodia, May 1—A huge al lied task force including, 5,000 American infantrymen swept into Cambodia today and formed an arc around the sus pected headquarters of the Vietnamese Communist forces.",Archives,By Terence Smith Special to The New York Times,Archives,,"['Vietnam', 'Vietnam']"
Excerpts From Mansfield Speech on War,1970-05-02,https://www.nytimes.com/1970/05/02/archives/excerpts-from-mansfield-speech-on-war.html,article,"WASHINGTON, May 1— Following are excerpts from a speech opposing United States action in Cambodia, delivered in the Senate today by Mike Mansfield of Mon tana, the majority leader:",Archives,,Archives,,['Vietnam']
PNOMPENH GIVEN NO PRIOR NOTICE,1970-05-02,https://www.nytimes.com/1970/05/02/archives/pnompenh-given-no-prior-notice-lon-nol-calls-drive-breach-asserts.html,article,"PNOMPENH, Cambodia, May 1 — Premier Lon Nol said today that Cambodia had not been consulted in advance about the American and South Vietnamese military operations on her territory.",Archives,By Henry Kamm Special to The New York Times,Archives,,"['Vietnam', 'Vietnam']"
"Curtain‐Raisers, 1970",1970-05-02,https://www.nytimes.com/1970/05/02/archives/curtainraisers-1970.html,article,"The primary season is upon us, focusing today on the kind of fierce internal feud that makes the Demo cratic party of Texas even more suicidal if possible than its counterpart in New York. Ralph W. Yar borough, a dove on Vietnam and one of the few Southern Senators unable to detect Supreme Court qualities in Judge. Carswell, is being challenged by highly conservative ex‐Congressman. Lloyd Bentsen, now a Texas banker and businessman, has the political support of former Governor John Connally and the financial support of the state's oil industry.",Archives,,Archives,,[]
Nixon Puts ‘Bums’ Label On Some College Radicals,1970-05-02,https://www.nytimes.com/1970/05/02/archives/nixon-puts-bums-label-on-some-college-radicals-nixon-denounces-bums.html,article,"WASHINGTON, May 1— President Nixon referred today to some campus radicals who violently oppose his Vietnam policies as “bums” and, in con trast, he said American soldiers were “the greatest.”",Archives,By Juan de Onis Special to The New York Times,Archives,,"['Vietnam', 'Vietnam', 'Vietnam', 'Vietnam']"
Russians Drop Princeton Talks As Anti‐Nixon Protests Erupt,1970-05-02,https://www.nytimes.com/1970/05/02/archives/russians-drop-princeton-talks-as-antinixon-protests-erupt.html,article,"PRINCETON, N. J., May 1— An academic delegation of Russians canceled public panel discussions here today, admit ting nervousness that they might be accused of fomenting the protest and strike move ment that broke out at Prince ton University after President Nixon's speech on Cambodia.",Archives,By Peter Grose Special to The New York Times,Archives,,['Vietnam']
3 Red Nations Won't Attend Asian Meeting on Cambodia,1970-05-02,https://www.nytimes.com/1970/05/02/archives/3-red-nations-wont-attend-asian-meeting-on-cambodia.html,article,"JAKARTA, Indonesia, May 1 —North Vietnam, North Korea and Communist China have of ficially declined nvitations by the Indonesian Government to attend a two‐day conference of Asian and Pacific nations on Cambodia in Jakarta on May 16 and 17.",Archives,,Archives,,[]
Military Planners View Nixon Decision as Sound,1970-05-02,https://www.nytimes.com/1970/05/02/archives/military-planners-view-nixon-decision-as-sound-political-risk-is.html,article,"WASHINGTON, May 1—Sen ior military planners today viewed President Nixon's de cision to assault major sanc tuaries in Cambodia as strate gically important and tactically sound.",Archives,By William Beecher Special to The New York Times,Archives,,"['Vietnam', 'Vietnam']"
NASSER WARNS U.S. ON AID FOR ISRAEL,1970-05-02,https://www.nytimes.com/1970/05/02/archives/nasser-warns-us-on-aid-for-israel-declares-delivery-of-planes-would.html,article,"CAIRO, May 1—President Gamal Abdel Nasser cautioned President Nixon tonight to re frain from delivering more air craft to Israel, warning that such a move would have “dan gerous consequences” to Unit ed States interests in the Arab world for decades to come.",Archives,By Raymond H. Anderson Special to The New York Times,Archives,,"['Vietnam', 'Vietnam']"
... Political Derring‐Do,1970-05-02,https://www.nytimes.com/1970/05/02/archives/-political-derringdo.html,article,"President Nixon's televised explanation of why American troops are crossing the Cambodian border included a long peroration on history, morality and patriotism.",Archives,,Archives,,"['Vietnam', 'Vietnam', 'Vietnam']"
U.S. Action Linked To Drives by Foe,1970-05-02,https://www.nytimes.com/1970/05/02/archives/us-action-linked-to-drives-by-foe-us-action-linked-to-foes-new.html,article,"WASHINGTON, May 1 — White House sources offered an expanded account today of President Nixon's decision to send American troops into Cambodia, asserting that it was based almost entirely on esti mates of dangerous enemy, activity in recent days.",Archives,By Robert B. Semple Jr. Special to The New York Times,Archives,,"['Vietnam', 'Vietnam', 'Vietnam']"
Puzzled by Nixon View,1970-05-02,https://www.nytimes.com/1970/05/02/archives/puzzled-by-nixon-view.html,article,"GODAUHA, South Vietnam, May 1—Experienced observers both in and outside the Ameri can armed forces are voicing puzzlement over President Nix on's statement last night that American troops near the Cam bodian border have been en dangered by action of enemy troops in Cambodia within the last 10 days.",Archives,,Archives,,"['Vietnam', 'Vietnam']"
Editorial Comments on Move in Cambodia,1970-05-02,https://www.nytimes.com/1970/05/02/archives/editorial-comments-on-move-in-cambodia-middle-atlantic-middle-west.html,article,Following were editorial com ments yesterday on President Nixon's announcement Thurs day night that he was sending United States combat troops into Cambodia for the first time to drive Communists from stag inz zones:,Archives,,Archives,,"['Vietnam', 'Vietnam', 'Vietnam']"
Reds at Paris Talks Denounce U.S. ‘Aggression’ in Cambodia,1970-05-02,https://www.nytimes.com/1970/05/02/archives/reds-at-paris-talks-denounce-us-aggression-in-cambodia-escalation.html,article,"PARIS, May 1—North Viet nam and the Vietcong reacted angrily here today to “the open and impudent American aggres sion” in Cambodia and ap pealed for support of American public opinion and of foreign governments to stay the hand of the “warlike and perfidious” Nixon Administration.",Archives,By Henry Giniger Special to The New York Times,Archives,,"['Vietnam', 'Vietnam', 'Vietnam', 'Vietnam', 'Vietnam']"
A Meeting on War Moves Asked by Fulbright Group,1970-05-02,https://www.nytimes.com/1970/05/02/archives/a-meeting-on-war-moves-asked-by-fulbright-group-nixon-agrees-to-see.html,article,"WASHINGTON, May 1—The Senate Foreign Relations Com mittee, moving with intended restraint to challenge the Ad ministration's policy on Cam bodia, took the unusual step today of requesting a confer ence with President Nixon to discuss the American military involvement there.",Archives,By John W. Finney Special to The New York Times,Archives,,"['Vietnam', 'Vietnam', 'Vietnam']"
Allies in Asia Pleased; Others Critical,1970-05-02,https://www.nytimes.com/1970/05/02/archives/allies-in-asia-pleased-others-critical.html,article,"HONG KONG, May 1—Presi dent Nixon's decision to send American forces into Cambodia was approved today by the United States' Asian allies but encountered varying degrees of criticism in other Asian coun tries.",Archives,By Tillman Durdin Special to The New York Times,Archives,,"['Vietnam', 'Vietnam', 'Vietnam', 'Vietnam']"
NIXON MOVE SCORED BY U.S. COMMUNISTS,1970-05-03,https://www.nytimes.com/1970/05/03/archives/nixon-move-scored-by-us-communists.html,article,The Communist party of the United States accused President Nixon yesterday of violating the Constitution and of defying the “expressed will of the American people” in ordering combat troops into Cambodia. ,Archives,,Archives,,['Vietnam']
Allied Search in Cambodia Yields Few Sign's of Foe,1970-05-03,https://www.nytimes.com/1970/05/03/archives/allied-search-in-cambodia-yields-few-signs-of-foe-push-in-cambodia.html,article,"SAIGON, South Vietnam, Sunday, May 3—United States and South Vietnamese soldiers have begun a painstaking search of the Fishhook area of Cam bodia amid increasing indica tions that many enemy troops fled in advance of the allied forces' arrival. ",Archives,By Terence Smite Special to The New York Times,Archives,,"['Vietnam', 'Vietnam']"
Washington: ‘The Heart of the Trouble’,1970-05-03,https://www.nytimes.com/1970/05/03/archives/washington-the-heart-of-the-trouble.html,article,"WASHINGTON, May 2—In announcing his decision to ex pand the Indochina war, Presi dent Nixon said he was going “to the heart of the trouble,” and if you accept this as true, it is easy to approve his deci sion. But is it true?",Archives,By James Reston,Archives,,"['Vietnam', 'Vietnam']"
‘Public Nuisance’—Six Years,1970-05-03,https://www.nytimes.com/1970/05/03/archives/public-nuisance-six-years.html,article,"In South Carolina and elsewhere, criminals have been known to receive six years or less for man slaughter. State Circuit Court Judge E. Harry Agnew, in sentencing three owners of a coffeehouse catering to off‐duty soldiers from Fort Jackson, gave them six years for maintaining a “public nuisance.” This was not simply judicial overkill; it was a vindictive sen tence against peaceful antiwar dissent.",Archives,,Archives,,['Vietnam']
Mudge Considering Action To Void Chicago 7 Verdict,1970-05-03,https://www.nytimes.com/1970/05/03/archives/judge-considering-action-to-void-chicago-7-verdict.html,article,"CHICAGO, May 2 (UPI)— United States District Court Judge Julius J. Hoffman has taken under advisement a mo tion by Chicago 7 defense at torneys requesting acquittal for the five convicted defendants in the riot conspiracy trial be cause of published reports by one of the jurors. ",Archives,,Archives,,['Vietnam']
COLUMBIA AGREES TO HALT CLASSES,1970-05-03,https://www.nytimes.com/1970/05/03/archives/columbia-agrees-to-halt-classes-one-day-action-tomorrow-will.html,article,Columbia University agreed yesterday to a one‐day mora torium on classes tomorrow to protest President Nixon's deci sion to send American troops into Cambodia. ,Archives,,Archives,,['Vietnam']
Beer Cans in Cambodia: A Sign G.I.'s Are There,1970-05-03,https://www.nytimes.com/1970/05/03/archives/beer-cans-in-cambodia-a-sign-gis-are-there.html,article,"PREY TATHOEK, Cambodia, May 1—“I'd like to see the look on Fulbright's face right now,” said a rotund Ameri can lieutenant colonel as he stuck a plug of chewing to bacco into his right jowl. “This is really something, ain't it?” ",Archives,By James P. Sterba Special to The New York Times,Archives,,"['Vietnam', 'Vietnam', 'Vietnam']"
The Necessity of Restraint,1970-05-03,https://www.nytimes.com/1970/05/03/archives/the-necessity-of-restraint.html,article,"While the search for ways to curb the nuclear arms race proceeded with agonizing deliberateness Vienna last week, the two major powers took actions in two sensitive trouble areas of the world that peri lously breached barriers of self‐restraint that have served as a vital safeguard against nuclear war.",Archives,,Archives,,"['Vietnam', 'Vietnam']"
128 U.S. PLANES CARRY OUT ATTACK IN NORTH VIETNAM; SUPPLY LINES ARE TARGETS,1970-05-03,https://www.nytimes.com/1970/05/03/archives/128-us-planes-carry-out-attack-in-north-vietnam-supply-lines-are.html,article,"WASHINGTON, May 2 —The United States has carried out a heavy bombing raid against supply dumps and other targets north of the demilitarized zone in North Vietnam, well‐placed Administration sources said to day. ",Archives,By William Beecher Special to The New York Times,Archives,,"['Vietnam', 'Vietnam', 'Vietnam', 'Vietnam', 'Vietnam', 'Vietnam']"
In The Nation: Further Into the Quagmire,1970-05-03,https://www.nytimes.com/1970/05/03/archives/in-the-nation-further-into-the-quagmire.html,article,WASHINGTON—The invasion of Cambodia ordered by Presi dent Nixon makes it clear that he does not have and never has had a “plan to end the war.” For this is another of those escalations of the South east Asian war that in every previous case had to be extend ed further than expected and still accomplished nothing.,Archives,By Tom Wicker,Archives,,"['Vietnam', 'Vietnam']"
2 Airmen List Antiwar Unit As Insurance Beneficiary,1970-05-03,https://www.nytimes.com/1970/05/03/archives/2-airmen-list-antiwar-unit-as-insurance-beneficiary.html,article,"CHICOPEE, Mass., May 2 (AP) —Two airmen at Westover Air Force Base say they have lamed the Vietnam Moratorium Committee as beneficiary of their $10,000 G.I. life insurance policies. ",Archives,,Archives,,['Vietnam']
Senators Shocked by Resumption of Raids in North,1970-05-03,https://www.nytimes.com/1970/05/03/archives/senators-shocked-by-resumption-of-raids-in-north.html,article,"WASHINGTON, May 2—Two Democratic leaders in the Sen ate deplored today the newly disclosed bombing of North Vietnam as a step that could enjarge the war and compro mise plans for withdrawal of American troops. ",Archives,By John W. Finney Special to The New York Times,Archives,,"['Vietnam', 'Vietnam', 'Vietnam', 'Vietnam', 'Vietnam', 'Vietnam']"
