headline,date,web_url,doc_type,lead_paragraph,material_type,author,section,subsection,keywords
U.S. Denies Combat Role,1971-02-13,https://www.nytimes.com/1971/02/13/archives/us-denies-combat-role.html,article,"KEY BISCAYNE, Fla., Feb. 12—The White House insisted again today that “there are no United States combat” forces or advisers committed” to the South Vietnamese operation in Laos.",Archives,,Archives,,"['Vietnam', 'Vietnam']"
Massachusetts Official Files Suit Against War,1971-02-13,https://www.nytimes.com/1971/02/13/archives/massachusetts-official-files-suit-against-war.html,article,"BOSTON, Feb. 12 (UPI)— State Attorney General Robert Quinn filed suit in United States District Court today on behalf of 12 Massachusetts soldiers challenging the con stitutional authority of De fense Secretary Melvin R. Laird to send them to fight in Southeast Asia. ",Archives,,Archives,,['Vietnam']
Ziegler Denies Threat to China,1971-02-13,https://www.nytimes.com/1971/02/13/archives/ziegler-denies-threat-to-china.html,article,"KEY BISCAYNE, Fla., Feb. 12 — Ronald L. Ziegler, the White House press secretary, said here today that the Nixon Administration did not believe that the Souh Vienamese ef fort to cut the Ho Chi Minh Trail network would provoke Chinese Communists into cross ing the Laotian border in force. ",Archives,,Archives,,['Vietnam']
COMA TARGET OF LAOS PROTEST,1971-02-13,https://www.nytimes.com/1971/02/13/archives/columbia-target-of-laos-protest-3-offices-wrecked-student-and-3.html,article,Three offices in Columbia's School of International Affairs were wrecked and a student and three policemen were in jured yesterday after a meet ing held to protest the incur sion into Laos. One student was arrested. ,Archives,By Richard Severo,Archives,,['Vietnam']
Copier Commander Robert F. Molinelli,1971-02-13,https://www.nytimes.com/1971/02/13/archives/copter-commander-robert-f-molinelli.html,article,Man in the News,Archives,By Ralph Blumenthal Special to The New York Times,Archives,,['Vietnam']
Hanoi Says U.S. Marines Are Set for DMZ Landing,1971-02-14,https://www.nytimes.com/1971/02/14/archives/hanoi-says-us-marines-are-set-for-dmz-landing.html,article,"HANOI, North Vietnam, Feb. 13 (Agence France Presse)—North Vietnam to day called on all its regions to prepare for an American military landing along the demilitarized zone. ",Archives,,Archives,,['Vietnam']
NEW ANTI‐U.S. RIOTING ERUPTS AT QUINHON,1971-02-14,https://www.nytimes.com/1971/02/14/archives/new-antius-rioting-erupts-at-quinhon.html,article,"SAIGON, South Vietnam, Feb. 13 (AP) — Anti‐American riot ing broke out in the coastal city of Quinhon again today. Rioters threw stones and set fire to American vehicles and a building before the South Vietnamese national police dis persed them with tear gas. ",Archives,,Archives,,['Vietnam']
Berlin Protest on Laos Held,1971-02-14,https://www.nytimes.com/1971/02/14/archives/berlin-protest-on-laos-held.html,article,"BERLIN, Feb. 13 (Reuters)— Several thousand young left wing demonstrators marched through West. Berlin streets here today, protesting against the drive into Laos and calling for the immediate withdrawal of all United States troops from Indochina. ",Archives,,Archives,,['Vietnam']
South Vietnamese Drive Into Laos Put at 14 Miles,1971-02-14,https://www.nytimes.com/1971/02/14/archives/south-vietnamese-drive-into-laos-put-at-14-miles-field-report-puts.html,article,"KHESANH, South Vietnam, Feb. 13— South Vietnamese troops were reported today to have advanced about 14 miles into Laos in their six‐day‐old drive to cut the enemy supply network there. ",Archives,By Ralph Blumenthal Special to The New York Times,Archives,,"['Vietnam', 'Vietnam', 'Vietnam', 'Vietnam']"
Letters to the Editor,1971-02-14,https://www.nytimes.com/1971/02/14/archives/apollo-14s-primary-aim.html,article,To the Editor:,Archives,Edward S. Hermant,Archives,,['Vietnam']
Letters to the. Editor,1971-02-14,https://www.nytimes.com/1971/02/14/archives/campus-view-on-laos-repressed-outrage.html,article,To the Editor:,Archives,Guilford Dudley 3d,Archives,,['Vietnam']
Saigon Is Using Deserters as Coolies,1971-02-14,https://www.nytimes.com/1971/02/14/archives/saigon-is-using-deserters-as-coolies.html,article,"DONGHA, South Vietnam, Feb. 13—When Tran Nam and the other members of his unit crossed into Laos this week, they went as con victs under sentence. They carried no weapons. Nam was certain he would not return. ",Archives,,Archives,,['Vietnam']
OBSERVER,1971-02-14,https://www.nytimes.com/1971/02/14/archives/the-making-of-a-nice-distinction.html,article,"WASHINGTON, Feb. 13—Everyone seems agreed now that the invasion of Laos is not an invasion but an in cursion. The newspapers call it an incursion. Radio and television call it an incursion. The official voices of the United States Government call an incursion. ",Archives,By Russell Baker,Archives,,['Vietnam']
Letters to the Editor,1971-02-14,https://www.nytimes.com/1971/02/14/archives/letter-to-the-editor-3-no-title.html,article,To the Editor:,Archives,Richard J. Coughlin,Archives,,['Vietnam']
"On Ho Chi Minh Trail, Painted Traffic Signs",1971-02-14,https://www.nytimes.com/1971/02/14/archives/on-ho-chi-minh-trail-painted-traffic-signs.html,article,"KHESANH, South Vietnam, Feb. 13—The South Vietnamese opened for inspection today a mile‐long section of the Ho Chi Minh Trail network in Laos. It turned out to have painted traf fic signs, and a latticework roof covered with camouflaging veg etation. ",Archives,,Archives,,['Vietnam']
The Nation,1971-02-14,https://www.nytimes.com/1971/02/14/archives/fateful-decisions-may-hinge-on-enemys-reaction-attack-in-laos.html,article,"SAIGON—Thousands of South Vietnamese troops, lifted and supplied by American helicop ters, continued their slow push into Laos last week and the ab sence of enemy resistance on the ground left Allied command ers both relieved and apprehen sive. ",Archives,&#8212;Alvin Shuster,Archives,,[]
The Nation,1971-02-14,https://www.nytimes.com/1971/02/14/archives/the-critics-thus-far-seem-to-be-holding-their-fire-reaction-in-us.html,article,"WASHINGTON—Nine months ago, when American and South Vietnamese troops first swept across the border into Cambodia, the United States erupted in a paroxysm of anguish. By the end of the first week of the in vasion, its people were divided, its campuses closed, four young students were dead in Ohio and Kent State had become the ral lying cry for a generation. Twice in the course of that first week the President went directly to the people on television, once to explain his decision, a sec ond time to plead for a cooling of the rhetoric and time to prove the merits of what he had done. ",Archives,&#8212;Terence Smith,Archives,,[]
U.S. Copters Get Rain of Fire in Laos,1971-02-15,https://www.nytimes.com/1971/02/15/archives/us-copters-get-rain-of-fire-in-laos.html,article,"KHESANH, South Vietnam, Feb. 14—As 40 American‐piloted helicopters ferrying South Viet namese troops into Laos pre pared to set down in the jun gle, mortar shells began raining on the clearing. ",Archives,By Ralph Blumenthal Special to The New York Times,Archives,,['Vietnam']
AT HOME ABROAD,1971-02-15,https://www.nytimes.com/1971/02/15/archives/war-and-peace.html,article,"LONDON, Feb. 14—Through the Johnson and Nixon Administrations, American policy in Indochina has fo cused almost entirely on military force. American troops are slowly withdraw ing now, but the war goes on by other means: Vietnamization, expanded bombings, close air support by Amer ican planes over wider fronts. The offi cial talk is still of punishing the enemy; it is the familiar talk of vic tory. ",Archives,By Anthony Lewis,Archives,,['Vietnam']
Air War in Laos,1971-02-15,https://www.nytimes.com/1971/02/15/archives/air-war-in-laos.html,article,"Shortly before South Vietnamese troops invaded the Laotian panhandle backed by awesome American air power, a Laotian general in the area told a New York Times correspondent he did not want American aerial support. “Every time the Americans are called in bomb, they destroy friends and not enemies,” he said. ",Archives,,Archives,,"['Vietnam', 'Vietnam']"
News of War in Laos Comes in Bits,1971-02-15,https://www.nytimes.com/1971/02/15/archives/news-of-war-in-laos-comes-in-bits.html,article,"VIENTIANE, Laos, Feb. 14— The war in Laos is still an out of‐bounds, largely secret war. ",Archives,By Tillman Durdin Special to The New York Times,Archives,,"['Vietnam', 'Vietnam', 'Vietnam']"
"South Vietnamese Troops Reach Supply Trail in Laos, but Are Shelled by the Enemy",1971-02-15,https://www.nytimes.com/1971/02/15/archives/us-accidentally-bombs-laos-allies-at-cia-base-us-bombs-allies-near.html,article,"SAIGON, South Vietnam, Mon day, Feb. 15—An Air Force plane accidentally bombed “a friendly unit” yesterday morn ing near the United States‐sup ported base at Long Tieng in Laos, the military command here announced today. ",Archives,By Craig R. Whitney Special to The New York Times,Archives,,"['Vietnam', 'Vietnam']"
U. S. Bombers Strike Trail,1971-02-15,https://www.nytimes.com/1971/02/15/archives/u-s-bombers-strike-trail.html,article,"SAIGON, Feb. 14 (AP) — United States bombers roamed across the east‐west axis of the Ho Chi Minh trail in southern Laos today, the United States command said, attacking sus pected North Vietnamese moun tain outposts overlooking Route 9 on the approaches to the town of Tchepone. ",Archives,,Archives,,['Vietnam']
Peking Reports Rally Against Drive Into Laos,1971-02-15,https://www.nytimes.com/1971/02/15/archives/peking-reports-rally-against-drive-into-laos.html,article,"HONG KONG, Feb. 14—Sev eral hundred thousand people were reported to have attended a rally in Peking today to de nounce the allied move into Laos and pledge support for the Communist cause in Indo china. ",Archives,,Archives,,"['Vietnam', 'Vietnam']"
Hanoi Spurs Recruiting,1971-02-16,https://www.nytimes.com/1971/02/16/archives/hanoi-spurs-recruiting.html,article,"HONG KONG, Feb. 15 (Reu ters) — An army recruitment drive is under way in North Vietnam, the Hsinhua press agency reported today. Re cruitment slogans in Haiphong read. “Be prepared at all times to join the army, go wherever our fatherland needs us,” the agency reported. ",Archives,,Archives,,['Vietnam']
Aid Rushed to U.S.‐Backed Base In Laos Alter Foe's Penetration,1971-02-16,https://www.nytimes.com/1971/02/16/archives/aid-rushed-to-usbacked-base-in-laos-after-foes-penetration.html,article,"VIENTIANE, Laos, Feb. 15— Reinforcements and supplies were flown today to the Ameri can‐backed base at Long Tieng, which was penetrated yester day by North Vietnamese com mandos. ",Archives,,Archives,,[]
FOE'S TROOP FLOW IS REPORTED CUT BY DRIVE IN LAOS,1971-02-16,https://www.nytimes.com/1971/02/16/archives/foes-troop-flow-is-reported-cut-by-drive-in-laos-saigon-says-all.html,article,"SAIGON, South Vietnam, Tuesday, Feb. 16—Military offi cials asserted yesterday that the sweep westward into the Laotian mountains, where thousands of South Vienamese troops are trying to block the Ho Chi Minh Trail network, had already succeeded in cutting off the flow of enemy supplies and troops into the northernmost province of South Vietnam. ",Archives,By Craig R. Whitney Special to The New York Times,Archives,,"['Vietnam', 'Vietnam']"
THAIS ABANDONING HARD LINE ON REDS,1971-02-16,https://www.nytimes.com/1971/02/16/archives/thais-abandoning-hard-line-on-reds-still-seeking-safe-borders-they.html,article,"BANGKOK, Thailand, Feb. 15 — The American‐supported South Vietnamese incursion into Laos has been met here with official silence that is a measure of how far Thailand has come from the time when she was one of the most vocal supporters of a hard line against Communism in Asia. ",Archives,By Henry Kamm Special to The New York Times,Archives,,"['Vietnam', 'Vietnam', 'Vietnam']"
U.S. Colonel in Vietnam Convicted in Drug Case,1971-02-16,https://www.nytimes.com/1971/02/16/archives/us-colonel-in-vietnam-convicted-in-drug-case.html,article,"SAIGON, South Vietnam, Tuesday, Feb. 16 (AP)—Col. Gerald V. Kehrli of the United States Air Force was found guilty today of smok ing and possessing marijuana and of asking enlisted men in his squadron to obtain it for him. ",Archives,,Archives,,['Vietnam']
TRIAL OF CALLEY RESUMING TODAY,1971-02-16,https://www.nytimes.com/1971/02/16/archives/trial-of-calley-resuming-today-he-is-expected-to-take-the-stand.html,article,"FORT BENNING, Ga., Feb. 15 — The murder trial of first Lieut. William L. Calley Jr. enters its climactic phase to morrow with the resumption of the court‐martial of the 27‐ year‐old officer charged with the mass execution of unarmed South Vietnamese civilians dur ing the so called Mylai mas score. ",Archives,By Homer Bigart Special to The New York Times,Archives,,['Vietnam']
Unstarchy U.S. General in Vietnam,1971-02-16,https://www.nytimes.com/1971/02/16/archives/unstarchy-us-general-in-vietnam-john-gillespie-hill-jr.html,article,"KHESANH, South Vietnam, Feb.14—In the one‐room trail er near here occupied by Brig. Gen. John G. Hill Jr., the man in, charge of “protecting the people providing logistical support” for the South Viet namese drive into Laos, there Is only one small self‐indul gence: a coffeepot on a ",Archives,By Gloria Emerson Special to The New York Times,Archives,,['Vietnam']
Casualty Reports by U. S. Again Raise Skepticism,1971-02-16,https://www.nytimes.com/1971/02/16/archives/casualty-reports-by-us-again-raise-skepticism.html,article,"FIRE SUPPORT BASE VAN. DERGRIFT, South Vietnam, Feb. 14—An enemy rocket made a direct hit two nights ago on an American bunker at this ar tillery base on Route 9 between Khesanh and Quangtri. ",Archives,By Ralph Blumenthal Special to The New York Times,Archives,,"['Vietnam', 'Vietnam', 'Vietnam']"
"U.S. Strength in Vietnam Drops 2,100 to 332,900",1971-02-16,https://www.nytimes.com/1971/02/16/archives/us-strength-in-vietnam-drops-2100-to-332900.html,article,"SAIGON, South Vietnam, Feb. 15 (AP)—The United States command announced today that the number of American troops in South Vietnam dropped by 2,100 last week to 332,900 and that 1,555 more were being pre pared for withdrawal. ",Archives,,Archives,,['Vietnam']
Antiwar Troupe Formed to Tour Bases,1971-02-17,https://www.nytimes.com/1971/02/17/archives/antiwar-troupe-formed-to-tour-bases.html,article,"Jane Fonda, Mike Nichols and Elliott Gould are among a dozen well‐known entertainers who have formed a comedy troupe in the hope of touring military bases across the coun try with an antiwar stage show for “the forgotten soldiers.” ",Archives,By Lacey Fosburgh,Archives,,['Vietnam']
A Times Reporter in Vietnam Wins a Polk Award,1971-02-17,https://www.nytimes.com/1971/02/17/archives/a-times-reporter-in-vietnam-wins-a-polk-award-gloria-emerson-is-one.html,article,"Gloria Emerson, a member of the news staff of The New York Times, was among the winners of 12 categories of George Polk Memorial Awards announced yesterday by the Brooklyn Cen ter of Long Island University “for outstanding achievements in journalism during 1970.” ",Archives,,Archives,,[]
A Colonel Is Given 3‐Year Drag Term,1971-02-17,https://www.nytimes.com/1971/02/17/archives/a-colonel-is-given-3year-drug-term-colonel-is-given-3year-drug-term.html,article,"SAIGON, South Vietnam, Feb. 16—A United States Air Force colonel was sentenced today to three years in prison and was fined $15,000 for smoking marijuana, asking a sergeant in his squadron to get him some marijuana and giving some to four enlisted men. ",Archives,,Archives,,['Vietnam']
Medal of Honor Given To 12 Posthumously,1971-02-17,https://www.nytimes.com/1971/02/17/archives/medal-of-honor-given-to-12-posthumously.html,article,"WASHINGTON, Feb. 16 (UPI)—With President Nixon looking on, the Medal of Honor was presented today to the families of 12 men killed in Vietnam. ",Archives,,Archives,,['Vietnam']
"IMPEACH NIXON, G.O.P FOE URGES",1971-02-17,https://www.nytimes.com/1971/02/17/archives/impeach-nixon-gop-foe-urges-mccloskey-house-liberal-cites-illegal.html,article,"WASHINGTON, Feb. 16— Representative Paul N. McClos key Jr., Republican of Califor nia, said tonight that President Nixon should be threatened with impeachment as a means of changing the Administra tion's Vietnam policy. ",Archives,,Archives,,"['Vietnam', 'Vietnam']"
McGill Assails Class Disruption And Insists on ‘Right to Teach’,1971-02-17,https://www.nytimes.com/1971/02/17/archives/mcgill-assails-class-disruption-and-insists-on-right-to-teach.html,article,"Dr. William J. McGill, presi dent of Columbia University, has condemned the attempt by a group of militant students to disrupt class in political science last Friday afternoon. ",Archives,,Archives,,['Vietnam']
FOREIGN AFFAIRS,1971-02-17,https://www.nytimes.com/1971/02/17/archives/press-freedom-in-a-nonwar.html,article,"PARIS—The argument about the news embargo at the start of Laotian operations has become as ridiculous as it is bitter and distorted. What is wholly forgotten is the fact that Amer ican and other reporters in Indochina have been permitted to operate with a freedom, not to say abandon, that would have seemed paradisaical to their older colleagues of World War II. ",Archives,By C. L. Sulzberger,Archives,,"['Vietnam', 'Vietnam', 'Vietnam']"
American Legion Hears Nixon Plea For a Strong U.S.,1971-02-17,https://www.nytimes.com/1971/02/17/archives/american-legion-hears-nixon-plea-for-a-strong-us.html,article,"WASHINGTON, Feb. 16—Presi ??ent Nixon told several thou and members of the American ??egion tonight that the United States must remain as strong in peacetime as it has been in war ??ime in order to “maintain the ??eace.” ",Archives,,Archives,,"['Vietnam', 'Vietnam']"
Saigon Seeks to Shift Talks,1971-02-17,https://www.nytimes.com/1971/02/17/archives/saigon-seeks-to-shift-talks.html,article,"SAIGON, South Vietnam, Feb. 16 (Reuters)—South Vietnam will suggest at the Vietnam peace talks in Paris on Thurs day that the meetings be moved to Southeast Asia, Foreign Min ister Tran Van Lam said today. ",Archives,,Archives,,['Vietnam']
LAIRD EXPECTING ‘SOME TOUGH DAYS’ IN LAOS CAMPAIGN,1971-02-17,https://www.nytimes.com/1971/02/17/archives/laird-expecting-some-tough-days-in-laos-campaign-in-briefing-for.html,article,"WASHINGTON, Feb. 16— Secretary of Defense Melvin R. Laird advised President Nixon and members of the Cabinet today to expect “some tough days ahead” in the allied ef fort to cut the Ho CM Minh Trail supply line In southern Laos. ",Archives,By Terence Smith Special to The New York Times,Archives,,"['Vietnam', 'Vietnam']"
Air Force to Try 14 In Study of Misuse Of Mess Hall Funds,1971-02-17,https://www.nytimes.com/1971/02/17/archives/air-force-to-try-14-in-study-of-misuse-of-mess-hall-funds.html,article,"WASHINGTON, Feb. 16 (AP) —The Air Force announced to day that it would court‐martial two officers and 12 noncommis sioned officers charged with mishandling mess hall funds in Thailand. ",Archives,,Archives,,['Vietnam']
SAIGON LABOR CHIEF ASSAILS U.S. POLICY,1971-02-17,https://www.nytimes.com/1971/02/17/archives/saigon-labor-chief-assails-us-policy.html,article,"BAL HARBOUR, Fla., Feb. 16 —The head of the main federa tion of labor unions in South Vietnam said today that he feared that the United States and its allies were putting too much emphasis on winning militarily while leaving the Vietcong free to build up their political apparatus. ",Archives,,Archives,,"['Vietnam', 'Vietnam']"
Missile Sites in North Vietnam Attacked by U. S. 3d Day in Row,1971-02-17,https://www.nytimes.com/1971/02/17/archives/missile-sites-in-north-vietnam-attacked-by-us-3d-day-in-row.html,article,"SAIGON, South Vietnam, Wednesday, Feb. 17—American jets attacked missile sites in North Vietnam yesterday for the third successive day, the United States command an nounced today. ",Archives,By Ralph Blumenthal Special to The New York Times,Archives,,"['Vietnam', 'Vietnam', 'Vietnam']"
SANITY UNIT FINDS CALLEY ‘NORMAL’,1971-02-17,https://www.nytimes.com/1971/02/17/archives/sanity-unit-finds-calley-normal-army-panel-rules-on-officer-charged.html,article,"FORT KENNING, Ga., Feb. 16 —First Lieut. William L. Calley Jr., accused of murdering at least 102 unarmed Vietnamese civilians during the so‐called Mylai massacre, has been found “normal in every re spect” by an Army sanity board. ",Archives,By Homer Bigart Special to The New York Times,Archives,,['Vietnam']
Letters to the Editor,1971-02-17,https://www.nytimes.com/1971/02/17/archives/bomb-to-end-war.html,article,To the Editor:,Archives,Harlan G. Haskell 3d,Archives,,"['Vietnam', 'Vietnam']"
Vietnamese General and a G.I. Who Want to See Victory,1971-02-17,https://www.nytimes.com/1971/02/17/archives/vietnamese-general-and-a-gi-who-want-to-see-victory.html,article,"KHESANH, South Vietnam, Feb. 14—Brig. Gen. Pham Van Phu, commander of the First Infantry Division, which is among the forces pushing into southern Laos, and Specialist Charles Heffley of Brighton, Colo., have not met, although they work here a few hundred yards of each other.",Archives,By Gloria Emerson Special to The New York Times,Archives,,"['Vietnam', 'Vietnam']"
Defense Says Calley Regarded Victims as an Enemy,1971-02-18,https://www.nytimes.com/1971/02/18/archives/defense-says-calley-regarded-victims-as-an-enemy.html,article,"FORT KENNING, Ga., Feb. 17—The chief counsel to First Lieut. William L. Calley Jr. said today that the lieutenant did not feel he was killing “humans” when he ordered and participated in the execution of two groups of Vietnamese civilians at Mylai. ",Archives,By Homer Bigart Special to The New York Times,Archives,,['Vietnam']
KENNEDY ASSAILS VIETNAMIZATION,1971-02-18,https://www.nytimes.com/1971/02/18/archives/kennedy-assails-vietnamization-calls-it-policy-of-violence-that-led.html,article,"WASHINGTON, Feb. 17 (UPI) — Senator Edward M. Kennedy, said today the United States policy of Vietnamization was actually “a policy of violence” that has resulted in the “inva sion of Cambodia, the invasion of Laos.” ",Archives,,Archives,,"['Vietnam', 'Vietnam']"
Trial Reported Still Open The Washington Star,1971-02-18,https://www.nytimes.com/1971/02/18/archives/trial-reported-still-open.html,article,"VIENTIANE, Laos, Feb. 17— Informed sources said here to day that despite the South Vietnamese incursion, North Vietnam still retained the ca pability to move its men and supplies south through the Lao tian panhandle.",Archives,,Archives,,['Vietnam']
New Enemy Units in Laos,1971-02-18,https://www.nytimes.com/1971/02/18/archives/new-enemy-units-in-laos-said-to-peril-allied-drive-new-enemy-units.html,article,"SAIGON, South Vietnam, Feb. 17—High military sources reported today that two additional North Vietnamese regi ments had moved into new positions in southern Laos in what appeared to be a serious threat to advancing South Vietnamese troops.",Archives,By Alvin Shuster Special to The New York Times,Archives,,['Vietnam']
Transcript of the President's News Conference on Foreign and Domestic Matters,1971-02-18,https://www.nytimes.com/1971/02/18/archives/transcript-of-the-presidents-news-conference-on-foreign-and.html,article,"WASHINGTON, Feb. 17 — Following is a transcript of President Nixon's news conference today: ",Archives,,Archives,,"['Vietnam', 'Vietnam', 'Vietnam', 'Vietnam', 'Vietnam']"
Two Fire Bombs Hit Wall Of U.S. Embassy in Saigon,1971-02-18,https://www.nytimes.com/1971/02/18/archives/two-fire-bombs-hit-wall-of-us-embassy-in-saigon.html,article,"SAIGON, South Vietnam, Feb. 17—Young men threw two fire bombs outside the American Embassy this afternoon, and sped away on motorcycles. The incident caused little damage to the walls surrounding the heavily guarded embassy. Em bassy employes repainted the wall. ",Archives,,Archives,,['Vietnam']
200 Laos Civilians Wounded In Bombing Error Are Moved,1971-02-18,https://www.nytimes.com/1971/02/18/archives/200-laos-civilians-wounded-in-bombing-error-are-moved.html,article,"VIENTIANE, Laos, Feb. 17 (AP)—About 170 wounded civilians have been evacuated from Long Aieng to United States hospital at Van Son, reli able sources reported today. ",Archives,,Archives,,['Vietnam']
"At Border Crossing Into Laos, the Litter of Troops and History",1971-02-18,https://www.nytimes.com/1971/02/18/archives/at-border-crossing-into-laos-the-litter-of-troops-and-history.html,article,"ON ROUTE 9, near the Lao tian border, Feb. 15—Now there is only the garbage of war. Empty C‐ration cans of fruit cocktail and turkey loaf, an empty Pall Mall cigarette pack age, a single khaki sock and two mounds of sandbags are strewn about at the border crossing into Laos on Route 9. ",Archives,By Gloria Emerson Special to The New York Times,Archives,,['Vietnam']
U.S. JURY INDICTS 8 IN ARMY CLUB CASE,1971-02-18,https://www.nytimes.com/1971/02/18/archives/us-jury-indicts-8-in-army-club-case-exsergeant-major-charged-with.html,article,"WASHINGTON, Feb. 17—The Army's former top‐ranking en listed man and seven others were indicted today by a Fed eral grand jury on charges that they plotted to defraud non commissioned officers' clubs in Vietnam. ",Archives,By Warren Weaver Jr. Special to The New York Times,Archives,,"['Vietnam', 'Vietnam']"
