headline,date,web_url,doc_type,lead_paragraph,material_type,author,section,subsection,keywords
Incursion by Saigon Generates Only Scattered Protests in U.S.,1971-02-09,https://www.nytimes.com/1971/02/09/archives/incursion-by-saigon-generates-only-scattered-protests-in-us.html,article,"WASHINGTON, Feb. 8—The South Vietnamese incursion into Laos generated only scat tered protests around the na tion today, in marked contrast to outbursts last spring follow ing the move into Cambodia. ",Archives,,Archives,,['Vietnam']
Thant Deplores Operations,1971-02-09,https://www.nytimes.com/1971/02/09/archives/thant-deplores-operations.html,article,"UNITED NATIONS, N.Y. Feb. 8 (AP) — Secretary General Thant expressed fear today that operations in Laos by the North Vietnamese and now the South Vietnamese might be the death blow for the 1962 Geneva agreement. A statement issued by his office said: “The report ed incursion into Laos of South Vietnamese armed forces sup ported by the United States Air Force is one more deplorable episode in the long history of the barbarous war in Indo china.” ",Archives,,Archives,,"['Vietnam', 'Vietnam']"
"Along the Road to Laos: Noise, Dust, Confusion",1971-02-09,https://www.nytimes.com/1971/02/09/archives/along-the-road-to-laos-noise-dust-confusion.html,article,"BANHOUEKATANG, South Vietnam, Feb. 8—The artil lery fired over this little bor der crossing into Laos all night, and the young South Vietnamese Rangers who climbed aboard their boxy ar mored personel carriers to invade Laos this morning said they had not been able to sleep well. ",Archives,By Iver Peterson Special to The New York Times,Archives,,['Vietnam']
"‘Understandable,’ Britain Says",1971-02-09,https://www.nytimes.com/1971/02/09/archives/understandable-britain-says.html,article,"LONDON, Feb. 8 (UPI)—Brit ain today termed the South Viet namese action in Laos “fully understandable.” A Foreign Office spokesman said that the British Government was in con stant touch with the South Vietnamese and United States Governments on the situation in Southeast Asia. ",Archives,,Archives,,"['Vietnam', 'Vietnam']"
Chronology of U.S. Involvement in Laos,1971-02-09,https://www.nytimes.com/1971/02/09/archives/chronology-of-us-involvement-in-laos.html,article,"WASHINGTON, Feb. R—Fol lowing is a chronology of events and decisions that marked the increasing United States in volvement in Laos: ",Archives,,Archives,,"['Vietnam', 'Vietnam']"
Fighting Near Plain,1971-02-10,https://www.nytimes.com/1971/02/10/archives/fighting-near-plain.html,article,"VIENTIANE, Laos, Feb. 9 (UPI) — North Vietnamese troops and Pathet Lao guerrillas have opened attacks against Government positions around ong Tieng, Laotian military pokesmen said today. ",Archives,,Archives,,[]
"Rain, Fog and Mud Slow Drive Into Laos",1971-02-10,https://www.nytimes.com/1971/02/10/archives/rain-fog-and-mud-slow-drive-into-laos.html,article,"QUANGTRI. South Vietnam, Wednesday, Feb. 10—Heavy rains and dense fog fell un expectedly over the South Viet ramose drive against enemy sup ply trails in Laos yesterday, virtually halting United States helicopter supply flights and other air support. ",Archives,By Iver Peterson Special to The New York Times,Archives,,['Vietnam']
Letters to the Editor,1971-02-10,https://www.nytimes.com/1971/02/10/archives/error-in-indochina.html,article,To the Editor:,Archives,Richard M. Brett,Archives,,"['Vietnam', 'Vietnam']"
"Laird and Rogers, Explaining Drive, Seem to Modify G.I Withdrawal Plan",1971-02-10,https://www.nytimes.com/1971/02/10/archives/laird-and-rogers-explaining-drive-seem-to-modify-gi-withdrawal-plan.html,article,"WASHINGTON, Feb. 9—The Secretary of State and the Secretary of Defense went to Capitol Hill today with the message that the incursion into Laos would insure American troop withdrawals from Viet nam and shorten the war. ",Archives,By John W. Finney Special to The New York Times,Archives,,"['Vietnam', 'Vietnam', 'Vietnam']"
WASHINGTON,1971-02-10,https://www.nytimes.com/1971/02/10/archives/the-forgotten-lesson.html,article,"WASHINGTON, Feb. 9—In this latest crisis in the. Indochina war, when we are being told once more that the latest adventure into Laos will surely put an end to the long agony, it may be pru dent to look back at the record. ",Archives,By James Reston,Archives,,"['Vietnam', 'Vietnam']"
North Vietnam Election Set,1971-02-10,https://www.nytimes.com/1971/02/10/archives/north-vietnam-election-set.html,article,"HANOI. North Vietnam, Feb. (Agence France‐Presse)—North Vietnam will hold its first legis lative elections since 1964 on April 11, an official statement said today. The country will elect 420 members of National Assembly. The voting age in North Vietnam is 18. ",Archives,,Archives,,['Vietnam']
The Marines Stand Fast,1971-02-10,https://www.nytimes.com/1971/02/10/archives/the-marines-stand-fast-the-new-breed-aids-vietnamization-and-free.html,article,"WASHINGTON— Marines are facing new challenges. Transition is the key word, undiminished professionalism is the standard. For the marines and for the Corps, the commandant set a minimum requirement lean, tough, professional, disciplined, fully combat ready. In spite of troop withdrawals that have reduced the Marine Corps commitment from a 1968 high of 86,730 to the present strength of 24,800, the marines' pacification and Vietnamization efforts continue. ",Archives,By Lewis W. Walt,Archives,,['Vietnam']
Reds Said to Buy Laotian Rice,1971-02-10,https://www.nytimes.com/1971/02/10/archives/reds-said-to-buy-laotian-rice.html,article,"VIENTIANE, Laos, Feb. 9— Well‐informed American sources here say that the South Vietnamese incursion into the Ho Chi Minh Trail area in the northern sector of the Laos panhandle will not cut the North Vietnamese off from food supplies. ",Archives,,Archives,,"['Vietnam', 'Vietnam']"
Laos Incursion Is Given Vietnamese Code Name,1971-02-10,https://www.nytimes.com/1971/02/10/archives/laos-incursion-is-given-vietnamese-code-name.html,article,"Operation Dewey Canyon II, the United States com mand announced in Saigon yesterday, is no more. The command has adopted the South Vietnamese designa tion, Lam Son 719. ",Archives,,Archives,,"['Vietnam', 'Vietnam']"
Soviet Gives No Sign. It Will Act on Laos,1971-02-10,https://www.nytimes.com/1971/02/10/archives/soviet-gives-no-sign-it-will-act-on-laos.html,article,"MOSCOW, Feb. 9—The So viet Union continued to de nounce the United States today for the allied incursion into Laos but gave no sign that it would take any action to bol ster the Communist cause in Indochina. ",Archives,,Archives,,"['Vietnam', 'Vietnam']"
U.S. AIDES BELIEVE THRUST MAY COST FOE YEAR OR MORE,1971-02-10,https://www.nytimes.com/1971/02/10/archives/us-aides-believe-thrust-may-cost-foe-year-or-more-aims-of-laos.html,article,"WASHINGTON, Feb. 9—Ad ministration planners asserted privately today that the allied military incursion into Laos could buy a year or possibly two during which it would be extremely hard for North Viet nam to mount an effective of fensive of any size in either South Vietnam or Cambodia. ",Archives,By William Beecher Special to The New York Times,Archives,,"['Vietnam', 'Vietnam']"
Laotians to Explain Views,1971-02-10,https://www.nytimes.com/1971/02/10/archives/laotians-to-explain-views.html,article,"VIENTIANE, Laos, Feb. 9— Laotian missions abroad acted today on a worldwide basis to explain Laotian objections to the advance begun yesterday by South Vietnamese troops, with United States air support, against North Vietnamese trans port routes and bases along the Ho Chi Minh Trail in Laos. ",Archives,By Tillman Durdin Special to The New York Times,Archives,,"['Vietnam', 'Vietnam']"
Hanoi Warns Allies,1971-02-10,https://www.nytimes.com/1971/02/10/archives/hanoi-warns-allies.html,article,"HANOI, North Vietnam, Feb. 9 (Agence France‐Presse)—The North Vietnamese press and radio warned the United States and South Vietnam today that the “liberated zone of Laos” would be “the tomb of the Americans and their agents.” ",Archives,,Archives,,"['Vietnam', 'Vietnam']"
Britain Ready to Consult,1971-02-10,https://www.nytimes.com/1971/02/10/archives/britain-ready-to-consult.html,article,"LONDON, Feb. 9 (AP)— Foreign Secretary Sir Alec Douglas‐Home today expressed Britain's readiness to consult with China and the Soviet Union on ways of negotiating an Indochina peace settlement. ",Archives,,Archives,,['Vietnam']
Road Damage Reported,1971-02-10,https://www.nytimes.com/1971/02/10/archives/road-damage-reported.html,article,"SAIGON, South Vietnam, Wednesday, Feb. 10 (AP)— South Vietnamese troops and tanks, pressing west in south ern Laos yesterday, were re ported slowed both by bad weather and by the craters gouged in the road by United States bombers.",Archives,,Archives,,['Vietnam']
Protest Rallies and Marches Set For Today on Drive Into Laos,1971-02-10,https://www.nytimes.com/1971/02/10/archives/protest-rallies-and-marches-set-for-today-on-drive-into-laos.html,article,"Protest rallies and marches by students opposed to the drive into Laos are scheduled for today in various places across the country, but indi cations are that they may be more subdued those those over Cambodia last spring. ",Archives,,Archives,,['Vietnam']
Ky Asserts an Invasion Of North Is Way to Win,1971-02-10,https://www.nytimes.com/1971/02/10/archives/ky-asserts-an-invasion-of-north-is-way-to-win.html,article,"SAIGON, South Vietnam, Feb. 9 (Agence France Presse)—Vice President Ngu yen Cao Ky has warned against treating the” South Vietnamese operation in Laos as a game of double or noth ing and has suggested that the best way to make sure of winning is to invade North Vietnam. ",Archives,,Archives,,"['Vietnam', 'Vietnam']"
G.I.'s Report Fighting,1971-02-11,https://www.nytimes.com/1971/02/11/archives/gis-report-fighting.html,article,"KHESANH, South Vietnam, Feb. 10 (UPI) — Some United States soldiers belonging to Troop D, Seventh Battalion, 17th Air Cavalry, said here today that 100 or more Amer ican ground troops had been in Laos during the last three days and had fought the Com munists, but United States spokesmen denied that any American ground forces were in Laos. ",Archives,,Archives,,['Vietnam']
Troops Frisky as They Entered Laos,1971-02-11,https://www.nytimes.com/1971/02/11/archives/troops-frisky-as-they-entered-laos.html,article,"Th following account was given by Nguyen Ngoc Luong, a Vietnamese part time correspondent of The New York Times who ac companied South Vietnamese troops into Laos.",Archives,,Archives,,"['Vietnam', 'Vietnam']"
Laotian General Said to Ask for Reinforcements,1971-02-11,https://www.nytimes.com/1971/02/11/archives/laotian-general-said-to-ask-for-reinforcements.html,article,"VIENTIANE, Laos, Feb. 10— Concern increased here today over the situation at Sam Thong and Long Tieng, the two im portant Governrinent positions southwest of Plaine des Janes that have come under inereas ing pressure from North Viet namese and Laotian Communist forces. ",Archives,,Archives,,['Vietnam']
ADAMANCY BY FOE IN PARIS EXPECTED,1971-02-11,https://www.nytimes.com/1971/02/11/archives/adamancy-by-foe-in-paris-expected-us-doubts-any-progress-in-vietnam.html,article,"PARIS, Feb. 10—Any possi bility of serious negotiation at the Vietnam peace talks has apparently been written off for the next few months by the United States. ",Archives,By Henry Giniger Special to The New York Times,Archives,,"['Vietnam', 'Vietnam']"
Rogers Says U.S. Supports An Indochina Peace Parley,1971-02-11,https://www.nytimes.com/1971/02/11/archives/rogers-says-us-supports-an-indochina-peace-parley.html,article,"WASHINGTON, Feb. 10— Secretary of State William P. Rogers said today that the United States would give its unqualified support to “any kind of conference, in any for mat” that would bring peace to Indochina. ",Archives,By Terence Smith Special to The New York Times,Archives,,"['Vietnam', 'Vietnam', 'Vietnam']"
Incursion Into Laos Fails to Overcome the Torpor of Vientiane,1971-02-11,https://www.nytimes.com/1971/02/11/archives/incursion-into-laos-fails-to-overcome-the-torpor-of-vientiane.html,article,"VIENTIANE, Laos, Feb. 10 —Torpor runs high in Vien tiane, the most lively town in Laos, on any day, so it is difficult to tell that today is Makhabouxa, a major Bud dist feast and public holiday. But to those interested in official activities it became plain by midmorning that Government offices, instead of opening late, were not opening at all. ",Archives,By Henry Kamm Special to The New York Times,Archives,,['Vietnam']
THOUSANDS IN U.S. PROTEST ON LAOS,1971-02-11,https://www.nytimes.com/1971/02/11/archives/thousands-in-us-protest-on-laos-students-march-in-several-cities.html,article,"About 2,000 persons demon strated here last evening against the Laos incursion and about 3.000 marched on the Boston Common. ",Archives,By Martin Arnold,Archives,,['Vietnam']
Airstrip Being Rebuilt,1971-02-11,https://www.nytimes.com/1971/02/11/archives/airstrip-being-rebuilt.html,article,"SAIGON, Feb. 10 (AP)— South Vietnamese sources re ported that after the task force reached Tchepone today engi neers began rebuilding the town's abandoned dirt airstrip, which will enable the South Vietnamese to fly in supplies and reinforcements. ",Archives,,Archives,,['Vietnam']
4 Photographers Missing as Copter Is Downed in Laos,1971-02-11,https://www.nytimes.com/1971/02/11/archives/4-photographers-missing-as-copter-is-downed-in-laos-4-photographers.html,article,A helicopter carrying sev eral news photographers was shot down yesterday in Laos. There was no indica tion of survivors.,Archives,,Archives,,['Vietnam']
KY PREDICTS STAY IN LAOS TILL MAY AND FUTURE DRIVE,1971-02-11,https://www.nytimes.com/1971/02/11/archives/ky-predicts-stay-in-laos-till-may-and-future-drive-expects-pullback.html,article,"SAIGON, South Vietnam, Feb. 10 — Vice President Nguyen Cao Ky said today that South Vietnamese forces would probably remain in Laos until the dry season ends in May and predicted that they would go in again next year. ",Archives,By Alvin Shuster Special to The New York Times,Archives,,"['Vietnam', 'Vietnam', 'Vietnam']"
SENATE GETS CURB ON USE OF TROOPS,1971-02-11,https://www.nytimes.com/1971/02/11/archives/senate-gets-curb-on-use-of-troops-javits-bill-seems-assured-of.html,article,"WASHINGTON, Feb. 10—A new effort to impose legislative restrictions on the war‐making powers of the President began in the Senate today amid indi cations that there is conserva tive support for it in Congress. ",Archives,By John W. Finney Special to The New York Times,Archives,,"['Vietnam', 'Vietnam']"
U.S. Copter Pilots Taking Some of Worst Fire of War,1971-02-12,https://www.nytimes.com/1971/02/12/archives/us-copter-pilots-taking-some-of-worst-fire-of-war.html,article,"KHESANH, South Vietnam, Feb. 11—“I've been flying for six months, took my first hit yesterday, and since then I've taken 13,” said Maj. Burt Al len of Obion, Tenn., as he brought his bullet‐pierced heli copter in for a safe ??ding here today. ",Archives,By Ralph Blumenthal Special to The New York Times,Archives,,['Vietnam']
12 Jailed and Student Shot In Stanford Clash on War,1971-02-12,https://www.nytimes.com/1971/02/12/archives/12-jailed-and-student-shot-in-stanford-clash-on-war.html,article,"PALO ALTO, Calif., Feb. 11 —A high school student was shot, three other persons were injured and at least 12 were arrested last night as several hundred radicals protesting Stanford University's involve ment in the Southeast Asian war clashed with the police. ",Archives,,Archives,,['Vietnam']
DAVID KENNEDY GETS SAIGON ASSIGNMENT,1971-02-12,https://www.nytimes.com/1971/02/12/archives/david-kennedy-gets-saigon-assignment.html,article,"WASHINGTON, Feb. 11 (Reu ters)—David M. Kennedy, for mer Secretary of the Treasury, was assigned by President Nixon today to help South Vietnam repair its war‐ravaged economy and to plan for peace full development when the Indo china conflict ends. ",Archives,,Archives,,[]
DRIVE TO CRASH SITE IN LAOS IS DOUBTED,1971-02-12,https://www.nytimes.com/1971/02/12/archives/drive-to-crash-site-in-laos-is-doubted.html,article,"QUANG TRI, South Vietnam, Feb. 11 (AP) — It appeared doubtful today that troops could reach the site of a heli copter shot down in southern Laos with four press photogra phers aboard. ",Archives,,Archives,,[]
Letters to the Editor,1971-02-12,https://www.nytimes.com/1971/02/12/archives/letter-to-the-editor-2-no-title.html,article,To the Editor:,Archives,Paul Bixler,Archives,,['Vietnam']
U. S. Reconnaissance in Laos,1971-02-12,https://www.nytimes.com/1971/02/12/archives/u-s-reconnaissance-in-laos.html,article,"SAIGON, South Vietnam, Feb. 11 (AP)—Official sources said today that United States recon naissance teams were operating inside Laos—but only in an intelligence‐gathering role—and that there were no American ground combat troops in that country.",Archives,,Archives,,"['Vietnam', 'Vietnam']"
Letters to the Editor,1971-02-12,https://www.nytimes.com/1971/02/12/archives/letter-to-the-editor-3-no-title.html,article,To the Editor:,Archives,Harry F. V. Edward,Archives,,['Vietnam']
AMERICAN TROOPS REPORTED IN LAOS,1971-02-12,https://www.nytimes.com/1971/02/12/archives/american-troops-reported-in-laos-said-to-wear-uniforms-of-saigon-us.html,article,"Reports broadcast by the American Broadcasting Com pany and the Columbia Broad casting System yesterday said that American ground troops were taking part in the South Vietnamese incursion into southern Laos, some in South Vietnamese uniforms. ",Archives,,Archives,,"['Vietnam', 'Vietnam']"
Letters to the Editor,1971-02-12,https://www.nytimes.com/1971/02/12/archives/war-in-indochina.html,article,To the Editor:,Archives,Doris R. Marston,Archives,,['Vietnam']
3 G.I.'S INDICTED IN CAMP BOMBING,1971-02-12,https://www.nytimes.com/1971/02/12/archives/3-gis-indicted-in-camp-bombing-accused-of-july-explosions-at.html,article,"MADISON, Wis., Feb. 11 — A Federal grand jury indicted today three Army enlisted men, one o them a Vietnam War veteran, on charges or stealing explosives and blowing up telephone exchange, an electric substation and a water works at Camp McCoy, Wis., last July. ",Archives,,Archives,,[]
Operation in Cambodia,1971-02-12,https://www.nytimes.com/1971/02/12/archives/operation-in-cambodia.html,article,SAIGON. Feb. 11 (AP) — South Vietnamese military headquarters reported today that its troops operating in eastern Camboiia had killed 164 enemy soldiers in six engage ments. ,Archives,,Archives,,[]
24 U.S. Combat Deaths Reported in Last Week,1971-02-12,https://www.nytimes.com/1971/02/12/archives/24-us-combat-deaths-reported-in-last-week.html,article,"SAIGON, South Vietnam, Feb. 11 (UPI)—United States headquarters said today that 24 Americans were killed in battle in Vietnam last week, the lowest seven‐day toll this year. But South Vietnamese combat deaths increased sharply. ",Archives,,Archives,,[]
Communists at Paris Talks Say 10 U.S. Battalions Fight in Laos,1971-02-12,https://www.nytimes.com/1971/02/12/archives/communists-at-paris-talks-say-10-us-battalions-fight-in-laos.html,article,"PARIS, Feb. 11—Communist representatives at the Vietnam peace talks said today that 10 American battalions were en gaged in ground combat in Laos and named the divisions the units came from—the Fifth Mechanized, the 101st Airborne and the Americal. But the American spokesman, Stephen Ledogar, accusing the Com munists of “heaping exaggera tions upon lies,” said, “That's all nonsense.” ",Archives,,Archives,,"['Vietnam', 'Vietnam']"
Resistance Termed Light As Laos Drive Continues,1971-02-12,https://www.nytimes.com/1971/02/12/archives/resistance-termed-light-as-laos-drive-continues-resistance-reported.html,article,"SAIGON, South Vietnam, Friday, Feb. 12—South Vietnam ese forces were reported push ing deeper into Laos today in the fifth day of their drive against enemy supply trails and bases. But it was said they had not yet encountered the kind of ground resistance that was ex pected when the push began on Monday. ",Archives,By Iver Peterson Special to The New York Times,Archives,,['Vietnam']
Letters to the Editor,1971-02-12,https://www.nytimes.com/1971/02/12/archives/letter-to-the-editor-4-no-title.html,article,To the Editor:,Archives,Charles O'Nell,Archives,,['Vietnam']
Hanoi Accuses U.S.,1971-02-12,https://www.nytimes.com/1971/02/12/archives/hanoi-accuses-us.html,article,"HANOI, North Vietnam, Feb. 11 (Agence France‐Presse) — The Foreign Ministry charged today that American warships invaded North Vietnamese ter ritorial waters off Quangbinh Province in southern North Vietnam last night and shelled fishing vessels and junks, kill ing a number of persons and wounding others. ",Archives,,Archives,,"['Vietnam', 'Vietnam']"
Protest by Pathet Lao,1971-02-13,https://www.nytimes.com/1971/02/13/archives/protest-by-pathet-lao.html,article,"TOKYO, Feb. 12 (AP) — Prince Souphanouvong, head of the Pathet Lao, the Commu nist‐led Laotian rebels, has ur gently asked the cochairmen of the Geneva Conference to stop what he called an aggressive operation in Laos by United States and South Vietnamese troops. ",Archives,,Archives,,['Vietnam']
Big Gap at the Briefings on Laos,1971-02-13,https://www.nytimes.com/1971/02/13/archives/big-gap-at-the-briefings-on-laos-copters-have-busy-day-but-the.html,article,News Analysis,Archives,By Craig R. Whitney Special to The New York Times,Archives,,"['Vietnam', 'Vietnam']"
A.B.C. Report Is Denied,1971-02-13,https://www.nytimes.com/1971/02/13/archives/abc-report-is-denied.html,article,"SAIGON, South Vietnam, Feb. 12 (AP)—The United States Command issued a state ment today denying a report by the American Broadcasting Company indicating that Amer ican advisers were operating with South Vietnamese air borner units in Laos.",Archives,,Archives,,"['Vietnam', 'Vietnam']"
SAILOR IS FREED IN LOYALTY CASE,1971-02-13,https://www.nytimes.com/1971/02/13/archives/sailor-is-freed-in-loyalty-case-conviction-over-an-antiwar.html,article,"WASHINGTON, Feb. 12 (UPI) — The United States Navy Court of Military Review has reversed the court‐martial conviction of Seaman Roger L. Priest of Houston on charges of promoting disloyalty in the armed fortes by publication of an antiwar newsletter. ",Archives,,Archives,,['Vietnam']
Laos Declares Emergency As Red Pressure Mounts,1971-02-13,https://www.nytimes.com/1971/02/13/archives/laos-declares-emergency-as-red-pressure-mounts-laotians-decree.html,article,"VIENTIANE, Laos, Feb. 12— Laos declared a state of emer gency today and transferred in ternal security matters from the police to military officers. A Government statement said that the change had been made because of “recent develop ments in the military situation.” ",Archives,By Tillman Durbin Special to The New York Times,Archives,,"['Vietnam', 'Vietnam']"
Bayh Supports 18‐Year‐Old Vote in All Elections,1971-02-13,https://www.nytimes.com/1971/02/13/archives/bayh-supports-18yearold-vote-in-all-elections-cites-costs-and.html,article,"WASHINGTON. Feb. 12— Senator Birch Bayh, sounding like a man with his eye on the 1972 national campaign, grasped the initiative today in the cam paign to lower the voting age to 18 an all elections. ",Archives,By James M. Naughton Special to The New York Times,Archives,,['Vietnam']
RED CHINA WARNS ON MOVE IN LAOS,1971-02-13,https://www.nytimes.com/1971/02/13/archives/red-china-warns-on-move-in-laos-says-it-will-act-to-aid-all.html,article,"HONG KONG, Saturday, Feb. 13—Communist China declared yesterday that it “will not re main indifferent” to the recent incursion into Laos by “large numbers of U.S. and puppet forces.” ",Archives,,Archives,,['Vietnam']
Polish Note Deplores U.S. Intervention in Laos,1971-02-13,https://www.nytimes.com/1971/02/13/archives/polish-note-deplores-us-intervention-in-laos.html,article,"WARSAW, Feb. 12 — The Polish Government moved to day as a member of the In ternational Control Commission for Laos to seek an end to American military intervention there. ",Archives,By James Feron Special to The New York Times,Archives,,['Vietnam']
AT HOME ABROAD,1971-02-13,https://www.nytimes.com/1971/02/13/archives/oh-what-a-lovely-war.html,article,"LONDON, Feb. 12—Stuart Hamp shire, the English philosopher, wrote recently of the impact of Freud's dem onstration that human behavior is gov erned less by conscious than by unconscious thoughts and feelings. It was a Copernican revelation for men who understood, he said; it destroyed the “comfortable feeling that we are easily in control of our own thoughts and purposes.” ",Archives,By Anthony Lewis,Archives,,['Vietnam']
U.S. Sees No Intervention,1971-02-13,https://www.nytimes.com/1971/02/13/archives/us-sees-no-intervention.html,article,"WASHINGTON, Feb. 12— United States officials said to day there were no indications that Communist China intended to intervene in the fighting in Laos. ",Archives,,Archives,,['Vietnam']
Letters to the Editor,1971-02-13,https://www.nytimes.com/1971/02/13/archives/military-justice.html,article,To the Editor:,Archives,Richard W. Vogel,Archives,,['Vietnam']
2 MORE COPIERS OF U.S. DOWNED IN DRIVE ON LAOS,1971-02-13,https://www.nytimes.com/1971/02/13/archives/2-more-copters-of-us-downed-in-drive-on-laos-total-of-14-officially.html,article,"QUANGTRI, South Vietnam, Saturday, Feb. 13—The United States command announced early today that intense enemy antiaircraft fire had brought down two more American helicopters supporting the South Vietnamese drive against Communist supply trails in Laos. ",Archives,,Archives,,"['Vietnam', 'Vietnam', 'Vietnam']"
